text,src_start,src_end,dst_start,dst_end
okay could you rename data/plzebt.txt as backup/ruonyefx.js please,22,37,41,59
hey rename new/dkoccc.csv as v2/owiqrku.docx for me,11,25,29,44
"can you rename file ""fps.docx"" into ""new/pyisxc.json"" for pine tree state",20,30,36,53
okay change filename from old/vxuvbu.png to tfwjid.log for me,26,40,44,54
"i want to rename axhzwvb.md to ""bsnzhhgg.txt"" please",17,27,31,45
update the gens of backup/wpx.jpg to odcgdcb.csv,19,33,37,48
rename old/skchuk.csv as ynqrkeo.py for pine tree state,7,21,25,35
please update the epithet of qgdrcqh.jpg to zjs.txt please,29,40,44,51
"hey could you rename ""pejeda.txt"" as tmp/yfhqmdg.csv please",21,33,37,52
"please update the name of rktalx.png to ""vcrlql.md"" now",26,36,40,51
please rename project/dulsjfal.pdf to logs/rqjquw.js please,14,34,38,52
"please variety ""gxwduonn.json"" to ""project/yeqyleiw.json"" now",15,30,34,57
"rename ""new/xhulc.jpg"" to ish.pdf now",7,22,26,33
okey rename file ndwdtijp.txt into project/gqrjmur.js for me,17,29,35,53
hey ace want to rename bkvadukj.pdf to mhbsqr.md please,23,35,39,48
"alteration ""data/dnzqwnmq.png"" to kyo.jpg for maine",11,30,34,41
". k. variety filename from tmp/emqyz.jpg to ""old/cplqxw.docx"" please",27,40,44,61
hey rename old/djta.py to upluq.txt please,11,22,26,35
"can you rename file ""project/fcbxygda.js"" into ""abzdcobn.jpg"" please",20,41,47,61
can you could you rename gvwodag.md as sqasdmpb.pdf,25,35,39,51
"please i want to rename ""exrkz.csv"" to old/auxzpfi.txt for me",24,35,39,54
"okay update the name of ""backup/sgivfk.docx"" to ydefrti.csv now",24,44,48,59
"can you modification akdscxk.py to ""rddxj.js"" for me",21,31,35,45
"can you rename ""pwiujsc.jpg"" as v1/lpmhfer.png",15,28,32,46
please could you rename kqpe.docx as logs/lrjuyp.md for maine,24,33,37,51
"change ""old/fxtu.log"" to ""jwgme.jpg"" instantly",7,21,25,36
"hey change ""pcorepua.log"" to ""rbncv.js"" please",11,25,29,39
"okay could you rename ""v2/ceukiqqw.jpg"" as v1/ref.csv now",22,39,43,53
"please rename ""pkzz.txt"" to ""backup/zoqjqb.pdf"" for me",14,24,28,47
hind you update the name of v2/mtudhxo.log to nhlfojni.jpg please,28,42,46,58
please update the name of rcufk.txt to vfafj.jpg for me,26,35,39,48
"please could you rename bbwo.png as ""shdwdpqr.pdf""",24,32,36,50
variety rtdo.png to lcnutwhh.png,8,16,20,32
"ok rename jkipwy.log to ""tmp/mdamyr.md"" please",10,20,24,39
please rename single file src/mneumxki.docx into v2/nafzs.csv,26,43,49,61
"give the axe you rename onyizlk.csv as ""grveng.json""",24,35,39,52
hey rename vvfls.py as src/gserfeju.js please,11,19,23,38
hey rename foz.js as jtb.log for maine,11,17,21,28
"rename file ""v1/srxlomr.csv"" into ""old/iqtzkyfc.csv"" please",12,28,34,52
please change zdwz.json to mzkmvvnz.js,14,23,27,38
"can you rename ""vhupm.csv"" to tjopilhf.png please",15,26,30,42
can you unity want to rename vqku.txt to new/qvythc.docx straight off,29,37,41,56
please rename tmp/mgm.log to v2/ifijxulz.png,14,25,29,44
canful you change logs/xdzzgg.js to xnbzuvn.log,18,32,36,47
"hey could you rename ""vjx.py"" as afejo.docx",21,29,33,43
hey rename file gguvcwem.py into src/nlxo.md please,16,27,33,44
"modification new/kgm.json to ""akskkzef.png"" for me",13,25,29,43
"can you rename ""data/nfevfoz.txt"" to backup/gixgz.jpg for maine",15,33,37,53
"i want to rename ""v1/hxtlrmdf.png"" to project/hkqv.json please",17,34,38,55
could you rename logs/ghjcjhs.txt as data/rwsykkz.jpg for maine,17,33,37,53
"hey rename esrkjz.jpg as ""data/cfa.jpg""",11,21,25,39
hey rename tmp/wtjtg.md to heicyu.jpg please,11,23,27,37
okay could you rename aqricmjp.csv as jhipzq.md now,22,34,38,47
"change v2/vfe.py to ""data/ahocyna.txt""",7,16,20,38
"please atomic number 53 lack to rename ""backup/zihzk.docx"" to eivvibgr.txt for pine tree state",39,58,62,74
hey i want to rename yndx.log to new/bho.jpg now,21,29,33,44
"please update the name of ""eswrx.csv"" to old/wuwqq.json please",26,37,41,55
please i wishing to rename tmp/ertrsnax.txt to jhkbbkg.json,27,43,47,59
can you rename file zbmhbzz.csv into liynie.png please,20,31,37,47
"okay alteration ""ysud.docx"" to ""backup/cohonh.log""",16,27,31,50
"okay update the name of ""new/zuptlje.py"" to qgxt.py please",24,40,44,51
can you could you rename data/jdeon.log as project/evgvi.csv,25,39,43,60
"okeh change ""logs/lsq.log"" to ""data/xndwsnl.js""",12,26,30,47
"hey rename ivgq.py to ""kufipkib.log"" now",11,18,22,36
"hey rename ""v2/mwza.txt"" to ""lcch.json"" please",11,24,28,39
hey rename uko.log as tmp/rmbyna.json now,11,18,22,37
hey variety filename from xijnirfp.json to project/icgbuhe.png please,26,39,43,62
hey variety pauvasb.txt to curruamq.jpg please,12,23,27,39
"hey rename file pvqff.json into ""project/ygk.md"" forthwith",16,26,32,48
"rename indian file szsh.log into ""rlgplynt.csv""",19,27,33,47
"please rename ""gsx.txt"" as v2/vuaphlka.pdf for me",14,23,27,42
please update the name of qsw.txt to backup/klnfdvmd.jpg please,26,33,37,56
"could you rename knrvlpoo.log as ""iwkza.docx""",17,29,33,45
"modification file name from new/pah.py to ""lyzq.docx"" for me",28,38,42,53
hey rename mlr.json to ueanhttp.log please,11,19,23,35
rename file cabinet ohdhmd.pdf into new/ovgtaa.jpg now,20,30,36,50
hey unity want to rename ysqnka.js to old/bzs.md please,25,34,38,48
can you update the name of mxlpuxg.docx to backup/nclygd.csv now,27,39,43,60
"hey update the gens of ""wemuak.py"" to data/vbwtigw.jpg directly",23,34,38,54
"can you rename ""uxhjdvo.md"" to ""bmm.docx"" please",15,27,31,41
hey variety yepjn.pdf to snthhz.json,12,21,25,36
hey rename file qagrum.md into cdjngk.png please,16,25,31,41
modification filename from bpi.pdf to src/mvp.log for me,27,34,38,49
okay rename dwszc.txt to src/fxy.pdf forthwith,12,21,25,36
"modification computer name from ""src/nwnzmnx.pdf"" to ""dvhokmtz.py"" please",32,49,53,66
please could you rename muacjbor.json as mhuis.txt please,24,37,41,50
"okay i want to rename ""tmp/lfnlfdr.log"" to mbxh.log",22,39,43,51
"update the name of gobymcdd.docx to ""logs/fnzvjwz.js"" straightaway",19,32,36,53
"can you update the name of ""bkxhwjf.py"" to new/spor.txt please",27,39,43,55
"rear end you rename ""old/nqlscwej.docx"" as ccsfiqit.png for me",20,39,43,55
hey could you rename taxw.png as gzo.log for me,21,29,33,40
hey update the name of v2/fkififuo.json to vplkjm.md directly,23,39,43,52
please rename ejxv.js as epeep.json for me,14,21,25,35
"please could you rename ""old/bnd.jpg"" as ""ydutvdo.py""",24,37,41,53
hey modification filename from v2/qvrgtdp.md to data/pbf.docx,31,44,48,61
"please rename miqtrr.md to ""zupbb.js""",14,23,27,37
"derriere you change file name from ffbich.json to ""v1/dfj.jpg"" please",35,46,50,62
"buns you alteration ""bbgja.log"" to old/lju.png now",20,31,35,46
change xnqkoq.csv to pwyuqkd.log now,7,17,21,32
give the axe you rename data/ibg.log to hgpvr.py please,24,36,40,48
update the public figure of project/gloars.py to old/uecn.txt,28,45,49,61
hey change nsqycr.md to xfp.png,11,20,24,31
"i want to rename ""omzmjhqj.py"" to v1/kfxvb.jpg straightaway",17,30,34,46
please number 53 want to rename vejiczjj.py to logs/aec.js please,32,43,47,58
"force out you change filename from ""sjwavtev.png"" to v2/sfvgcnta.py for me",35,49,53,67
ok update the name of bpr.json to old/oygodxr.txt immediately,22,30,34,49
"could you rename rbhkrkjj.js as ""old/ooouwsw.csv""",17,28,32,49
okay rename data/ltvuceu.md as project/kzs.log for me,12,27,31,46
okay change filename from logs/gmmrer.md to pqum.py,26,40,44,51
"please rename ""ybme.txt"" as logs/wtjp.log please",14,24,28,41
okay i privation to rename old/ihjbxyxt.jpg to yuqwbsgi.py for me,27,43,47,58
"update the name of ""src/arcn.png"" to v2/wmtzvoz.log please",19,33,37,51
please i want to rename ggsxbzpf.csv to logs/dojayd.json,24,36,40,56
okeh rename backup/eyetgg.py to backup/kidlahbo.docx please,12,28,32,52
sack you could you rename yvzzokii.csv as logs/yjenjg.pdf for maine,26,38,42,57
hey i want to rename project/redt.csv to rchz.md,21,37,41,48
"can you modification ""data/ihrlewge.txt"" to backup/cvfvlk.docx for me",21,40,44,62
please alteration file name from v2/gmz.md to cinpm.docx for maine,33,42,46,56
"change ifsqs.md to ""vlu.md""",7,15,19,27
"hey rename cassgn.jpg to ""rnpndrg.png"" for maine",11,21,25,38
can you modification filename from cycv.csv to tmp/taqzhk.md for me,35,43,47,60
"hey change filename from ""v1/rmfidog.pdf"" to xvzpuhit.log straight off",25,41,45,57
"rename v2/arp.csv as ""pjmjoi.png"" please",7,17,21,33
please rename eowcrd.jpg as nyz.py straightaway,14,24,28,34
"hey rename wwnxi.pdf as ""ylqytoqg.txt"" for maine",11,20,24,38
"please update the name of ""rdjwii.csv"" to fzdb.png for me",26,38,42,50
"okay rename logs/nda.pdf to ""ltuiqq.csv"" please",12,24,28,40
"please modification ""qtyhc.log"" to old/wom.docx now",20,31,35,47
"please rename ""src/bmf.js"" to ""old/gih.docx"" like a shot",14,26,30,44
please change logs/duyeta.jpg to v2/dyj.txt for me,14,29,33,43
okay rename file hvhskyvv.log into vancbp.docx for me,17,29,35,46
okey rename file whonq.log into old/fsmmyid.txt now,17,26,32,47
"prat you i want to rename ""xes.jpg"" to ""v1/jyna.py""",26,35,39,51
"please update the name of ""backup/arptxn.jpg"" to backup/itq.log nowadays",26,45,49,63
"can you rename new/hpt.py as ""v1/lui.py""",15,25,29,40
i want to rename logs/ntab.json to lbjbpvri.csv,17,31,35,47
hey update the epithet of ydbsnsys.pdf to v2/gbjwst.jpg for me,26,38,42,55
okeh update the name of qwxnkhh.json to lhrx.png,24,36,40,48
"please could you rename ""khwx.csv"" as jbhqwnvd.txt please",24,34,38,50
"please rename uidgdvn.js to ""new/jnwj.log"" please",14,24,28,42
okay modification filename from wzqmm.log to v2/lihlqvr.jpg,32,41,45,59
alteration filename from v2/ohsyswv.pdf to old/ftqfnts.md now,25,39,43,57
okay update the name of vlij.py to zqpn.docx please,24,31,35,44
"please i lack to rename ""backup/briyaac.pdf"" to ""src/ooec.png"" now",24,44,48,62
can you i lack to rename old/drmcp.docx to knkdbtjd.jpg now,25,39,43,55
"okay alteration filename from ""trya.csv"" to ""mca.js""",30,40,44,52
ok rename new/ktpky.json to mnemedul.js please,10,24,28,39
"hey rename file tmp/lhz.png into ""backup/phheesk.log"" please",16,27,33,53
rename davuvraq.txt to buvvrjxd.pdf please,7,19,23,35
hey i want to rename mzlrii.csv to inzogefs.txt,21,31,35,47
"could you rename ""rhcgs.txt"" as bqlic.csv",17,28,32,41
can you change data/dcux.csv to old/iwnwdz.docx for me,15,28,32,47
"please rename data/kmwcqt.py to ""new/mpbzb.jpg"" for pine tree state",14,28,32,47
"change ""rxa.csv"" to bwxrjrs.pdf for pine tree state",7,16,20,31
"please 1 want to rename ""mnmkhp.md"" to ""logs/fkuqv.csv"" please",24,35,39,55
"hey rename ""project/sozyd.csv"" to ""puzkx.jpg""",11,30,34,45
"can you rename ""v1/rpmvkl.log"" as ""pgb.jpg"" now",15,30,34,43
okay change filename from flon.py to new/hwczt.docx please,26,33,37,51
"please rename new/ynklzmip.json to ""sxn.csv"" at",14,31,35,44
please change filename from data/jqogsk.csv to src/xicfvmeg.jpg directly,28,43,47,63
please rename backup/zuhh.pdf as v2/kmolv.docx now,14,29,33,46
"okay could you rename ""iycrg.docx"" as ykdyonrx.docx for me",22,34,38,51
"can you change filename from new/xju.py to ""jknqs.pdf"" for me",29,39,43,54
"please rename ""zsvyvm.txt"" as logs/rnlsobtw.csv now",14,26,30,47
"can you update the name of ""old/qthyfx.docx"" to ""project/jvg.log"" for me",27,44,48,65
"update the name of ""glyc.jpg"" to sthyo.docx please",19,29,33,43
"please rename bvjdefph.png as ""logs/plyiyjbj.csv"" now",14,26,30,49
hey change name from cbdxjeh.pdf to aqy.txt now,21,32,36,43
"okay rename file ""naeb.py"" into v2/ffoyq.js now",17,26,32,43
"update the name of ""eyvpkryb.jpg"" to fgue.js please",19,33,37,44
can you modification new/ult.md to wwpg.png please,21,31,35,43
rename kno.log to data/khcule.txt,7,14,18,33
"please rename file tfgkq.csv into ""zkariamu.js""",19,28,34,47
okay rename file v1/meojk.log into ikft.png now,17,29,35,43
"update the name of ""project/obekxftr.docx"" to kkztscf.pdf",19,42,46,57
"modification filename from ""new/pmztijkl.log"" to old/vcm.json for me",27,45,49,61
rename file pym.md into spxx.png at present,12,18,24,32
"update the name of ""zvinmgm.py"" to ""glid.js"" now",19,31,35,44
"rename ""data/dseak.pdf"" as yxvvryj.jpg please",7,23,27,38
"can you change vwtim.txt to ""sgevwaj.js""",15,24,28,40
"bathroom you modification mmyoqd.log to ""knfifiyz.js"" now",26,36,40,53
okay update the name of rblq.md to src/zxpgmg.log,24,31,35,49
"please change ""wtiyygyp.jpg"" to tmp/wcvuavz.jpg for me",14,28,32,47
"can you rename file jmjutof.json into ""ccoaf.csv""",20,32,38,49
"hey i want to rename ""yginae.csv"" to ""ndryl.js"" instantly",21,33,37,47
please i want to rename new/zckvv.md to ehhyvzk.docx please,24,36,40,52
"please rename ""hfzwaku.png"" to v2/lygdns.pdf",14,27,31,44
hey alteration svccbnoo.js to twdxw.jpg,15,26,30,39
okay could you rename new/gsj.py as ysosaq.jpg for me,22,32,36,46
"can you update the public figure of backup/lfdb.pdf to ""dplh.md"" please",36,51,55,64
"stern you rename ""fbijyacz.json"" as logs/dtb.py right away",17,32,36,47
"sack you modification aqy.py to ""tmp/heqlt.csv"" for me",22,28,32,47
hey 1 deprivation to rename project/cct.py to project/wpqzex.png directly,28,42,46,64
"hey rename file ""pzezhaun.js"" into old/npziezka.png",16,29,35,51
"okay rename ""zrs.md"" to src/ywj.pdf please",12,20,24,35
okeh change psde.txt to tskdc.jpg please,12,20,24,33
okay i want to rename ettkkj.py to nyklozcj.json,22,31,35,48
"ok rename ""project/ckibl.md"" as npd.js now",10,28,32,38
"hey rename single file ""new/qejnxlj.json"" into ""ithbrf.csv"" for me",23,41,47,59
update the public figure of data/pybz.png to src/elwz.json for pine tree state,28,41,45,58
"please rename file backup/jtoozg.png into ""v2/spshuhza.png"" directly",19,36,42,59
rename v1/pswbxdz.pdf as fpuepo.png please,7,21,25,35
"hey rename file ""upgpekk.py"" into cjqfkfy.docx please",16,28,34,46
"hey rename file cabinet ""kagxx.jpg"" into v1/sklejgd.png",24,35,41,55
change fpnifuo.csv to dfwfoqy.png,7,18,22,33
"alteration filename from ""ixzt.js"" to zycy.pdf please",25,34,38,46
ok rename qrhka.log to doknlk.txt,10,19,23,33
update the name of qrv.png to sqis.pdf for me,19,26,30,38
"please change filename from aehqhsr.txt to ""ino.txt"" now",28,39,43,52
okay could you rename juhlpzm.csv as lwhex.csv,22,33,37,46
"give the axe you rename ""mtca.txt"" as v1/xfed.png immediately",24,34,38,49
hey change filename from old/qtor.js to lyasv.csv,25,36,40,49
hey update the name of hru.pdf to laxt.log please,23,30,34,42
"please modification ""lzussecx.pdf"" to ""iofwz.jpg"" please",20,34,38,49
"please could you rename ""czxshsx.pdf"" as clcu.pdf for me",24,37,41,49
"okeh could you rename ""bplhaqpc.csv"" as ""aafhvw.png""",22,36,40,52
"please rename file hgwqd.png into ""cuzw.md"" for me",19,28,34,43
"hey rename ""mhzw.csv"" as old/vwuvf.json please",11,21,25,39
please could you rename logs/xxbzmse.md as sbhp.png now,24,39,43,51
rename file ixfblhi.log into qbuazr.txt now,12,23,29,39
"can you could you rename yehrsmro.md as ""zac.csv"" now",25,36,40,49
please rename exvvzzhs.md to tiha.docx today,14,25,29,38
"can you rename file ""v1/fkutbis.txt"" into v1/nni.json now",20,36,42,53
hey update the name of hykzx.jpg to logs/pty.png please,23,32,36,48
i want to rename kbuul.jpg to gskqupbb.pdf for me,17,26,30,42
"displace you change zqrt.png to ""vnefz.docx""",20,28,32,44
please rename cjnm.txt as v1/cwnb.json,14,22,26,38
"okay change filename from ""v2/bzaj.jpg"" to biror.py for maine",26,39,43,51
please rename file tmp/jfwn.json into qhitse.docx now,19,32,38,49
okeh rename mhevyrr.txt as gduz.json now,12,23,27,36
hey modification nsc.png to pjenaqwl.png for me,17,24,28,40
change filename from gtxdwfg.docx to khxikc.json straightaway,21,33,37,48
okay i want to rename xkpwx.docx to logs/fvobpspr.pdf please,22,32,36,53
"can you rename hex.pdf to ""v1/igdjyyx.json"" for me",15,22,26,43
"please change filename from kxx.js to ""src/rjjntr.log""",28,34,38,54
hey update the name of rnmpwui.js to nutl.pdf,23,33,37,45
john you could you rename gsfffxhp.log as old/sinajb.docx please,26,38,42,57
okay rename project/roy.md as gyjk.docx please,12,26,30,39
okay change gcnmv.json to new/wzzhj.jpg now,12,22,26,39
"hey i need to rename mpmlc.py to ""wkq.txt"" for me",21,29,33,42
"please update the gens of ""v1/ebv.json"" to iempq.docx please",26,39,43,53
update the gens of uawbst.docx to dace.docx now,19,30,34,43
rename buob.txt to dtlt.json please,7,15,19,28
"can you rename single file ""eiluz.md"" into tdqztx.js",27,37,43,52
"hey could you rename ""v2/gfqld.json"" as yrnz.csv now",21,36,40,48
hey change data/ypbfuv.md to wqph.md for me,11,25,29,36
send away you iodin want to rename gxruz.json to omp.md please,35,45,49,55
"can you could you rename ""tbwqnhw.json"" as v2/ccvj.py please",25,39,43,53
please i want to rename logs/zimb.txt to data/wmj.json,24,37,41,54
"hey change filename from ""lwdk.log"" to rqdxwngw.md now",25,35,39,50
"hey update the gens of ""txrqad.csv"" to ""otb.log"" please",23,35,39,48
"can you i need to rename qbzk.log to ""pdlbqx.jpg"" please",25,33,37,49
"update the name of logs/xrvenby.py to ""project/zvuag.png"" now",19,34,38,57
can you single want to rename npgfdy.png to hhop.json please,30,40,44,53
"ok change computer file name from v1/qal.txt to ""qtzx.txt"" instantly",34,44,48,58
hey rename rmrxpll.png to old/jiifi.jpg for maine,11,22,26,39
"hey change filename from dbuamm.py to ""vgfagqq.py"" please",25,34,38,50
"hey change filename from ""zung.md"" to ekl.md please",25,34,38,44
can you update the name of src/kvitlzed.txt to ubeppf.pdf now,27,43,47,57
hey i want to rename old/kgc.py to logs/fssihyl.jpg,21,31,35,51
change new/fycekbs.txt to rjobwgdm.pdf,7,22,26,38
"could you rename ""zylpig.png"" as rxf.log now",17,29,33,40
"i want to rename dgmcu.jpg to ""data/yuunnzux.md""",17,26,30,48
please rename file sydimnk.txt into logs/hdhzaofr.csv now,19,30,36,53
please iodine want to rename btbbcly.js to jjlzlmth.py,29,39,43,54
can you rename old/uiyiuker.pdf as src/nxeoug.log please,15,31,35,49
tail you variety filename from atgimpe.log to trvnlpu.log for me,31,42,46,57
"hey could you rename src/euxklszx.log as ""rogw.png"" please",21,37,41,51
hey atomic number 53 want to rename new/xoetaszg.js to cfsq.json now,36,51,55,64
"rename file tmp/kwesaah.md into ""ifnsne.pdf""",12,26,32,44
"hey update the name of ""peb.log"" to mflfxqoc.json",23,32,36,49
"could you rename imlam.docx as ""src/yiuqns.pdf"" now",17,27,31,47
can you rename file icje.png into bgan.md,20,28,34,41
okay single want to rename old/xjabctm.md to new/ebqwx.js please,27,41,45,57
"hey could you rename ""hvt.log"" as new/asf.png please",21,30,34,45
okay rename file wwrt.js into yefmjia.csv please,17,24,30,41
"i wish to rename project/tkcbllgr.jpg to ""gnwwqegf.docx"" now",17,37,41,56
can you modification computer file name from logs/knmliocr.py to new/ntmqdup.docx for me,45,61,65,81
hey could you rename v2/anmxn.csv as logs/kgqi.json,21,33,37,51
rename project/jftu.md as cimwlq.json,7,22,26,37
"please rename ""grbqlm.csv"" to wlh.txt now",14,26,30,37
"can you rename v1/rqehn.py as ""mlhzy.txt"" now",15,26,30,41
"please change efx.log to ""iiqltvlq.json"" for maine",14,21,25,40
"can you rename ""zfqfy.txt"" as bpkw.txt please",15,26,30,38
"rename ""ghaaqs.md"" to tmp/kmsu.docx for me",7,18,22,35
"please alteration filename from nnoyt.docx to ""mttttp.jpg"" now",32,42,46,58
"okay change filename from lckuh.md to ""old/qbha.py"" now",26,34,38,51
change dac.jpg to fkmyvres.js please,7,14,18,29
"hey unity want to rename ""bioeon.txt"" to ""v2/agrsy.md""",25,37,41,54
"can you rename indian file new/mawskvf.js into ""project/dvs.py"" now",27,41,47,63
rename wfregeym.png as v2/ykbc.json,7,19,23,35
please rename wdnwtats.png as prgkmgu.csv nowadays,14,26,30,41
can you rename file data/rybkrt.js into plemloc.md,20,34,40,50
"hey rename ""ubh.js"" as ""backup/gimrasge.png"" for maine",11,19,23,44
"okay rename ""ozlj.log"" to tmp/zzjo.png",12,22,26,38
"displace you modification filename from ""rswtwar.md"" to logs/wpuxnba.txt now",40,52,56,72
can you could you rename hqpsamy.png as rkiksvv.log now,25,36,40,51
hey change filename from qyy.jpg to src/ehilihrz.jpg,25,32,36,52
"please rename ""v1/uru.pdf"" as tefdj.log",14,26,30,39
"can you unity want to rename derd.md to ""new/dqfiuxds.json""",29,36,40,59
give notice you rename file new/dafa.docx into tth.js please,28,41,47,53
rename tmp/slkpbb.png to new/piqisg.js for me,7,21,25,38
variety filename from new/soynzjs.log to bvcclv.txt for me,22,37,41,51
"o.k. variety dfehjd.py to ""jpl.js"" please",13,22,26,34
can you alteration data/lxx.docx to teoc.log for me,19,32,36,44
"unity want to rename ""tmp/ulnyhf.md"" to trt.json for me",21,36,40,48
"please rename file ""arbgtopk.md"" into ""src/rxjts.py"" now",19,32,38,52
change filename from tiyz.json to pbhmbisd.log,21,30,34,46
could you rename rgi.pdf as project/deu.docx,17,24,28,44
"rename logs/ryudio.json to ""qxt.jpg"" for pine tree state",7,23,27,36
"could you rename ""qrzoioqt.jpg"" as v2/ehmawa.py please",17,31,35,47
"please update the name of ""v1/vijzu.pdf"" to ceqlfydw.md for me",26,40,44,55
please rename file v1/orm.csv into project/rtjlf.csv for maine,19,29,35,52
okay could you rename v1/sbejz.pdf as v2/lfmvix.csv for me,22,34,38,51
"hindquarters you alteration beracsru.js to ""fvkwkndb.log"" please",28,39,43,57
"can you update the name of odxkjfm.docx to ""uewm.txt"" like a shot",27,39,43,53
"please change filename from ""vxesh.js"" to logs/jbi.log for me",28,38,42,54
"okay change computer file name from tmp/guvusw.csv to ""njt.json"" now",36,50,54,64
please change lvtqvxc.json to project/pdungj.log,14,26,30,48
1 want to rename ooixg.js to urpnizub.docx for maine,17,25,29,42
"please rename splpew.log to ""wuv.py"" please",14,24,28,36
please change filename from data/eprozrea.csv to pyjj.jpg for me,28,45,49,57
change computer file name from blumlwp.docx to v2/usseparz.jpg now,31,43,47,62
rename yql.pdf as project/nxjqfcqn.md please,7,14,18,37
"hey rename file v2/xocmzc.log into ""kepygu.png""",16,29,35,47
hey rename oxk.txt to tmp/swkatxw.js now,11,18,22,36
"please rename file zicryq.png into ""qbvtvult.py""",19,29,35,48
"please could you rename ""tqkptra.py"" as data/xhysc.js now",24,36,40,53
"okay could you rename lhqlvqax.log as ""project/rmjzhmh.log"" please",22,34,38,59
rename project/oqumzq.png as tfxhuk.js,7,25,29,38
"hey update the name of jkp.csv to ""rtd.txt"" for me",23,30,34,43
"rename file v1/acfrenud.json into ""rwcgndxu.txt"" for maine",12,28,34,48
ok could you rename wfhlci.pdf as cfm.md,20,30,34,40
"okay could you rename xpcgwwiu.json as ""leb.pdf"" now",22,35,39,48
"can you rename ber.pdf to ""hixoant.jpg"" please",15,22,26,39
"please update the name of ""nraigwfg.log"" to urmtuwq.md for me",26,40,44,54
rename gnn.png to logs/ehwzjb.txt now,7,14,18,33
"okay rename ""qpltx.jpg"" as v1/cewefl.csv please",12,23,27,40
"hey could you rename ""tmp/syyhrm.csv"" as ""backup/txc.js"" for me",21,37,41,56
"hey rename file ""logs/tnu.png"" into tmp/mwwdhbi.pdf",16,30,36,51
please one need to rename nwb.csv to project/eqcitt.json,26,33,37,56
can you could you rename fvuxevqn.docx as xbdyx.csv please,25,38,42,51
"okay change filename from ""guxtr.jpg"" to ""frvvwn.jpg"" please",26,37,41,53
"ok rename ""wobqi.png"" to ""vulgks.json"" right away",10,21,25,38
"fire you alteration computer from old/unkzuz.log to ""ewmak.log""",34,48,52,63
"throne you update the name of new/lwvrm.md to ""maxbh.png"" please",30,42,46,57
hey i want to rename tnannh.py to vvhqvvz.png,21,30,34,45
"please rename file ""v1/wum.json"" into zehufx.docx for pine tree state",19,32,38,49
please rename jkt.csv to ysdwmcx.pdf now,14,21,25,36
"okay modification mnbb.jpg to ""old/tucuiiv.py"" for me",18,26,30,46
"rename ""flbc.json"" to v1/gxag.png please",7,18,22,33
"could you rename ""rerhflpo.txt"" as inpu.docx for me",17,31,35,44
hey alteration v1/xewh.json to backup/dforn.log today,15,27,31,47
can you change filename from logs/eyk.md to project/ogiuzt.py,29,40,44,61
can you change filename from ybezhrb.docx to iyrlr.csv,29,41,45,54
ok could you rename data/kkvctdw.pdf as src/uanvd.json please,20,36,40,54
force out you rename kkzfbi.md to cjg.jpg,21,30,34,41
"hey could you rename ""old/wald.txt"" as old/hmzat.pdf for me",21,35,39,52
"okay rename filing cabinet backup/cuycalv.csv into ""eupn.md"" for pine tree state",27,45,51,60
"can you could you rename ""kbkfwroj.docx"" as dshv.js please",25,40,44,51
"please rename nyaemn.log to ""backup/zger.txt"" at once",14,24,28,45
okay update the name of amaxk.pdf to htz.txt now,24,33,37,44
"hey change filename from kexttg.png to ""rvcmry.png"" for me",25,35,39,51
"hey rename file ""qfk.jpg"" into ""udkkmjx.png"" now",16,25,31,44
okay rename eikzwjzw.docx as pwfwm.csv,12,25,29,38
ok modification filename from nfsz.md to zbtebbi.log,30,37,41,52
"hey rename file qlqyr.js into ""kjnxd.js"" please",16,24,30,40
"rename ""eedb.js"" to lnmebvgq.csv for me",7,16,20,32
can you rename file etdu.py into ymfjisl.jpg,20,27,33,44
okay update the name of tmp/vzychzga.log to backup/cmnum.pdf please,24,40,44,60
"hey rename ""project/xdjhqs.py"" as uvz.log now",11,30,34,41
"could you rename ""mbf.jpg"" as old/qxgs.log immediately",17,26,30,42
please rename uxgodfv.pdf as tmp/gmxtdzh.txt for pine tree state,14,25,29,44
"change ""v1/cdfln.log"" to backup/dqksvsr.log",7,21,25,43
"can you rename src/qbvcxf.png to ""tkfoutq.csv""",15,29,33,46
"please update the name of ""ozuroop.jpg"" to spchy.js now",26,39,43,51
"hey change filename from ""tmp/bguw.docx"" to project/vnktxyh.docx for me",25,40,44,64
please modification file from logs/mpde.jpg to oay.md please,30,43,47,53
hey rename tlfmegq.md to nnxkejd.js please,11,21,25,35
change gsdvoytj.py to iadrnnow.docx for me,7,18,22,35
