text,src_start,src_end,dst_start,dst_end
change filename from xemftob.docx to v1/daokd.docx for me,21,33,37,50
"can you rename src/pznqvnne.log as ""logs/pssap.txt"" quickly",15,31,35,51
please rename src/ekqjfl.txt as v2/fnwchesj.txt now,14,28,32,47
okay update the name of kxussx.md to data/iuujmui.pdf quickly,24,33,37,53
well  change  filename  from  project/bgcsgopa.js  to  project/jngkl.log  now,30,49,55,72
"hey rename file logs/dpyn.json into ""logs/dixtg.log"" please",16,30,36,52
"please update the name of qwfmm.json to ""zgos.png"" quickly",26,36,40,50
can  you  could  you  rename  oycebkp.js  as  stlfwye.json  for  me,30,40,46,58
okay  rename  bgwodp.png  as  eryqt.csv  for  me,14,24,30,39
"well rename file tqxol.csv into ""hsyx.py"" now",17,26,32,41
update the name of logs/jgnp.docx to tkn.docx for me,19,33,37,45
"could you rename ""old/rsymzot.jpg"" as uiw.docx please",17,34,38,46
"Okay could you rename v1/vkgxhe.py as ""old/dxprmbca.py"" please",22,34,38,55
"so  i  want  to  rename  lintsmid.py  to  ""project/kmg.md""  now",25,36,42,58
well update the name of zfkvum.json to jpinslze.log quickly,24,35,39,51
"can you could you rename uuphcky.docx as ""gldidpxx.pdf""",25,37,41,55
"so  rename  ""slpikkal.docx""  as  yejxt.png",12,27,33,42
"change ""v2/svu.js"" to v2/julot.pdf for me",7,18,22,34
"hey change filename from ""vpzekzpn.json"" to data/tajvyrdg.json now",25,40,44,62
"okay change filename from ""data/hoslhc.pdf"" to v2/qsytsdip.log now",26,43,47,62
so rename logs/czpgqew.csv as rgfvj.js now,10,26,30,38
"well  rename  ""ycuvvlek.md""  as  wre.jpg  please",14,27,33,40
update the name of logs/rcvs.json to old/cwir.csv,19,33,37,49
please  rename  igxm.json  as  v1/sfut.docx  quickly,16,25,31,43
update  the  name  of  ezl.txt  to  lfyug.docx  now,23,30,36,46
change filename from data/tzleld.md to tmp/przfy.md for me,21,35,39,51
well change filename from backup/jzpqki.js to project/eiszx.js,26,42,46,62
well rename logs/yfujxl.py to uubwqfea.js now,12,26,30,41
update the name of tmp/scbzypi.csv to tmp/yvfk.md quickly,19,34,38,49
"so change ""logs/xzau.docx"" to aurr.log now",10,26,30,38
please rename v2/fxlm.log as kbskwf.md now,14,25,29,38
"So could you rename dibpovqa.png as ""czgtkq.js"" now",20,32,36,47
well  change  filename  from  logs/dyc.jpg  to  mjyy.log,30,42,48,56
could  you  rename  backup/lbwourpq.log  as  tmp/zqm.log  quickly,20,39,45,56
well rename file nmchww.png into v2/jqhphukl.docx now,17,27,33,49
"well update the name of ""qsw.json"" to ""v2/gfsfuo.log"" for me",24,34,38,53
update  the  name  of  tmp/yby.md  to  v2/asqw.docx,23,33,39,51
okay  change  filename  from  src/hwxqow.csv  to  enrgdsiy.csv  please,30,44,50,62
can you change filename from zkbsh.pdf to wzbitf.pdf now,29,38,42,52
please change filename from bax.docx to tmp/rlppwg.csv please,28,36,40,54
hey change qqmovtuz.log to old/bfrkt.docx,11,23,27,41
hey  rename  pdvygvne.png  to  v1/xkvegs.js  now,13,25,31,43
well update the name of v1/lpfyxa.js to src/skpyf.md,24,36,40,52
hey rename src/tlox.json as backup/sizmen.js quickly,11,24,28,44
"okay  change  ""pijhghv.jpg""  to  v1/cejfjiw.png  quickly",14,27,33,47
"well i want to rename old/blmisy.log to ""yijngzui.json"" for me",22,36,40,55
well update the name of dnrltooy.jpg to yel.csv,24,36,40,47
could you rename new/swnbi.md as ojcehl.log quickly,17,29,33,43
well rename cwtpezw.md to v1/rqcradl.csv,12,22,26,40
"so could you rename v1/yaymiw.png as ""ohfe.docx"" please",20,33,37,48
so change filename from vmf.js to nak.png,24,30,34,41
so i want to rename backup/ajgwop.docx to umu.md for me,20,38,42,48
"so could you rename ""rhoyzwlp.txt"" as gbzrwupc.png",20,34,38,50
So  could  you  rename  peotj.pdf  as  nmsussef.md  now,24,33,39,50
okay could you rename solmbxdf.md as v2/fabkwwu.md for me,22,33,37,50
okay update the name of jwgikc.md to tok.py,24,33,37,43
please  could  you  rename  lihg.js  as  tmp/rmmztw.pdf  please,28,35,41,55
so i want to rename yesldikj.md to logs/frphg.csv,20,31,35,49
okay rename beg.jpg to v2/bdgcipyb.pdf please,12,19,23,38
well change filename from fbdirftc.json to imke.log please,26,39,43,51
"can you rename file ""rtx.txt"" into ttdbm.jpg quickly",20,29,35,44
"so change rutx.jpg to ""v2/uzhwbq.png""",10,18,22,37
"hey  update  the  name  of  hjxkjoxy.js  to  ""ylplcfg.csv""  now",28,39,45,58
i want to rename backup/xwziszww.log to tmp/pkb.json quickly,17,36,40,52
"hey could you rename smfrrh.txt as ""wambrytv.pdf"" now",21,31,35,49
"please could you rename svufem.py as ""ymjkulu.jpg"" please",24,33,37,50
Hey update the name of ejk.md to tmp/ermbvkd.md,23,29,33,47
okay  rename  whzj.png  to  adontvt.txt  quickly,14,22,28,39
"can  you  change  filename  from  ""logs/zvzry.py""  to  ""v2/etgoofmd.py""",34,49,55,71
okay rename v1/yzlp.png as ypxmw.docx quickly,12,23,27,37
"okay  update  the  name  of  ""old/vhenj.json""  to  cacf.jpg  please",29,45,51,59
"okay change filename from naqi.log to ""vyifnbsc.txt"" now",26,34,38,52
"so rename file zuk.png into ""jwg.py""",15,22,28,36
hey change hwfs.csv to new/ddgsk.json please,11,19,23,37
"okay update the name of ""old/uasm.jpg"" to babh.jpg for me",24,38,42,50
okay i want to rename v1/hkfs.md to cqzd.js now,22,32,36,43
could you rename project/gusyu.js as backup/vfhez.md quickly,17,33,37,52
can you rename project/nlp.log as tmp/gjvuoimk.txt,15,30,34,50
"okay change v2/tmjup.csv to ""v1/wciagihf.jpg""",12,24,28,45
Well change filename from logs/erccohbh.png to backup/nlfymzu.jpg now,26,43,47,65
can you rename dqtrmz.png as sporr.log,15,25,29,38
"please rename ""bpa.md"" to tfx.csv now",14,22,26,33
"Change filename from ""fytnash.csv"" to ""jeke.docx"" for me",21,34,38,49
can you rename new/ubqoubpa.md as kwsovwpi.pdf please,15,30,34,46
"please change filename from ""src/hmcfmz.py"" to xltxff.pdf now",28,43,47,57
"well change filename from pbcg.pdf to ""umum.md"" now",26,34,38,47
can you i want to rename uzc.docx to wmqkcja.py,25,33,37,47
hey rename lrsdc.txt as project/okbdwruy.txt now,11,20,24,44
"rename ""new/madr.jpg"" to pfe.pdf for me",7,21,25,32
so rename file hgfrmucu.py into logs/sgs.png quickly,15,26,32,44
Hey update the name of azlgpoz.csv to backup/qervbdo.pdf please,23,34,38,56
can  you  i  want  to  rename  new/pvbju.jpg  to  ohhue.txt  please,31,44,50,59
hey rename kjvuz.js to old/fmbglzqe.js,11,19,23,38
"please update the name of ""tcglxcm.csv"" to ""v1/cbmd.jpg"" please",26,39,43,56
"okay rename ""data/gwucqhpj.docx"" as ykzgsgdi.png quickly",12,32,36,48
so rename iuadlrdh.pdf as dhoiaj.jpg,10,22,26,36
"can  you  change  filename  from  project/hle.txt  to  ""fhfc.txt""  for  me",34,49,55,65
please change src/ccpw.json to xhkols.js please,14,27,31,40
can  you  change  data/fcibxj.pdf  to  kefpo.pdf  please,18,33,39,48
please i want to rename viatuqbe.md to weirkbp.png now,24,35,39,50
please change dff.png to xqwvjdiz.png for me,14,21,25,37
"okay could you rename ""src/apmqtd.py"" as logs/agdtk.png please",22,37,41,55
"so  change  filename  from  qcrps.log  to  ""slfkioye.js""",28,37,43,56
rename file hyty.png into src/hicbvtvj.png,12,20,26,42
So i want to rename new/imln.csv to gktbvodc.csv,20,32,36,48
"please  update  the  name  of  ""qqcy.py""  to  ""phbhio.py""  now",31,40,46,57
"hey rename src/gfmdwpis.csv to ""htf.py"" now",11,27,31,39
please  i  want  to  rename  ary.md  to  gztf.log,29,35,41,49
update  the  name  of  javzpdt.jpg  to  vukckixv.py  quickly,23,34,40,51
"Hey rename file ""kgdfda.py"" into ""data/rgo.jpg"" now",16,27,33,47
"so rename qkq.png to ""fgdexs.jpg""",10,17,21,33
can you update the name of asoeb.png to mpdlbk.log quickly,27,36,40,50
"change  filename  from  bdsfuvy.jpg  to  ""data/rbxu.csv""  now",24,35,41,56
"okay rename ""jgavns.log"" as ""logs/zcy.json""",12,24,28,43
"okay  change  filename  from  kdfyng.json  to  ""eefgljf.jpg""  please",30,41,47,60
"please rename file tmp/radta.log into ""btbwr.pdf""",19,32,38,49
okay i want to rename dpjx.md to xuqynh.json,22,29,33,44
well rename file ylugvd.csv into vhcfzwn.py please,17,27,33,43
"so  rename  file  jwiw.md  into  ""src/umny.docx""  please",18,25,33,48
hey change qsmerq.docx to backup/smos.pdf quickly,11,22,26,41
hey change filename from tqbrqbjv.txt to data/scbggduo.jpg for me,25,37,41,58
well change filename from bxwkxb.csv to wdhoool.log please,26,36,40,51
"hey rename tbkz.docx as ""rclgmpbb.csv""",11,20,24,38
"well change ""amwe.jpg"" to project/cxh.jpg for me",12,22,26,41
can you rename cbka.md as lbqhsai.txt now,15,22,26,37
"please could you rename ""data/lah.md"" as ugo.png for me",24,37,41,48
"i want to rename ""tmp/thzbdjso.py"" to src/obmgxyw.png quickly",17,34,38,53
Can  you  update  the  name  of  new/tycowxgt.pdf  to  v1/nikbo.csv  for  me,33,49,55,67
so rename kkwhvcvv.py to kmc.txt for me,10,21,25,32
please rename otr.txt as nzxdfq.png for me,14,21,25,35
"hey could you rename ""iqvau.png"" as backup/yhccsup.md now",21,32,36,53
"please change filename from src/kdxtebrq.csv to ""tmp/qelqpbi.py""",28,44,48,64
so rename nzrlusl.json to v2/ivm.md,10,22,26,35
"can you update the name of ""cqzymasu.docx"" to project/ssyzdxyn.png for me",27,42,46,66
hey  rename  backup/zdt.txt  to  ihgdrd.log  for  me,13,27,33,43
so  change  gjj.png  to  rfd.png  please,12,19,25,32
"can you i want to rename new/vtafxt.json to ""logs/uell.csv"" now",25,40,44,59
"can you rename file ""ckai.jpg"" into qxhqbew.log",20,30,36,47
"hey change src/wqiro.jpg to ""mjwcz.py"" now",11,24,28,38
can you rename lnusy.py to v1/gnfnll.js,15,23,27,39
okay rename v1/bnugsgns.pdf as iktpurg.log,12,27,31,42
hey i want to rename v1/xkmc.py to vtm.pdf now,21,31,35,42
can  you  rename  iyovdj.docx  as  v2/xgpgvk.json  please,18,29,35,49
so rename file nvfvz.txt into src/jnxjjxah.js for me,15,24,30,45
i want to rename new/lqdivmx.log to pouazn.txt quickly,17,32,36,46
"Can you change ""tevyynq.json"" to ""jzuml.txt"" quickly",15,29,33,44
Okay change mnqt.log to vvzh.py,12,20,24,31
okay  rename  logs/porkw.json  as  diitr.jpg  quickly,14,29,35,44
so  could  you  rename  zqvcj.png  as  tuwd.py  please,24,33,39,46
so rename file orvlx.pdf into btl.pdf for me,15,24,30,37
so  could  you  rename  wbkg.pdf  as  snpibw.pdf  quickly,24,32,38,48
"can you rename file ""qjtr.csv"" into leazfrwv.pdf quickly",20,30,36,48
can you update the name of rqcomt.jpg to new/fotrl.txt for me,27,37,41,54
So rename mhobgq.png as btbumnm.log please,10,20,24,35
update the name of tmp/fwdoufm.csv to cwma.png,19,34,38,46
"hey rename file ""project/azpnnzs.md"" into ""tmp/vgnfojuz.jpg"" for me",16,36,42,60
can you change xfba.jpg to umv.jpg for me,15,23,27,34
"Hey change old/xupwoage.log to ""v1/evdwjg.js""",11,27,31,45
hey rename file suyie.txt into backup/vmotioc.json now,16,25,31,50
"hey i want to rename ""bdoov.jpg"" to v2/zayan.txt please",21,32,36,48
"so change project/rkiqvfv.png to ""hicjljm.py"" quickly",10,29,33,45
please rename file data/ywaesml.js into cpkjrwa.json please,19,34,40,52
well i want to rename dssjoomk.png to backup/eythbrx.docx for me,22,34,38,57
well update the name of cdx.py to gvc.js,24,30,34,40
"well rename file ""aei.txt"" into pdyprvw.py",17,26,32,42
so i want to rename aaylrrn.txt to v2/vsruv.pdf now,20,31,35,47
"well rename ""logs/byt.docx"" to ""dgiluned.txt"" quickly",12,27,31,45
"so rename ""mzvw.png"" to tijby.docx now",10,20,24,34
"can you update the name of ""v2/cbo.md"" to logs/nas.txt quickly",27,38,42,54
please  rename  agqqkcd.py  to  ptugmm.pdf  now,16,26,32,42
"please change filename from ""tmp/amnofbvt.md"" to ""old/ofia.csv"" please",28,45,49,63
well update the name of vgal.txt to qzbn.docx for me,24,32,36,45
can you could you rename plgksso.jpg as project/usjkmg.docx for me,25,36,40,59
"hey rename file ""backup/zyfrstfj.pdf"" into ""wfocveg.py"" now",16,37,43,55
well  rename  src/sqobqexu.js  to  qjlzrqm.csv  please,14,29,35,46
hey i want to rename logs/pfbioht.md to backup/agnevr.csv for me,21,36,40,57
can you i want to rename eiwzw.png to src/hlakk.csv please,25,34,38,51
"hey could you rename ""backup/nsruam.json"" as tmp/vvhqt.py quickly",21,41,45,57
"well update the name of ziwdb.json to ""zrqo.log"" quickly",24,34,38,48
"well  update  the  name  of  ""ksbzi.csv""  to  project/nyjbigpf.pdf  please",29,40,46,66
"hey rename ""logs/ejrc.log"" to qcwai.js now",11,26,30,38
"So  rename  file  pxcjqiv.log  into  ""ydidjavx.log""  for  me",18,29,37,51
okay change filename from src/ycmyalak.py to logs/pawe.jpg,26,41,45,58
"well could you rename mdtoib.pdf as ""cqfjgzqd.py""",22,32,36,49
can you i want to rename yoms.json to ngcul.docx,25,34,38,48
rename lengvujm.json as nxzej.json please,7,20,24,34
"hey rename qvyh.docx to ""src/ohpg.py""",11,20,24,37
"please change filename from data/qedkwxk.jpg to ""avethtqa.txt"" now",28,44,48,62
"hey update the name of xup.csv to ""project/cfeogl.md""",23,30,34,53
so change xgppbke.js to xqhotpa.pdf,10,20,24,35
hey update the name of data/ums.jpg to mlnaex.txt quickly,23,35,39,49
okay i want to rename project/vylmrnn.csv to ntkwhq.docx for me,22,41,45,56
"okay rename ""hackr.log"" as ""src/qck.jpg"" for me",12,23,27,40
"well rename ""xxrye.txt"" to ""nhhdpejn.md"" quickly",12,23,27,40
please could you rename old/rzf.docx as gadynhtx.js quickly,24,36,40,51
"well rename ""backup/brone.txt"" to bmr.log please",12,30,34,41
well rename bol.log to ydepswkg.log quickly,12,19,23,35
"change filename from ""fvwqu.json"" to old/uyoepw.pdf now",21,33,37,51
please  rename  flqi.log  as  new/qjyb.py  quickly,16,24,30,41
"okay rename vnte.pdf as ""data/yfujp.docx"" quickly",12,20,24,41
"okay  rename  logs/jwyuroph.csv  as  ""spuckg.pdf""  now",14,31,37,49
can you change filename from src/nhjkrd.txt to old/iepd.docx for me,29,43,47,60
"Hey rename file ""old/ejshke.docx"" into v1/bhmhk.csv quickly",16,33,39,51
hey  i  want  to  rename  notbhsdd.txt  to  old/cpuhe.csv  quickly,26,38,44,57
so update the name of jzkvkzwe.md to v1/vqnbre.md,22,33,37,49
rename logs/clypmmq.csv to logs/ozahe.json now,7,23,27,42
can you rename tmp/cvfkeg.jpg as xwbdjj.csv,15,29,33,43
"can  you  change  ""new/zzankj.csv""  to  backup/xgnrd.jpg  now",18,34,40,56
"Can you update the name of rjrxl.py to ""tmp/laawzheh.py"" now",27,35,39,56
rename file old/xiedexk.jpg into project/vhzryv.md for me,12,27,33,50
well change jmvdtzo.log to old/xvjmhgwf.py,12,23,27,42
rename file tmp/hytffj.pdf into fqkf.log please,12,26,32,40
okay change filename from gjorzivo.png to qgpsk.js now,26,38,42,50
"so i want to rename ""frbfrk.pdf"" to ezziku.png for me",20,32,36,46
"well update the name of ""v1/oioyskp.txt"" to project/iupqx.js quickly",24,40,44,60
"could you rename mmxyly.py as ""backup/mjsn.txt"" now",17,26,30,47
okay  rename  file  logs/iuumqeh.csv  into  habcvgf.pdf  quickly,20,36,44,55
"well i want to rename ""backup/fqhujhm.csv"" to ""logs/fvdo.js"" please",22,42,46,60
"so change filename from nvh.md to ""v2/dcysm.py"" now",24,30,34,47
could you rename wwugxzn.pdf as awd.csv now,17,28,32,39
well rename nwjmcs.json to project/fbuioje.md for me,12,23,27,45
"well change old/rsgokt.pdf to ""wwmjw.pdf"" please",12,26,30,41
"hey  change  ""yxrdkzyb.log""  to  ""wve.csv""  please",13,27,33,42
well rename file src/plm.jpg into v1/cqjxousr.png now,17,28,34,49
"hey  rename  ""new/qfixqt.pdf""  to  ""v1/lmmiy.js""",13,29,35,48
"please rename cnaxd.md to ""tmp/jvsdiwp.log"" please",14,22,26,43
okay  rename  data/svrzaikt.json  to  project/mlzwfeed.docx  now,14,32,38,59
hey could you rename vsn.json as ncahe.jpg now,21,29,33,42
can you i want to rename wqmhlq.log to rehq.docx for me,25,35,39,48
"okay  rename  file  fbfcnth.docx  into  ""data/mrjj.png""  now",20,32,40,55
so  rename  mpecgbuy.docx  to  cydtpvd.docx  for  me,12,25,31,43
please update the name of v1/ikou.js to pko.pdf now,26,36,40,47
so could you rename v1/gmnqovsz.jpg as new/kgier.md now,20,35,39,51
hey change gurgsfb.txt to mocq.csv please,11,22,26,34
"please  change  filename  from  ""aaje.csv""  to  backup/azywa.txt",32,42,48,64
so change filename from ydkggtu.docx to okt.json quickly,24,36,40,48
"rename file ""project/kukdokz.log"" into ""sjobstc.js"" now",12,33,39,51
"well change filename from ""backup/cahxexlz.pdf"" to old/cgms.md now",26,47,51,62
"Hey  could  you  rename  ""muksmw.csv""  as  ""fib.json""  for  me",25,37,43,53
"please change filename from ""cblzjp.txt"" to brp.pdf for me",28,40,44,51
"okay change filename from amvsvi.jpg to ""logs/dvu.py"" now",26,36,40,53
"okay  change  filename  from  exumtm.jpg  to  ""artsh.pdf""",30,40,46,57
hey i want to rename project/ilqyv.docx to njoo.csv,21,39,43,51
change filename from mwp.docx to yngtkznj.docx for me,21,29,33,46
so  rename  new/jiq.md  as  logs/reacvj.log  for  me,12,22,28,43
change filename from afawq.jpg to project/cfxoqn.png please,21,30,34,52
can  you  rename  vrpax.csv  to  old/flghffu.jpg  quickly,18,27,33,48
so rename src/htjqxs.log as project/ouycfn.js,10,24,28,45
okay rename mdta.json as mlotkv.md quickly,12,21,25,34
okay rename uiyoq.md to v2/xgr.json now,12,20,24,35
"So i want to rename qvofqnl.pdf to ""ghpql.json""",20,31,35,47
"well rename ""qmmm.txt"" to new/ytyqym.pdf",12,22,26,40
rename file qoj.txt into fwu.js now,12,19,25,31
hey could you rename rjw.pdf as tmp/tvsda.js for me,21,28,32,44
change  rkicnrq.png  to  v2/smsucqx.log  now,8,19,25,39
"can you rename ""src/zxkcuiu.txt"" as sxgjz.py now",15,32,36,44
"okay rename ""src/ywcvngzm.js"" to ""rjnal.png"" now",12,29,33,44
can  you  rename  kev.json  to  project/asfq.log  now,18,26,32,48
"change nsslsbvs.pdf to ""new/ydml.log"" please",7,19,23,37
"please rename ""wpulf.txt"" to ""project/zeny.js"" for me",14,25,29,46
hey  change  zgdr.log  to  logs/injxmuen.py  now,13,21,27,43
Update the name of project/wgk.json to v1/prntxxu.pdf please,19,35,39,53
"so change jnj.docx to ""kpp.json"" for me",10,18,22,32
Can you could you rename wjbzyend.csv as v2/wxfvg.js now,25,37,41,52
"please change filename from ""project/rlajav.log"" to isyayma.pdf quickly",28,48,52,63
"well rename logs/toltqt.csv to ""v2/ksyplo.md""",12,27,31,45
okay change v2/ahuckyh.log to fav.py please,12,26,30,36
"hey change filename from ""jjb.csv"" to dltil.docx quickly",25,34,38,48
so i want to rename nqtav.js to old/xtyp.jpg,20,28,32,44
"Can you change filename from sxg.log to ""qdwq.log"" please",29,36,40,50
Okay change filename from ctanlq.js to hqgp.log now,26,35,39,47
so change filename from rnawkj.py to byqdmh.log,24,33,37,47
can you change filename from bbnxn.docx to v1/rfiljpl.log,29,39,43,57
"please change filename from dqtk.md to ""sbvpwh.jpg"" now",28,35,39,51
rename file v2/twjfioy.txt into tmp/hrej.txt for me,12,26,32,44
"Hey could you rename ""pupo.png"" as src/fnj.pdf now",21,31,35,46
hey change przryu.png to src/zzybtz.js,11,21,25,38
so change data/bwkdh.md to mrtt.json,10,23,27,36
"please rename ""logs/hepdc.csv"" to project/svipyew.jpg please",14,30,34,53
okay could you rename backup/mdwu.jpg as opbtn.docx,22,37,41,51
"can  you  rename  file  ""vuutnsfo.jpg""  into  logs/ycbvxqx.log  now",24,38,46,62
please  update  the  name  of  project/msdaxf.pdf  to  mwczkij.js,31,49,55,65
"so change ""ifqlcjxx.pdf"" to ""zcks.txt""",10,24,28,38
"hey  rename  file  ""cdxf.js""  into  ""qijsrpq.js""  quickly",19,28,36,48
"please  rename  pbmrqz.md  to  ""project/jgmft.txt""  quickly",16,25,31,50
well rename hkh.csv as v1/hnhlijp.js please,12,19,23,36
change  dkeui.jpg  to  qbwhat.json  quickly,8,17,23,34
"can you change ""backup/gdjdz.md"" to yhwzrek.csv for me",15,32,36,47
"so change filename from tmp/xuevxkl.json to ""asugpgn.txt"" now",24,40,44,57
"Well could you rename ""v2/plifn.md"" as logs/yghzszt.png for me",22,35,39,55
okay update the name of luqyego.txt to oxzhkqy.log for me,24,35,39,50
okay  rename  backup/caufji.docx  as  huf.docx  quickly,14,32,38,46
"hey i want to rename ""myurcb.js"" to ""new/mwjh.md"" for me",21,32,36,49
Please  change  cgm.png  to  v1/cakzvhaj.py,16,23,29,43
"hey could you rename ""old/mpdcz.png"" as tzj.jpg please",21,36,40,47
"hey rename file qflzofda.log into ""ajzjtxe.txt"" quickly",16,28,34,47
so rename file xlclzv.json into v1/ogghgkjg.log quickly,15,26,32,47
"can you change filename from ""qgzyaipd.txt"" to pkylx.docx please",29,43,47,57
"well i want to rename ""bgjfajt.jpg"" to tmp/evsg.pdf for me",22,35,39,51
okay i want to rename tmp/hjmrgl.json to tmp/oaairc.txt now,22,37,41,55
hey  update  the  name  of  backup/eemhrvc.txt  to  dcrydc.png,28,46,52,62
"can you could you rename ""mmbwirog.md"" as ""v2/kxv.json"" for me",25,38,42,55
"well rename ""plpc.pdf"" as gwje.json quickly",12,22,26,35
okay rename file data/uwjms.png into project/bzqofulm.pdf please,17,31,37,57
hey  change  v1/lozfc.pdf  to  bkh.txt  please,13,25,31,38
okay change logs/xtgyro.jpg to joimdpq.md quickly,12,27,31,41
"well update the name of ""project/tsqw.docx"" to ""project/ejsecnkd.js"" quickly",24,43,47,68
"so update the name of ""nrzo.pdf"" to ""v1/frguye.py"" quickly",22,32,36,50
rename v1/jwsifsf.pdf to wfwacgla.pdf for me,7,21,25,37
"so  rename  ""xsflmxq.docx""  as  pioa.docx  quickly",12,26,32,41
Can you could you rename new/obwlj.csv as bhbb.png for me,25,38,42,50
"okay rename file tmp/nelpot.png into ""mpd.md"" now",17,31,37,45
"hey rename new/qwmau.png as ""data/pfp.py"" please",11,24,28,41
"well i want to rename pjpxueo.csv to ""old/hjq.json"" quickly",22,33,37,51
"can you i want to rename fgrr.js to ""ofawias.pdf""",25,32,36,49
"can you rename ""project/roemhqib.md"" to okmkuoz.txt for me",15,36,40,51
Please update the name of sixchpp.docx to v2/kwzdbt.py for me,26,38,42,54
"update the name of wuepsc.json to ""lfuum.pdf""",19,30,34,45
hey rename src/honuj.js to old/wtssq.png now,11,23,27,40
"can you change filename from pnn.md to ""ykyyn.md"" quickly",29,35,39,49
"so  change  filename  from  ""slx.pdf""  to  project/nmw.log  for  me",28,37,43,58
change vbyferwc.jpg to jocfar.jpg please,7,19,23,33
"well rename file ""kweb.py"" into rstg.json for me",17,26,32,41
Hey  could  you  rename  cfm.txt  as  ews.js  now,25,32,38,44
"okay i want to rename ""data/ystdccr.json"" to yktzuqb.png now",22,41,45,56
i want to rename wli.csv to oyocdu.png,17,24,28,38
"hey rename ""holusobv.pdf"" to mndzcw.txt now",11,25,29,39
"please could you rename tmp/xiep.js as ""v1/rqpfsra.js"" now",24,35,39,54
hey change old/lui.json to dmso.docx for me,11,23,27,36
hey change v1/mxtnlqbd.md to src/wxbqodh.js now,11,25,29,43
hey rename file aagwfq.png into qgp.js for me,16,26,32,38
please i want to rename v2/yrjfaqhj.log to project/ouueg.txt,24,39,43,60
"can  you  change  ""backup/dklfr.md""  to  kylqemgk.txt  please",18,35,41,53
"okay change filename from ""mbr.docx"" to v2/bqmbap.log for me",26,36,40,53
okay could you rename dwtvarv.pdf as udyvbnug.log now,22,33,37,49
hey i want to rename ppwyper.md to spnx.png please,21,31,35,43
so change ukwo.json to clk.js quickly,10,19,23,29
"Well i want to rename ""rnkuqpw.md"" to gamxu.js now",22,34,38,46
"please  rename  ""xge.js""  as  xpkuyib.json  now",16,24,30,42
rename xnxsxp.docx to tmp/luyo.csv,7,18,22,34
"please rename file ""tmp/vxkoyyl.log"" into ""new/pcufcti.js"" please",19,36,42,58
"update the name of ""xnnp.json"" to mtvdnj.py",19,30,34,43
"Okay i want to rename ""v1/avq.csv"" to ""rwx.py"" please",22,34,38,46
can you change filename from v1/sitxrl.txt to mkgrxoah.py,29,42,46,57
"okay  rename  ""new/ourli.md""  as  ""kaxkf.jpg""  quickly",14,28,34,45
please i want to rename src/hysoncg.json to old/vxsubkd.md please,24,40,44,58
well  change  irtkzu.md  to  new/rpfxqpdh.docx  now,14,23,29,46
"please could you rename ""pubfnzhs.pdf"" as hfcfbwpo.jpg now",24,38,42,54
okay rename czec.json as qsymn.md now,12,21,25,33
"hey update the name of ""aqlqwyo.js"" to data/jey.txt quickly",23,35,39,51
hey could you rename rkszzdsf.py as tohku.txt now,21,32,36,45
hey  rename  pfrvz.png  as  tmp/kxnkb.py  now,13,22,28,40
"So  update  the  name  of  ""ovvr.jpg""  to  sxu.md  now",27,37,43,49
i want to rename gubw.txt to data/lcnefs.md,17,25,29,43
hey update the name of vaw.py to ayy.docx please,23,29,33,41
please change filename from tmp/lrmawr.log to uoguotqs.py now,28,42,46,57
well rename juytg.txt to project/rkqzzbvn.txt for me,12,21,25,45
"please  change  ""wqivw.csv""  to  lgjgfssk.pdf  quickly",16,27,33,45
"well i want to rename ""zwlst.jpg"" to old/arkku.log quickly",22,33,37,50
okay rename project/zlvozum.json as ywid.txt for me,12,32,36,44
"please rename ""wwpfgimq.json"" as ktvw.json",14,29,33,42
hey change filename from mubjwxfg.csv to gxbmmofn.png for me,25,37,41,53
okay change filename from backup/qwbk.pdf to ybfusyk.txt for me,26,41,45,56
"please  change  filename  from  ""wbtty.docx""  to  ""backup/bba.pdf""  please",32,44,50,66
well  update  the  name  of  data/lle.csv  to  dmkii.csv  for  me,29,41,47,56
okay i want to rename xvw.js to uwjkxpxz.js now,22,28,32,43
so i want to rename logs/afgg.png to yyhkw.md quickly,20,33,37,45
"can  you  rename  new/pddwyqk.png  to  ""logs/ypayre.json""  quickly",18,33,39,57
i want to rename msglhg.md to rnmfhcf.png now,17,26,30,41
so change filename from data/cdhjnu.jpg to tmp/jfxhnvrv.py quickly,24,39,43,58
okay update the name of zlkt.docx to volicsfs.png now,24,33,37,49
"okay rename pwsg.json as ""backup/sysy.log"" now",12,21,25,42
"please update the name of ""ikpheyej.py"" to new/crckvb.json for me",26,39,43,58
"please change filename from kkylmqd.md to ""fqkowzj.log""",28,38,42,55
can  you  change  backup/fgpkgcwx.png  to  qyvogf.pdf  now,18,37,43,53
"rename file tdcjx.md into ""v2/baai.js"" now",12,20,26,38
please  rename  file  etrvnha.json  into  jlb.csv  now,22,34,42,49
"can you rename file ""tmp/qzup.jpg"" into ""daeren.log"" now",20,34,40,52
"so change ""new/kvjh.js"" to uxwkskx.docx for me",10,23,27,39
"so i want to rename ""wysck.json"" to ifbg.log for me",20,32,36,44
hey change ivwgukx.docx to tuwpwjrs.pdf now,11,23,27,39
"well rename ""old/muv.csv"" as ""v2/bvgc.txt"" for me",12,25,29,42
"so rename file ""whbrmayw.docx"" into project/gmlo.csv quickly",15,30,36,52
