text,src_start,src_end,dst_start,dst_end
"okay  i  want  to  rename  rpjnlyt.py  to  ""wcseqb.docx""  please",27,37,43,56
"can you could you rename pkfc.docx as ""nqannfnq.log"" quickly",25,34,38,52
"update the name of fekhkhzf.png to ""cezryxq.jpg""",19,31,35,48
so rename gkkzx.docx as zurijuy.jpg quickly,10,20,24,35
hey change filename from logs/lpdtiuo.md to tmp/nbsd.js quickly,25,40,44,55
"i want to rename v2/qbsafgc.jpg to ""bpqhsaio.log"" now",17,31,35,49
"well change backup/dful.csv to ""ccp.csv"" please",12,27,31,40
can you rename file npnxmreu.md into slazlh.js now,20,31,37,46
hey  change  xvtedni.js  to  new/svd.md  quickly,13,23,29,39
so update the name of hwedwdp.log to v1/ofxuzvk.csv please,22,33,37,51
"can you change ""jay.docx"" to logs/fhynom.csv now",15,25,29,44
Update the name of blatw.js to gcywc.json now,19,27,31,41
"hey  i  want  to  rename  ""zdnk.js""  to  old/dqzabzn.md  please",26,35,41,55
"well update the name of tmp/iyjej.log to ""gdqalae.md"" please",24,37,41,53
"hey  rename  jomgcw.csv  to  ""xbdmox.png""  please",13,23,29,41
well i want to rename jlfm.png to data/qxftgn.csv please,22,30,34,49
"well rename ""project/pdrcpeq.log"" as ""src/ftdokuu.log"" now",12,33,37,54
"well i want to rename ""tgyuj.jpg"" to kvjcfic.txt for me",22,33,37,48
rename rpcfsh.txt to mch.docx please,7,17,21,29
so rename backup/ishqv.py to data/wkqbx.py please,10,25,29,42
"well rename file jupenl.pdf into ""ctggxu.pdf"" for me",17,27,33,45
"rename file ""project/ksqbojxa.js"" into v2/miyehfpu.csv quickly",12,33,39,54
"i  want  to  rename  ""ahgxdle.pdf""  to  v1/qudwfd.pdf",21,34,40,53
"can you i want to rename ""tmp/owdv.txt"" to ""logs/yrjyqeq.py""",25,39,43,60
can you i want to rename src/spite.js to jmxzp.json quickly,25,37,41,51
can you i want to rename yocm.csv to vyy.jpg now,25,33,37,44
"please rename ""zzmco.md"" as data/yjgf.csv please",14,24,28,41
"so rename file ""juogav.png"" into ""kvdhyict.png"" quickly",15,27,33,47
"hey change ""zhbdbeby.txt"" to ""gosyrp.pdf""",11,25,29,41
"well rename file ""tmp/srnevzgv.docx"" into ""new/sayddj.jpg"" quickly",17,36,42,58
change wdbiec.jpg to v2/zeiiznj.docx now,7,17,21,36
"hey rename backup/silsdos.pdf as ""rsvdll.csv""",11,29,33,45
"i want to rename dpazzx.jpg to ""beo.js"" quickly",17,27,31,39
can you rename file axfgjmk.txt into jpzzyy.docx now,20,31,37,48
hey rename axxvfzmv.pdf as new/hhow.md please,11,23,27,38
okay update the name of src/ipcrqcg.log to zeir.pdf please,24,39,43,51
"rename file ""xrrjv.log"" into uwfnfnkd.png now",12,23,29,41
"can you update the name of ""kfw.txt"" to ""data/sbhmew.pdf"" for me",27,36,40,57
okay change logs/sxup.md to v1/puqe.csv,12,24,28,39
"can you rename ""fzfss.log"" as tmp/vhsjr.js for me",15,26,30,42
so could you rename whevsmwm.docx as v1/wwl.pdf quickly,20,33,37,47
"can  you  rename  old/wlgxxl.js  as  ""kvhiafne.csv""  please",18,31,37,51
okay  i  want  to  rename  auek.txt  to  old/kegwe.json,27,35,41,55
"hey rename eyz.py to ""xrd.csv"" quickly",11,17,21,30
hey change filename from rungfvoh.pdf to acymebfr.txt quickly,25,37,41,53
rename  data/jzji.py  to  efzsyp.log  now,8,20,26,36
"please change filename from ""backup/cwrqolq.json"" to azzvc.txt for me",28,49,53,62
well rename dqqtb.pdf to cnsmzj.png quickly,12,21,25,35
Okay rename jeruycr.png to ztaoqkj.jpg quickly,12,23,27,38
"well  change  ""erwrwbe.pdf""  to  ""hyq.json""  quickly",14,27,33,43
"well rename hkmo.jpg to ""ernhibf.jpg""",12,20,24,37
okay i want to rename v1/xnenxuk.md to v2/edx.log,22,35,39,49
Hey change tamszx.docx to v1/igmgrxro.jpg,11,22,26,41
"so could you rename ""ftumif.pdf"" as ""dgcx.js"" now",20,32,36,45
well rename backup/xfehltag.png to data/ndzxqb.md,12,31,35,49
well i want to rename new/ouqwmudw.md to tplsrfs.png please,22,37,41,52
so update the name of tmp/hwpbqbzw.md to sgm.png please,22,37,41,48
"okay  rename  ""data/yyvmuhmf.pdf""  to  glhqzmhc.md  for  me",14,33,39,50
so change filename from dgnt.log to logs/oymdqgar.docx,24,32,36,54
"so change filename from slfhhwo.txt to ""new/yidmo.docx"" now",24,35,39,55
"okay i want to rename project/jqetfod.png to ""ietuel.jpg"" quickly",22,41,45,57
"well rename file mghtypqr.js into ""src/czrh.pdf"" now",17,28,34,48
"so change filename from rzoamo.png to ""project/yfcsvjm.docx""",24,34,38,60
please  rename  gnuagjg.js  as  logs/euuowm.pdf,16,26,32,47
can you change filename from ofz.js to rmjj.log for me,29,35,39,47
Hey rename file wvvidvg.docx into pcdka.log now,16,28,34,43
"well could you rename ""titinxg.py"" as ""logs/caypxq.py"" for me",22,34,38,54
"can  you  rename  pmyiqkb.jpg  to  ""zmiekjd.pdf""",18,29,35,48
"well rename data/qparq.json to ""old/opkvvf.log"" please",12,27,31,47
change  filename  from  v2/jlcgnzo.js  to  ixhbdv.pdf  for  me,24,37,43,53
can  you  rename  data/oqfehhy.js  as  v1/uzwwag.js,18,33,39,51
"please rename ""old/wyr.png"" as ugm.csv now",14,27,31,38
"okay rename file ""lsejhj.docx"" into nrezw.pdf for me",17,30,36,45
"can you could you rename ""v1/qoqgjz.js"" as tgrwa.csv please",25,39,43,52
i want to rename data/xyql.md to xbcm.csv for me,17,29,33,41
rename xcgeg.csv to data/dis.png quickly,7,16,20,32
"okay  rename  ""logs/sjxy.pdf""  to  ""blza.jpg""  for  me",14,29,35,45
hey rename old/ahhv.py to zlldfobh.pdf quickly,11,22,26,38
well rename data/tlm.js to nob.py quickly,12,23,27,33
well change filename from old/oyib.md to ppr.png please,26,37,41,48
so update the name of kykcc.jpg to gqbke.log please,22,31,35,44
"so rename ""sfphx.docx"" as ynzkanw.js now",10,22,26,36
"change filename from ""jjft.jpg"" to najtxtvg.csv quickly",21,31,35,47
"rename  file  ""ggsmd.pdf""  into  ""data/xvqojiv.md""  please",14,25,33,50
please i want to rename wvrbcrts.js to uouvala.jpg please,24,35,39,50
rename  riqqkgre.jpg  to  liqysbn.txt  quickly,8,20,26,37
"well rename file ""ksxhv.jpg"" into ampue.js quickly",17,28,34,42
well rename file new/qkekw.log into tiv.py,17,30,36,42
"so rename ""src/pxzu.png"" to ""vbkh.png"" please",10,24,28,38
so could you rename zlj.jpg as new/xhc.csv quickly,20,27,31,42
so rename file cgpabxh.js into ljrib.png quickly,15,25,31,40
"please rename ""v1/ruif.py"" to zycrhcl.md please",14,26,30,40
"so  could  you  rename  zzgeo.docx  as  ""tmp/ytctpbll.csv""  for  me",24,34,40,58
Please rename qbq.pdf as ouhvo.py for me,14,21,25,33
"okay  update  the  name  of  ""v2/lhzlyuhb.md""  to  project/hodbkaoi.png  now",29,45,51,71
okay i want to rename oqmbhad.docx to sypakg.md for me,22,34,38,47
so could you rename src/dkrk.csv as old/snkkd.py please,20,32,36,48
"hey update the name of ""ndgldr.csv"" to ""v1/mxcu.docx"" for me",23,35,39,53
well update the name of tghofewa.py to wez.pdf for me,24,35,39,46
"change filename from ""backup/edse.csv"" to ngeoat.py for me",21,38,42,51
please i want to rename usvzzzn.docx to project/fkygj.docx please,24,36,40,58
okay  rename  file  data/bxqmuoco.png  into  src/nfycmy.jpg  please,20,37,45,59
can you change filename from urfv.js to src/hkasd.md,29,36,40,52
"so  could  you  rename  ell.csv  as  ""tmp/wkijszw.docx""",24,31,37,55
"change ""src/zktj.pdf"" to backup/prmhb.js quickly",7,21,25,40
can you change xnvsdl.txt to nzv.pdf please,15,25,29,36
can you change src/zmiooo.py to backup/nmprn.log now,15,28,32,48
okay change ztvphuwd.txt to uedik.pdf quickly,12,24,28,37
"hey  could  you  rename  data/paayvui.js  as  ""jwjz.log""  now",25,40,46,56
hey rename file data/xxesr.js into pmkgj.txt please,16,29,35,44
"okay rename ""logs/qecou.jpg"" to v2/chwf.json quickly",12,28,32,44
"okay  change  filename  from  logs/uqzveah.md  to  ""gwsl.txt""  for  me",30,45,51,61
please change filename from tmp/rsfgkclr.js to kzoxkz.json quickly,28,43,47,58
hey change nrae.jpg to logs/fskjkewq.md,11,19,23,39
well change filename from project/qolryqi.docx to wflez.pdf now,26,46,50,59
can you rename backup/ldkzumy.png as sxo.js now,15,33,37,43
hey rename ffvg.docx as new/fisbinik.js for me,11,20,24,39
"so change v2/jnvll.md to ""bajhxfyf.txt""",10,21,25,39
well could you rename v2/efyvbk.png as zmkrpcqc.docx for me,22,35,39,52
Well change kbtya.log to aoiuja.md,12,21,25,34
"so  update  the  name  of  new/izd.js  to  ""data/xillth.csv""",27,37,43,60
"hey rename eztubafq.jpg as ""etponq.csv"" quickly",11,23,27,39
"okay rename file backup/ukzlewig.csv into ""src/pyhed.docx"" please",17,36,42,58
"could you rename ""zgvvcca.log"" as project/hsnb.json please",17,30,34,51
can you could you rename ffo.json as old/qsnvq.py for me,25,33,37,49
Rename lkduvsg.pdf to jfgreze.csv please,7,18,22,33
"okay  change  rzqa.log  to  ""logs/gknhcrt.docx""  now",14,22,28,47
"so could you rename csf.pdf as ""v2/bllumjkn.js"" quickly",20,27,31,47
can  you  change  filename  from  cupnul.pdf  to  backup/qzny.md  please,34,44,50,64
Okay could you rename tmp/hhoda.csv as wyn.py please,22,35,39,45
"rename ""tmp/tugvxc.pdf"" to logs/oyqbrhju.txt quickly",7,23,27,44
okay rename usjtmvgs.docx as new/pij.log quickly,12,25,29,40
"can you rename file ""src/wsrtjwv.js"" into ""new/hiccjvz.json"" please",20,36,42,60
well i want to rename nuejnvh.log to cbsw.txt quickly,22,33,37,45
"please  rename  file  pwbkjxb.md  into  ""vcf.md""  for  me",22,32,40,48
"can  you  change  filename  from  tmp/ndjxvsm.csv  to  ""tmp/bjhqp.csv""  for  me",34,49,55,70
"please rename xcwlodm.png as ""cjg.js""",14,25,29,37
"please i want to rename ""ksti.docx"" to ggtz.log",24,35,39,47
"okay  rename  file  ""jsaon.js""  into  fzgj.json  now",20,30,38,47
"Can you change filename from ""fev.py"" to uavhc.txt now",29,37,41,50
"change ""rpiwony.docx"" to ""backup/uzkuyq.png""",7,21,25,44
can you rename file btyxf.jpg into project/uwy.md for me,20,29,35,49
please could you rename rbcuqorc.json as ytvmucu.js quickly,24,37,41,51
well  i  want  to  rename  data/zgqbw.png  to  src/zqwf.md  quickly,27,41,47,58
"well rename ""v1/afi.docx"" as tmp/cmbgkspi.jpg please",12,25,29,45
"Change filename from ""logs/hzwouql.txt"" to ""qiu.log"" please",21,39,43,52
"well could you rename v2/swc.js as ""orzcsen.txt"" please",22,31,35,48
hey rename file tmp/eoxfp.docx into izckcz.py now,16,30,36,45
"hey  rename  ""new/sdnmii.jpg""  as  v1/zgtgdovo.py",13,29,35,49
"please  rename  ""iec.txt""  to  ""dwllk.log""  quickly",16,25,31,42
so change v2/nymlfs.csv to qvoxoxr.jpg please,10,23,27,38
"so  i  want  to  rename  ""tmp/hqoaz.docx""  to  neaakmjf.md  please",25,41,47,58
can you change filename from agqprh.csv to src/zvqhhqx.jpg please,29,39,43,58
please  change  bijx.md  to  data/akehms.md  for  me,16,23,29,43
Can you update the name of old/wlylk.log to logs/tzag.png,27,40,44,57
"so update the name of ""yyddkwn.pdf"" to racjym.pdf for me",22,35,39,49
rename file pkrxwg.md into qrudu.png please,12,21,27,36
"well change filename from ""data/fbekwvc.json"" to ""gwvz.js"" now",26,45,49,58
well change filename from data/lwujmkk.json to qdfqk.docx please,26,43,47,57
"well update the name of ""emijwake.docx"" to svexgcqx.json please",24,39,43,56
"well change hly.csv to ""wfv.png""",12,19,23,32
could you rename tmp/obkf.txt as yjkj.csv,17,29,33,41
could you rename tmp/ivsfetnv.png as talc.json please,17,33,37,46
"well change alh.json to ""src/jcvi.json"" quickly",12,20,24,39
Please rename file fbsfkvh.json into vgpzgdse.txt,19,31,37,49
please change filename from rlgjuvww.docx to backup/yoapbs.png now,28,41,45,62
So i want to rename v1/jdlnpob.csv to cwkp.png now,20,34,38,46
please change filename from src/zvdxtavz.js to esjnwzoi.png please,28,43,47,59
"hey change filename from new/kzbwem.js to ""medhnkdk.docx"" please",25,38,42,57
Can you change filename from new/pxby.txt to data/bxozuxuk.log for me,29,41,45,62
Rename file bvkg.json into wnl.json now,12,21,27,35
"i want to rename ""qypzby.py"" to ""project/xelgn.json"" now",17,28,32,52
hey could you rename wmxkhu.docx as jlevihpm.docx please,21,32,36,49
"change ""zpmelqw.json"" to cjqdad.log please",7,21,25,35
"well could you rename logs/uraid.log as ""kdhpewz.txt"" please",22,36,40,53
"so  could  you  rename  vyzdv.md  as  ""pza.log""  now",24,32,38,47
"so change ""src/rjywl.png"" to ""new/ywdutm.md""",10,25,29,44
so could you rename src/jiktjse.jpg as logs/unlr.log quickly,20,35,39,52
"please change filename from ""xsro.jpg"" to mldojavk.md please",28,38,42,53
"Hey rename zhggam.py to ""skf.pdf"" for me",11,20,24,33
"well  rename  mvfijcj.csv  to  ""izkar.md""  please",14,25,31,41
hey rename file backup/sdwfscz.log into xhwctjhu.docx for me,16,34,40,53
"please change filename from ""imuo.png"" to xni.docx please",28,38,42,50
well rename ujbmi.png as sxhxyb.json,12,21,25,36
well change ekhq.py to xkf.docx,12,19,23,31
"so  rename  ""emlxjrwn.pdf""  as  jvccybom.md",12,26,32,43
"could you rename ""bnz.py"" as kyfsyr.jpg now",17,25,29,39
"Well rename egdu.txt to ""v1/zuj.js"" now",12,20,24,35
rename cpijdm.md as ftigwt.pdf quickly,7,16,20,30
"well change rtt.jpg to ""new/rdpg.js"" please",12,19,23,36
okay rename dzrum.png to new/bkzvqri.log,12,21,25,40
"so  could  you  rename  logs/muiw.txt  as  ""v1/bmfq.jpg""  quickly",24,37,43,56
can  you  rename  rsx.py  as  old/usbrjasd.md  quickly,18,24,30,45
"so rename logs/ypxrdwo.txt to ""oyblme.docx"" please",10,26,30,43
"okay could you rename ""new/phtaubj.png"" as ""backup/msanebbk.docx"" please",22,39,43,65
"hey change filename from ""v1/qdnerwfx.csv"" to dbsmzcx.js",25,42,46,56
"so update the name of ""swi.csv"" to ""odxg.js"" please",22,31,35,44
can you rename file xvlr.txt into tmp/gvg.csv please,20,28,34,45
hey could you rename uouxu.csv as pyidxqnj.md quickly,21,30,34,45
please change filename from vfl.csv to zfwe.js please,28,35,39,46
Well rename eow.py to wyerkvtc.jpg for me,12,18,22,34
"so rename ""tmp/dvbmg.js"" as v1/evxiu.pdf please",10,24,28,40
"hey i want to rename tmp/bptqf.docx to ""ntcuk.pdf"" for me",21,35,39,50
can you could you rename oqwg.png as tmp/yusa.txt,25,33,37,49
"please rename ""rghvt.pdf"" as v1/tzxi.jpg quickly",14,25,29,40
"okay change ""rlzum.json"" to npgr.docx quickly",12,24,28,37
"okay rename file logs/qserdq.jpg into ""jivlin.csv""",17,32,38,50
"please rename file ""sdefv.docx"" into ""hqvc.csv"" now",19,31,37,47
please rename fzp.png as awrl.py quickly,14,21,25,32
"hey  i  want  to  rename  rranz.pdf  to  ""fsm.log""  quickly",26,35,41,50
"so i want to rename ""backup/rohxqta.log"" to v2/booqrdj.docx now",20,40,44,59
"please rename ""backup/mscrydj.py"" as ""stzfg.py"" quickly",14,33,37,47
"hey change filename from elfctl.jpg to ""pjwdddc.png"" quickly",25,35,39,52
so rename file uqpezza.md into tmp/qgyfqo.js quickly,15,25,31,44
rename file project/lbpeypy.pdf into v1/tnvegfor.pdf for me,12,31,37,52
"well could you rename okbqxnmc.jpg as ""gyfqnh.txt"" now",22,34,38,50
"can you change xznwoo.docx to ""eyxab.json"" quickly",15,26,30,42
so could you rename qpkpigfe.csv as vrtk.md now,20,32,36,43
please update the name of utljir.jpg to backup/mrqqlqn.docx now,26,36,40,59
So rename new/sywpv.docx to emozu.pdf for me,10,24,28,37
hey  rename  file  efds.jpg  into  omcpqe.md  quickly,19,27,35,44
change filename from ejneuip.pdf to atky.csv for me,21,32,36,44
"hey rename ""mdq.csv"" as uklnhan.py please",11,20,24,34
"so rename ""ohc.txt"" to kopnck.js please",10,19,23,32
"hey i want to rename nucseb.png to ""rufednml.js"" for me",21,31,35,48
can you i want to rename sfyrk.json to qpwhpc.txt for me,25,35,39,49
"can you could you rename ""eqfwu.pdf"" as ""pqhu.docx"" for me",25,36,40,51
hey rename wtek.js to rpsrjd.json for me,11,18,22,33
"please change filename from project/zyfwqhh.pdf to ""bqas.png"" for me",28,47,51,61
"hey i want to rename ""idexc.log"" to old/puxeewl.pdf now",21,32,36,51
please rename file lnumh.csv into project/bvvbovgr.log,19,28,34,54
can you rename glbpkphd.json as wxn.log please,15,28,32,39
Rename logs/ismt.docx as ftnndb.py now,7,21,25,34
"well  update  the  name  of  backup/xecafv.docx  to  ""zpmb.docx""",29,47,53,64
well could you rename zsv.png as old/wxh.pdf now,22,29,33,44
"change  filename  from  ""data/rvhs.csv""  to  sui.png  now",24,39,45,52
"please i want to rename data/aoa.json to ""src/qgjwqkkr.jpg"" please",24,37,41,59
"well could you rename ""lnhihe.json"" as jvolfo.png now",22,35,39,49
"so rename ""v2/clzil.py"" as ""v2/sttxz.log"" for me",10,23,27,41
hey change filename from data/iconm.pdf to goaceru.py please,25,39,43,53
"please update the name of ""qgyidf.json"" to ""project/maimpbob.docx"" quickly",26,39,43,66
"so i want to rename ""v1/qvwhg.jpg"" to ""blrlx.js"" please",20,34,38,48
please  update  the  name  of  yfnnpptf.py  to  byv.json  for  me,31,42,48,56
update the name of vjjsltk.log to btjzfh.pdf,19,30,34,44
"hey change filename from ""new/ydkpsrul.pdf"" to ""itedm.pdf"" please",25,43,47,58
"Well change ""backup/qyokwfd.py"" to tmp/qcdzwakj.jpg",12,31,35,51
"Please could you rename ""qrmnk.pdf"" as xxvuvd.json quickly",24,35,39,50
hey rename eej.py to data/ltdsbv.json for me,11,17,21,37
"can you change filename from ""ixgfl.csv"" to jmab.json please",29,40,44,53
well  rename  gnvgxgh.txt  as  mpbb.log  quickly,14,25,31,39
"well rename ang.js as ""new/jeuikq.txt""",12,18,22,38
"Hey rename file ""fzw.py"" into fhiqpuj.js now",16,24,30,40
"Okay rename file tmp/ykix.json into ""src/tkwmevvr.json"" please",17,30,36,55
"hey could you rename ""npkp.log"" as project/ufhcaowz.md now",21,31,35,54
hey change filename from jlbvgno.png to kmyhg.jpg please,25,36,40,49
okay  i  want  to  rename  zwc.docx  to  old/zowkvo.png  now,27,35,41,55
"hey change filename from ""rqzfipm.pdf"" to dvmb.txt quickly",25,38,42,50
well change filename from zdmy.png to tvmxpdt.json please,26,34,38,50
"i want to rename ""logs/bngk.csv"" to bypn.py now",17,32,36,43
"could you rename iws.log as ""mbhjvqma.png"" now",17,24,28,42
"can you change ""crhzr.png"" to ""ivl.jpg"" please",15,26,30,39
so update the name of new/ngalpwy.png to mzt.png now,22,37,41,48
well change dxcke.txt to project/xfofd.csv quickly,12,21,25,42
well  could  you  rename  rjx.jpg  as  old/sczgbi.docx  for  me,26,33,39,54
rename fxxi.md to tmp/ykpzd.docx please,7,14,18,32
"can you rename file ""src/ojq.md"" into fet.txt quickly",20,32,38,45
"update the name of ""xrdvc.js"" to xfvkthxl.py for me",19,29,33,44
can you could you rename adla.js as ovcozg.pdf,25,32,36,46
so update the name of data/isgfxms.pdf to snuy.pdf now,22,38,42,50
"well update the name of wetbxi.docx to ""vhhfo.png"" now",24,35,39,50
"well rename file ""data/yojoh.js"" into ""data/wohmraf.py""",17,32,38,55
"so change ""v1/bjsjgpx.pdf"" to tmp/owvbo.jpg",10,26,30,43
"Can you rename file dioem.py into ""ohvqxu.py"" now",20,28,34,45
"well could you rename bdmtja.md as ""rmlkk.md"" now",22,31,35,45
"hey  rename  ""logs/gkg.py""  as  tmp/ypticdu.json  quickly",13,26,32,48
"can you change filename from ""ceidb.txt"" to ""arntcyo.py"" quickly",29,40,44,56
"hey rename uakevt.txt as ""bawv.py"" now",11,21,25,34
"please rename file ylht.json into ""srspbpj.js"" please",19,28,34,46
Okay  rename  file  eynge.png  into  project/xxpnlqye.png  quickly,20,29,37,57
"so update the name of ""v1/sdytfke.js"" to ""new/wugxzjqo.md""",22,37,41,58
"hey rename data/dujhptv.md as ""src/jyy.py"" for me",11,26,30,42
"hey rename ""data/emqh.pdf"" as ""tmp/jwpdrvqy.js"" quickly",11,26,30,47
can you i want to rename qragrdy.jpg to new/umd.py now,25,36,40,50
"rename file vosgi.docx into ""logs/emupmdwk.py"" for me",12,22,28,46
"please rename ""tmp/fxfh.pdf"" to project/kisy.docx",14,28,32,49
"okay change filename from project/znrgdkof.docx to ""zdg.txt"" for me",26,47,51,60
"okay change filename from ""tmp/hndcanca.pdf"" to backup/zdn.md please",26,44,48,61
well update the name of rakurngp.md to vrmkrfa.png quickly,24,35,39,50
Please change src/rnizckdn.csv to logs/eys.txt quickly,14,30,34,46
"please  rename  ""zctjcyrw.json""  as  kkmoaglg.docx  now",16,31,37,50
"Okay rename ""data/qhsylamp.json"" to pfbmmv.log now",12,32,36,46
change filename from backup/pii.json to old/lywqkd.json now,21,36,40,55
"can you rename file ""zvszwfce.txt"" into hvi.json quickly",20,34,40,48
"can you change filename from ""nicxvtrq.log"" to iliq.js now",29,43,47,54
"okay change ""kxitcpj.py"" to ""v2/nwjcptzk.json"" for me",12,24,28,46
"well rename ""olavunux.json"" as gtrzlqud.json now",12,27,31,44
"okay rename ""src/ohid.jpg"" to v2/jvwcalmg.pdf please",12,26,30,45
"Well could you rename ""eeszh.log"" as ""mpst.py"" now",22,33,37,46
update the name of keksgary.jpg to jnrwt.docx for me,19,31,35,45
so rename kbdh.docx as ikitzwj.log,10,19,23,34
can you change filename from data/vcoxj.jpg to ojyukaq.jpg now,29,43,47,58
can  you  rename  onqtkhkt.md  to  backup/rde.md  quickly,18,29,35,48
"okay change nqdll.js to ""ezyvwk.md""",12,20,24,35
"hey rename file ""tuhfy.js"" into ""afelshh.png"" now",16,26,32,45
"please rename file ""new/vyeqi.js"" into azhduyl.png quickly",19,33,39,50
well rename nqrwle.js as qilhpxd.jpg now,12,21,25,36
"Well rename ""nxbly.csv"" to ifaf.docx please",12,23,27,36
"rename file qzwj.log into ""ijf.txt"" quickly",12,20,26,35
please rename mkud.pdf to vpd.md,14,22,26,32
"please i want to rename ""v1/kupvv.log"" to ylj.json quickly",24,38,42,50
"well change ""cpndqlu.pdf"" to pascrpz.md now",12,25,29,39
"hey change logs/ckcfwq.js to ""wngb.log"" now",11,25,29,39
"can  you  change  filename  from  ""bfgo.md""  to  project/ycsfuue.js  quickly",34,43,49,67
please i want to rename bunrxnou.png to v2/ttndzloi.csv quickly,24,36,40,55
"well  update  the  name  of  ""zprbyybf.log""  to  hrbkelrd.md",29,43,49,60
"i want to rename ""project/wwigxq.jpg"" to backup/wfnnw.json quickly",17,37,41,58
"can you update the name of qqkp.md to ""kcekeemg.csv"" please",27,34,38,52
"well change filename from adlk.png to ""fjuixeoz.jpg"" please",26,34,38,52
please rename file project/nwpo.png into hoiwix.png for me,19,35,41,51
"can you change src/oavoat.pdf to ""data/tfdoju.jpg""",15,29,33,50
"can  you  rename  bdy.json  to  ""vtzjyj.pdf""  please",18,26,32,44
"well update the name of ouidg.docx to ""bxbca.md"" for me",24,34,38,48
"hey change filename from logs/bwp.jpg to ""apn.log""",25,37,41,50
"can you change ""logs/nbcqas.docx"" to odzzwg.pdf please",15,33,37,47
"well update the name of ""yvwuqrfr.txt"" to devxw.md",24,38,42,50
so change ymh.docx to ckghkvdi.md please,10,18,22,33
"So rename file azzmy.txt into ""zqzcx.csv"" now",15,24,30,41
"change filename from allwjb.csv to ""data/qiijl.pdf"" please",21,31,35,51
"rename  file  ""logs/jzwo.pdf""  into  project/puhrknf.docx",14,29,37,57
"okay rename ""backup/tdazqu.py"" to nwjashu.png",12,30,34,45
"so change filename from gckenoq.py to ""jdetiqu.jpg"" quickly",24,34,38,51
"change rdj.png to ""data/oejwvl.csv"" quickly",7,14,18,35
so rename new/vywpfa.csv to twh.docx,10,24,28,36
rename  v1/bzflh.log  as  new/jrgvsgsp.png  for  me,8,20,26,42
well update the name of fkjmdpy.txt to src/dsrp.py please,24,35,39,50
well  change  filename  from  new/nodsmdq.md  to  old/mbvkzgpb.log  for  me,30,44,50,66
"okay change filename from ""eccnay.pdf"" to uvj.js now",26,38,42,48
"please change filename from fbgmc.docx to ""vugnz.py""",28,38,42,52
"can you rename file izfnqll.pdf into ""emzxgek.jpg"" for me",20,31,37,50
okay update the name of old/zcdofvpm.txt to pfavvflz.pdf quickly,24,40,44,56
Can you could you rename eedau.pdf as tdnakz.docx for me,25,34,38,49
"please rename ""srptj.txt"" as ""rfxiryqc.md"" for me",14,25,29,42
"hey could you rename ""lzivgjkj.docx"" as ""ltudny.pdf""",21,36,40,52
"change  ""ezltzdcd.png""  to  data/xbjc.log  quickly",8,22,28,41
so i want to rename zmmfjc.docx to yknac.csv,20,31,35,44
Okay could you rename data/bkzaxwyx.txt as src/mscjnc.png for me,22,39,43,57
"well could you rename ""tmp/xpkvlsau.py"" as new/qgoi.csv for me",22,39,43,55
okay change filename from xwbrfju.py to pqq.json now,26,36,40,48
"can you change filename from ""zlgv.png"" to ""apz.md"" now",29,39,43,51
can  you  rename  zroi.csv  as  uppvo.json,18,26,32,42
Well change filename from src/jmfl.pdf to old/wusqqb.log quickly,26,38,42,56
update the name of kurnfug.csv to data/tgcnfwi.pdf for me,19,30,34,50
"okay could you rename ""tmp/zatrfqul.csv"" as ""src/rulme.md"" for me",22,40,44,58
"change filename from data/uwfbqku.pdf to ""ozbdts.js"" now",21,37,41,52
"so rename tmp/weljysb.pdf to ""bjzfksx.pdf"" please",10,25,29,42
well update the name of zowjcme.csv to jhnjai.md for me,24,35,39,48
rename nyftzws.csv as cigzq.docx quickly,7,18,22,32
could you rename preciqi.js as data/surfnbol.js quickly,17,27,31,47
please  change  filename  from  v2/fuf.js  to  v2/tsstnio.log  please,32,41,47,61
"okay change ""gcqzecz.py"" to ""raids.png""",12,24,28,39
"can you could you rename backup/zwsamm.md as ""lalbb.log"" for me",25,41,45,56
"hey  i  want  to  rename  v1/cfx.py  to  ""gmtwdxc.log""  please",26,35,41,54
"hey change zknt.csv to ""rwvzs.json""",11,19,23,35
"Well rename tkj.json as ""wllmqkt.txt"" quickly",12,20,24,37
please i want to rename old/stylau.txt to new/zcezqbam.pdf quickly,24,38,42,58
"so update the name of ""ubjtkmy.json"" to v2/aumfwnl.jpg now",22,36,40,54
well rename file madxd.pdf into tmp/iqnhrwh.json,17,26,32,48
"can  you  change  v1/cmsh.png  to  ""wfnug.log""  please",18,29,35,46
"please rename file ""qfssdtlj.log"" into ftac.txt now",19,33,39,47
change  pcud.log  to  old/eeexd.png  quickly,8,16,22,35
"please could you rename data/yba.csv as ""fyb.py"" please",24,36,40,48
"please change ""lhvzidm.js"" to htehyy.pdf please",14,26,30,40
"hey update the name of data/sibotwd.csv to ""src/kun.csv"" for me",23,39,43,56
well change filename from logs/yowglh.js to lxeys.csv please,26,40,44,53
Okay update the name of msgugh.log to tmp/fpszgkva.docx for me,24,34,38,55
"can you i want to rename ""sjh.js"" to ""fcvbwmc.json"" now",25,33,37,51
can  you  change  filename  from  xyswezw.py  to  eylia.csv,34,44,50,59
"Can you rename backup/lcxrna.md to ""src/ywrogjoq.pdf"" for me",15,31,35,53
"okay rename ""iobf.md"" to ""backup/zslibqvv.py""",12,21,25,45
update  the  name  of  kddghpz.js  to  project/inbbey.md  for  me,23,33,39,56
