text,src_start,src_end,dst_start,dst_end
"can you change filename from ""qlbceo.log"" to ""aqrgtjtr.jpg"" now",29,41,45,59
can you change filename from logs/iek.jpg to backup/lmu.js please,29,41,45,58
"please  could  you  rename  ""logs/csfx.md""  as  ueep.docx  for  me",28,42,48,57
"so  rename  ""src/wzdwo.png""  to  tmp/dsjjp.png  please",12,27,33,46
"well change ""logs/steyg.json"" to xhya.md",12,29,33,40
so  rename  bxlvmjx.docx  to  fomrje.log,12,24,30,40
can you could you rename spxqtr.png as bzksmoox.py,25,35,39,50
well could you rename prrj.docx as old/vinr.md quickly,22,31,35,46
"so change filename from v1/kstb.txt to ""etpf.png"" please",24,35,39,49
"so rename file lectdev.docx into ""rhduauah.txt"" now",15,27,33,47
i want to rename hbsavv.csv to hgqxzss.log quickly,17,27,31,42
"well rename ""v1/ncnbijx.png"" to project/lpp.js please",12,28,32,46
okay  rename  file  czk.py  into  shiqo.py  now,20,26,34,42
okay  change  hshwh.png  to  mcvqta.docx  now,14,23,29,40
please rename file dwljk.js into old/tsskoyf.jpg please,19,27,33,48
please rename admlva.js as project/bhn.png now,14,23,27,42
"well i want to rename zufy.log to ""tmp/gahbwkka.docx"" for me",22,30,34,53
please rename file btfkki.png into cdr.csv please,19,29,35,42
hey change dxc.md to tvgvopb.js quickly,11,17,21,31
Hey rename old/rfcizus.log as ouocgvwp.pdf now,11,26,30,42
"please i want to rename v2/vbxvs.docx to ""logs/fiiimiqz.pdf"" now",24,37,41,60
"rename  ""jry.js""  to  backup/avklsgea.log",8,16,22,41
"Can you rename src/owk.json as ""v2/nya.pdf"" quickly",15,27,31,43
Please rename sqsozo.txt as ijrzcnjg.jpg now,14,24,28,40
"so change ""qybsvo.log"" to ""new/vogxzrpn.py"" please",10,22,26,43
"well update the name of ""v1/lvfoam.png"" to ofbur.csv",24,39,43,52
"please change ""backup/otl.png"" to rasia.json for me",14,30,34,44
"okay could you rename nbmo.json as ""kkgcelqp.png"" please",22,31,35,49
"okay update the name of ""old/rigb.pdf"" to tmp/djfksbs.js for me",24,38,42,56
"Can you change ""rhsmgp.docx"" to ""erlfl.csv"" quickly",15,28,32,43
"hey rename ""backup/rsoraq.txt"" to old/awvxow.log please",11,30,34,48
"can  you  update  the  name  of  ""qkl.txt""  to  logs/osjsooy.py  please",33,42,48,63
"rename file v1/phtrn.py into ""qpml.jpg""",12,23,29,39
"can you rename ""data/reauv.csv"" to tmp/fdk.py please",15,31,35,45
"hey i want to rename mjdto.png to ""tyeperri.md"" now",21,30,34,47
hey i want to rename src/kocfrv.docx to src/omt.docx now,21,36,40,52
well  rename  logs/hqqmafe.log  as  jxqntihj.txt  please,14,30,36,48
"please rename xwweyx.png as ""lydj.log"" for me",14,24,28,38
"can you change ""v1/svb.docx"" to mjqbnbng.jpg now",15,28,32,44
please rename project/xaj.txt to project/rjabgdu.md please,14,29,33,51
"can  you  rename  ""backup/daozx.json""  to  abkeojh.json  for  me",18,37,43,55
"okay rename file ""old/dfssn.txt"" into eknole.txt quickly",17,32,38,48
"so change filename from ""data/otrjvy.docx"" to dewcldvd.docx please",24,42,46,59
"hey could you rename ""ztqfusoo.js"" as cfecghj.log quickly",21,34,38,49
okay change filename from data/oda.pdf to v2/rltqlq.jpg,26,38,42,55
can  you  rename  ehgdp.py  to  itrfb.json  quickly,18,26,32,42
rename file bmyfnc.pdf into old/zsmhmzq.log,12,22,28,43
"well change ""old/ytcy.pdf"" to logs/pie.txt for me",12,26,30,42
"well rename file ""project/qcup.csv"" into whvwjl.docx",17,35,41,52
Hey could you rename v1/luhrgme.log as wgaivoq.py please,21,35,39,49
please  i  want  to  rename  data/dhr.csv  to  src/nsalik.png  quickly,29,41,47,61
so i want to rename upqb.js to logs/ydbqat.log now,20,27,31,46
"okay  change  ""prfxfjhq.jpg""  to  qvo.csv  now",14,28,34,41
can you rename xlh.png as xig.jpg for me,15,22,26,33
"okay  update  the  name  of  ""fhvm.txt""  to  wmldis.jpg",29,39,45,55
"please change filename from ""lvfypt.txt"" to qjdca.md quickly",28,40,44,52
"i want to rename ""ckxtpnm.log"" to v1/eqh.txt quickly",17,30,34,44
"hey  rename  file  ""rpantvbs.js""  into  backup/yvfq.md",19,32,40,54
Hey rename tuvkzz.png as dptamm.docx now,11,21,25,36
"could you rename zdr.json as ""hrmuomhg.txt"" please",17,25,29,43
hey change rpglfn.js to jjo.jpg now,11,20,24,31
"update  the  name  of  ""nkjq.py""  to  unbi.jpg  quickly",23,32,38,46
"hey  rename  ""backup/onragf.pdf""  as  backup/teulxdgv.png  for  me",13,32,38,57
"i want to rename data/qjs.json to ""xcvkxf.jpg"" please",17,30,34,46
"hey  could  you  rename  ""data/uab.png""  as  ""zlgx.jpg""  now",25,39,45,55
okay update the name of backup/gxttyyw.js to lawvkjqj.pdf please,24,41,45,57
hey change project/tkr.png to v2/rxxbjp.txt please,11,26,30,43
"Hey change v1/okfbgtmf.py to ""src/mln.json"" please",11,25,29,43
so update the name of dlniyjwr.jpg to ddrotucw.log please,22,34,38,50
"Well could you rename drpf.txt as ""data/ouoxmdlu.jpg"" quickly",22,30,34,53
"so update the name of ""v2/vfcoeex.pdf"" to zworslaa.jpg for me",22,38,42,54
"okay rename ""logs/hzgmnwc.jpg"" as uprnozoq.png",12,30,34,46
can you rename jou.js as lwgfh.py,15,21,25,33
"well could you rename ""v1/dxtkt.py"" as cxxj.pdf please",22,35,39,47
"can you i want to rename ""klcerqb.md"" to ""backup/oywmidt.json"" quickly",25,37,41,62
Okay rename file src/mamfyc.docx into atlpkw.json please,17,32,38,49
can you rename nffseba.pdf to backup/knom.log please,15,26,30,45
"hey rename ""backup/gzgp.md"" to syry.js",11,27,31,38
"well rename file ""v1/fbr.js"" into llxkr.json now",17,28,34,44
okay rename lunbn.js to new/hkse.csv quickly,12,20,24,36
"hey rename vxufnix.docx to ""uymmwild.py"" quickly",11,23,27,40
"so  rename  file  ""wrmx.py""  into  ""logs/ciq.md""  for  me",18,27,35,48
"can you rename ""data/xxrpls.json"" to ""v1/jtpxmklm.log"" quickly",15,33,37,54
update the name of howto.csv to data/pwpvue.txt quickly,19,28,32,47
hey rename xaexx.json to bdv.pdf quickly,11,21,25,32
Can you update the name of fpc.csv to v2/pjpbk.jpg,27,34,38,50
"change filename from ""tjtupf.csv"" to ""v2/jjmbn.jpg"" please",21,33,37,51
"change filename from ""new/wtejd.js"" to zcb.png",21,35,39,46
"well change filename from ""vgymu.csv"" to hhsv.docx for me",26,37,41,50
"So change siz.png to ""logs/cfcpbr.py"" please",10,17,21,37
hey  rename  tmp/ssx.py  as  xdayt.pdf,13,23,29,38
update the name of liit.csv to logs/dcu.png now,19,27,31,43
hey change filename from v2/tuootxe.png to new/hodk.md,25,39,43,54
so change kewnhxun.md to v1/ijnikg.png please,10,21,25,38
"so change ""uaqkwngl.txt"" to vyve.json",10,24,28,37
"update  the  name  of  ""yvflxmwa.jpg""  to  krna.txt  quickly",23,37,43,51
so change filename from skpro.docx to kwbe.png,24,34,38,46
update the name of v2/blhadkp.py to project/hoeofayl.png please,19,32,36,56
so rename ltplche.csv to data/pei.pdf for me,10,21,25,37
"okay  change  filename  from  btwu.log  to  ""project/udfii.py""  please",30,38,44,62
hey i want to rename yibblc.pdf to new/wyfugi.txt,21,31,35,49
"please change new/zpb.txt to ""hlcnfz.json"" for me",14,25,29,42
"hey rename ymh.js as ""fel.json"" now",11,17,21,31
"hey i want to rename ""qoejcvs.txt"" to v2/xag.docx please",21,34,38,49
okay update the name of bhrne.json to logs/nohsj.py,24,34,38,51
okay change filename from snajvdgo.png to sglfd.txt now,26,38,42,51
"change new/hmknhmrb.jpg to ""dnj.docx"" now",7,23,27,37
hey i want to rename backup/aff.log to vsxlpstw.js for me,21,35,39,50
"okay change orlr.json to ""leg.png"" quickly",12,21,25,34
"hey i want to rename gayge.jpg to ""ugmwi.jpg"" now",21,30,34,45
"Can you could you rename ""backup/uhmlz.json"" as fcwexauz.log please",25,44,48,60
can you change atzk.js to bgxw.png please,15,22,26,34
"Well could you rename ""trm.js"" as ivbcr.json for me",22,30,34,44
okay  rename  data/atczwro.docx  as  logs/isrrlcb.py,14,31,37,52
well i want to rename logs/zszdob.md to qblwhwgb.log quickly,22,36,40,52
Can you i want to rename zbydbwra.docx to ouihor.md for me,25,38,42,51
"hey change filename from ""rmu.png"" to ""vkbd.txt""",25,34,38,48
"please rename xsuwyg.csv to ""ltssfkx.js"" now",14,24,28,40
"so change filename from cqmwfy.md to ""eossko.json"" now",24,33,37,50
"okay could you rename alqngw.log as ""rttkxnim.csv"" now",22,32,36,50
"can you rename ""src/grwlm.csv"" to bntoa.py please",15,30,34,42
"rename file ""v1/iwkbmveh.pdf"" into new/qdlf.png",12,29,35,47
so rename file ugnckw.json into backup/ikawd.pdf,15,26,32,48
"can  you  rename  ini.jpg  as  ""data/bmpf.json""  please",18,25,31,47
Hey could you rename htzucxf.txt as project/fov.log now,21,32,36,51
"Hey rename file wyx.js into ""v1/onepaqd.png"" for me",16,22,28,44
"hey update the name of ""vhmjbr.md"" to dsmxpmzd.csv quickly",23,34,38,50
can you update the name of mjgtpkn.jpg to data/imdbtm.md now,27,38,42,56
so rename backup/vbta.json to v1/obdjgeym.txt please,10,26,30,45
"rename ""cutw.md"" to v2/jzjdp.png quickly",7,16,20,32
"could you rename ""src/osukl.py"" as src/twtwf.js please",17,31,35,47
okay i want to rename vnknh.log to nkjbt.py,22,31,35,43
so  change  ytty.docx  to  lvloebv.log  please,12,21,27,38
well i want to rename tmp/guvjpelz.js to project/mwbh.log quickly,22,37,41,57
"change filename from qhl.json to ""data/sfwwqdxd.jpg""",21,29,33,52
okay change filename from project/kajqnc.md to wfgnhax.jpg now,26,43,47,58
well rename file rftaevj.js into fusv.jpg quickly,17,27,33,41
"please update the name of ubzr.png to ""evbt.log"" quickly",26,34,38,48
"okay rename new/iqnfh.log to ""hdfcgys.pdf"" quickly",12,25,29,42
so  rename  file  v2/dkvx.docx  into  tmp/vxguyx.txt,18,30,38,52
"okay  change  xkadbazn.log  to  ""tmp/fnqf.md""  quickly",14,26,32,45
can you i want to rename spgzv.log to backup/qcgwu.pdf for me,25,34,38,54
"Hey  update  the  name  of  vvhv.md  to  ""ifod.csv""  quickly",28,35,41,51
change filename from old/cseg.json to zor.csv for me,21,34,38,45
please could you rename tmp/pabqotnk.py as src/gjtrr.docx now,24,39,43,57
"so update the name of vvu.md to ""data/relfwjs.txt"" quickly",22,28,32,50
rename file old/qpvev.md into tmp/effouyl.md quickly,12,24,30,44
"i want to rename ojuyw.txt to ""v1/nhquv.log""",17,26,30,44
"so  change  ""project/ctzrnb.jpg""  to  ""data/ywtmw.md""  quickly",12,32,38,53
can  you  change  filename  from  mqmwwnd.png  to  v2/oxrr.png  now,34,45,51,62
"please rename v2/eehyzx.log as ""jbaslp.png"" please",14,27,31,43
okay  rename  jbea.txt  as  v1/mwyvbxe.pdf,14,22,28,42
"so update the name of ""uudvuz.js"" to ""ndamupp.py"" now",22,33,37,49
Okay change filename from new/dhd.pdf to qogwpfou.jpg now,26,37,41,53
"well i want to rename evjne.md to ""data/rrpqn.png""",22,30,34,50
"can you i want to rename ""ueemty.py"" to ""project/ykrq.pdf"" quickly",25,36,40,58
"well change filename from cqfpbe.pdf to ""oqgoe.csv"" please",26,36,40,51
change filename from gkaakfcn.pdf to old/ruy.txt,21,33,37,48
so rename src/wcjpp.txt to xuq.pdf please,10,23,27,34
"so change ""znjnxq.docx"" to ""xntv.md""",10,23,27,36
okay rename src/aejpww.jpg to okmdbilx.log now,12,26,30,42
update the name of dawqwm.docx to logs/snrtee.json quickly,19,30,34,50
okay rename pjsdja.docx as erjmuk.py,12,23,27,36
"okay could you rename logs/zvilmy.py as ""blyuexd.docx""",22,36,40,54
"okay change zgo.png to ""lnimbh.txt"" now",12,19,23,35
"well rename ""ekkiash.log"" to old/fcyoqdfr.png quickly",12,25,29,45
well i want to rename v2/ohqtat.docx to v1/jkqfso.csv please,22,36,40,53
"please rename file ""ctuwln.csv"" into ""phzluclg.py"" for me",19,31,37,50
"i want to rename lvygyiz.txt to ""wiuhy.md"" quickly",17,28,32,42
"please rename file ""v1/tsrxoio.json"" into mkbfbfq.js",19,36,42,52
"please change filename from qswhng.png to ""tjgd.csv"" now",28,38,42,52
"okay change ""new/dlan.png"" to zeky.py",12,26,30,37
"well rename ""v2/fubdcl.pdf"" as project/anqo.csv please",12,27,31,47
"so rename fmogh.txt as ""ecegjzz.png"" please",10,19,23,36
update the name of data/fglda.log to aiy.csv please,19,33,37,44
"please could you rename ""cdq.pdf"" as zuvmwpe.pdf now",24,33,37,48
"hey rename ""rrbitglu.pdf"" as zrgtoo.md quickly",11,25,29,38
"okay could you rename v2/yxjbj.py as ""new/ukc.png""",22,33,37,50
"okay rename ""hkfm.pdf"" to logs/xob.json please",12,22,26,39
so update the name of bhktkgxo.docx to mow.txt quickly,22,35,39,46
rename momk.csv to backup/ioqftfy.py quickly,7,15,19,36
"hey change ""data/esux.md"" to v2/pcxeiuzy.csv please",11,25,29,44
"okay rename file ""pyxgd.log"" into igbww.docx",17,28,34,44
change filename from qgjpx.md to lgjkvk.txt quickly,21,29,33,43
"rename  project/pijrzbyn.txt  as  ""v2/kjfbigxp.js""",8,28,34,50
"hey update the name of sjlirpe.txt to ""fanxpnj.csv"" for me",23,34,38,51
"please  could  you  rename  ""v1/gfihjlzv.pdf""  as  cgumsau.pdf  please",28,45,51,62
"change ""data/wdjmmdm.csv"" to znwgg.log for me",7,25,29,38
so change v1/nxmuvzhk.csv to jandb.log quickly,10,25,29,38
"well could you rename ""tmp/aeqzqz.py"" as ""v2/mfvnyu.json"" now",22,37,41,57
"so could you rename ""bwywdsk.jpg"" as dswtlpot.md",20,33,37,48
"okay rename jfcdo.md to ""ioii.pdf"" please",12,20,24,34
can  you  update  the  name  of  imkggm.png  to  skhrw.log,33,43,49,58
"change  filename  from  ""v2/rqmhik.jpg""  to  src/biepj.jpg  quickly",24,39,45,58
"well change filename from kkjphz.json to ""new/cirdd.md"" for me",26,37,41,55
"i want to rename ""pwkt.json"" to old/sbykykh.png quickly",17,28,32,47
"so rename file xlifs.js into ""v1/vzcsmxkv.csv"" now",15,23,29,46
"so could you rename logs/wyybyy.jpg as ""mrjocqxx.js"" quickly",20,35,39,52
"hey  update  the  name  of  ""backup/dmwzbjvd.py""  to  ygwibew.csv  now",28,48,54,65
okay rename vzmderu.py as data/apo.png,12,22,26,38
"change ""zwnx.csv"" to data/qixvuok.json for me",7,17,21,38
please rename mkphm.py as v2/ngtl.jpg now,14,22,26,37
"Can you change filename from ""qbuqamm.csv"" to v1/htvtbc.png",29,42,46,59
can you rename file wahqw.py into project/shexajq.py now,20,28,34,52
can you could you rename rjig.pdf as dnayrkhv.jpg now,25,33,37,49
"Hey update the name of ""logs/qpuimwkb.docx"" to backup/mdqote.docx please",23,43,47,65
"okay rename file ""qqciny.docx"" into xjg.js please",17,30,36,42
can you change filename from v1/npt.txt to ubfrwd.md please,29,39,43,52
hey rename file backup/nsnasuk.csv into project/suxjkxil.txt please,16,34,40,60
"rename ""paojz.py"" as ""vawllw.log"" quickly",7,17,21,33
so update the name of v2/fwgimb.py to ghebqiq.json quickly,22,34,38,50
can you could you rename wpt.txt as xhlhetf.pdf please,25,32,36,47
"please change filename from ""yreiz.js"" to ""lkm.json"" quickly",28,38,42,52
can you update the name of dzkt.md to old/ioldhe.py please,27,34,38,51
"well rename file ""v1/kehtdzqe.docx"" into logs/htltjkwi.js",17,35,41,57
"okay i want to rename ehzlhgsg.jpg to ""othmlfv.pdf"" now",22,34,38,51
"please rename ""nnvlsbr.txt"" to shne.json please",14,27,31,40
"please  rename  file  ""src/dutmixi.jpg""  into  data/gvrjcok.md  now",22,39,47,62
"Hey i want to rename ""old/bmtligx.md"" to v1/hfjr.png quickly",21,37,41,52
"please  rename  file  ""jdwkb.md""  into  ""logs/kvnkwwcb.json""  for  me",22,32,40,60
well rename gsvgprr.pdf as backup/aqdar.log now,12,23,27,43
"rename  ""v2/pkxm.py""  as  ""new/kpkxvhdx.docx""",8,20,26,45
"can you change filename from v2/dnsh.pdf to ""v1/vyfs.js"" now",29,40,44,56
please rename file axwjrawr.pdf into gdvunqa.csv now,19,31,37,48
please  rename  rvdiqs.js  as  sthijihw.md  for  me,16,25,31,42
"so rename ""wqvosqd.csv"" to backup/huxrku.txt for me",10,23,27,44
"so  rename  ""dkgushdg.md""  as  ""new/ebhgl.jpg""  for  me",12,25,31,46
change v1/ept.csv to buqbjjuj.js please,7,17,21,32
"so rename gjl.docx to ""backup/fjo.json""",10,18,22,39
okay change filename from old/iokkzl.md to backup/zsp.log quickly,26,39,43,57
can you update the name of logs/ikz.jpg to fri.log now,27,39,43,50
change filename from tqx.csv to xosn.docx now,21,28,32,41
"hey rename file ""xkfhj.csv"" into ththcg.docx now",16,27,33,44
"rename tmp/ulndl.pdf to ""logs/ekryq.json"" quickly",7,20,24,41
okay update the name of jud.txt to logs/owcqkyrv.csv,24,31,35,52
so i want to rename ydm.md to zme.png,20,26,30,37
please could you rename new/yngiora.txt as apd.docx,24,39,43,51
okay update the name of vrlflh.png to vfquydv.md quickly,24,34,38,48
okay  i  want  to  rename  ungosoza.jpg  to  ujey.md  please,27,39,45,52
"So i want to rename ""tmp/whhgu.log"" to cfih.pdf for me",20,35,39,47
"change filename from ""mdnoceum.md"" to v2/mrzikd.md",21,34,38,50
so i want to rename new/rjem.log to kjz.js,20,32,36,42
please  rename  ybwxbg.js  to  v2/xvbs.docx  please,16,25,31,43
"can you change filename from pjeukcie.py to ""data/pciexs.md"" now",29,40,44,60
update the name of xgwmgy.txt to uycqlgdr.png now,19,29,33,45
"okay update the name of ""v1/psomcg.csv"" to ""old/kciwoa.txt"" for me",24,39,43,59
"okay rename backup/hjjctddk.csv as ""kkhw.docx"" quickly",12,31,35,46
"can you change ""uxrxts.js"" to gkk.txt",15,26,30,37
"well  could  you  rename  ""kwedra.json""  as  jwz.docx  please",26,39,45,53
"okay update the name of ""dkh.log"" to ""xpqm.py"" now",24,33,37,46
okay update the name of data/ngy.py to iqrlnp.json quickly,24,35,39,50
so change filename from iqbl.png to gvggtv.js now,24,32,36,45
"well rename file ""pkfcyj.log"" into logs/ejfkyjx.js quickly",17,29,35,50
"well change filename from ostws.csv to ""old/btdvmk.js"" for me",26,35,39,54
So change filename from jksep.md to oebbwpj.py for me,24,32,36,46
well change filename from kzdas.js to tmp/zjo.json quickly,26,34,38,50
"hey  change  filename  from  ""old/vop.js""  to  ukz.jpg  please",29,41,47,54
hey rename ldoxhx.md to old/kbhhv.pdf now,11,20,24,37
rename file btlc.docx into old/gdlqe.txt,12,21,27,40
"so  i  want  to  rename  hvtrcm.png  to  ""swevs.py""  for  me",25,35,41,51
"well rename file ""llol.jpg"" into mcyd.jpg quickly",17,27,33,41
can you update the name of kslynz.log to wfaopy.png quickly,27,37,41,51
can you change filename from backup/jlo.docx to vwxwot.log please,29,44,48,58
Please could you rename v1/uhb.txt as sggxjquh.txt now,24,34,38,50
"can you could you rename qsdpgwaf.log as ""tcdnpz.docx"" now",25,37,41,54
so i want to rename whyw.png to omdreq.py for me,20,28,32,41
"so i want to rename ""pcc.py"" to ""mozgfql.py"" please",20,28,32,44
"can you update the name of old/jmqu.pdf to ""vibfeo.py"" quickly",27,39,43,54
"i  want  to  rename  ""gvlafh.json""  to  ""aakmmbp.png""",21,34,40,53
update the name of pbg.jpg to v2/kmxegwu.py for me,19,26,30,43
hey rename file yhyph.jpg into old/hgqn.pdf please,16,25,31,43
okay could you rename project/npwoh.log as bgyg.txt now,22,39,43,51
"well could you rename ""iqw.png"" as ""data/wei.png"" please",22,31,35,49
"please  could  you  rename  caxbirc.docx  as  ""oebpd.txt""  please",28,40,46,57
"hey rename backup/fxxhajeo.pdf to ""new/ahtxtu.py"" now",11,30,34,49
can  you  could  you  rename  tksgu.json  as  okf.py  for  me,30,40,46,52
"hey change mwulkh.js to ""old/pah.pdf"" please",11,20,24,37
please  update  the  name  of  v1/kyswrnk.csv  to  ffjpte.json  quickly,31,45,51,62
"so rename hrgtog.json to ""nrfnc.pdf"" please",10,21,25,36
please could you rename v2/totp.png as iwyjdlo.pdf now,24,35,39,50
"so change ""v2/dkqd.js"" to v2/ownw.py please",10,22,26,36
"can  you  rename  file  ""v1/flchcuen.pdf""  into  ikn.py  please",24,41,49,55
okay rename laa.md to dlpos.py quickly,12,18,22,30
well update the name of data/yoet.py to cxxfz.png for me,24,36,40,49
Rename file backup/khw.png into new/trz.docx please,12,26,32,44
well change filename from src/ktp.js to data/fwfqll.json for me,26,36,40,56
okay rename ebii.log to v2/onfiy.txt quickly,12,20,24,36
can you rename vqty.py as esd.txt quickly,15,22,26,33
rename lecuver.log to tmp/civdqt.csv for me,7,18,22,36
well  rename  file  eaiuyjxa.pdf  into  phjgaexz.csv  for  me,20,32,40,52
"can you change src/rmpesdy.txt to ""old/chmu.jpg"" for me",15,30,34,48
"so i want to rename data/rvs.py to ""afqlfud.txt"" please",20,31,35,48
"please rename ""logs/jjo.py"" to mcsjavh.csv for me",14,27,31,42
"well rename file ""pesxft.json"" into ""xcodyok.csv"" now",17,30,36,49
"can  you  change  ""iyj.txt""  to  xbflmb.py  now",18,27,33,42
hey  i  want  to  rename  fltty.py  to  erej.pdf  quickly,26,34,40,48
so update the name of pdiceldx.csv to lcooo.csv please,22,34,38,47
"can you rename seyhn.jpg as ""ikf.pdf"" quickly",15,24,28,37
"well i want to rename old/pgw.js to ""lkcjc.csv""",22,32,36,47
could you rename mwhjibj.md as abzherc.csv now,17,27,31,42
"can you change filename from ""afwsbdwp.jpg"" to old/bqs.txt quickly",29,43,47,58
Okay change filename from project/tjla.pdf to ccslli.pdf please,26,42,46,56
"can you update the name of src/qjlexq.md to ""zmizp.pdf"" please",27,40,44,55
"update the name of backup/ihlfsxzr.pdf to ""emvgmq.txt"" for me",19,38,42,54
hey change filename from osglm.md to data/ljov.py quickly,25,33,37,49
"can you i want to rename qaomwv.js to ""pglpd.txt"" for me",25,34,38,49
"can you rename file ""old/nola.csv"" into src/cvg.pdf for me",20,34,40,51
Can you update the name of gbldvys.csv to data/tztom.csv please,27,38,42,56
"could you rename v1/kejt.pdf as ""v2/oohegvs.txt""",17,28,32,48
"well rename file ""eleqtv.js"" into src/sghsytjs.log for me",17,28,34,50
"well  rename  file  ""dxl.jpg""  into  rord.jpg  for  me",20,29,37,45
okay  rename  mdgosbey.jpg  as  new/ywqlm.py  now,14,26,32,44
"okay update the name of ""ovdmcy.csv"" to ""gkvh.js"" please",24,36,40,49
please could you rename v1/lqbp.pdf as yera.csv now,24,35,39,47
"can you i want to rename ""tmp/bqwpowp.py"" to v2/bpc.docx please",25,41,45,56
Okay i want to rename data/zoea.md to tmp/sulch.js,22,34,38,50
okay could you rename old/amv.txt as roimg.js please,22,33,37,45
"can you could you rename ""data/aaz.png"" as ogor.jpg please",25,39,43,51
"Hey update the name of ""backup/bike.json"" to ""v1/yeg.js"" for me",23,41,45,56
please could you rename new/fsernvmw.txt as sypxxe.log,24,40,44,54
well  rename  file  src/ezy.csv  into  data/lgjlk.json  for  me,20,31,39,54
"can you change filename from rcjnnfk.js to ""jwbmo.js"" please",29,39,43,53
"okay change xjknhvep.pdf to ""ndrjhhwj.txt"" please",12,24,28,42
please rename file project/zvxz.pdf into new/agrv.png for me,19,35,41,53
hey  rename  file  vsfrbmjo.png  into  mwqpcwh.md  please,19,31,39,49
"okay rename ""pah.py"" as apgll.pdf please",12,20,24,33
"can you rename ""suommf.txt"" as ""dsvonfaz.docx"" please",15,27,31,46
"hey  change  filename  from  ""src/oaerh.log""  to  fxnmxeyn.txt  for  me",29,44,50,62
"well could you rename tikdskg.png as ""project/flsbrdf.png"" please",22,33,37,58
rename file xobrg.log into data/wzxkggbo.md quickly,12,21,27,43
can you rename file src/tqqokv.csv into tqc.md now,20,34,40,46
Okay update the name of xfmr.txt to psggcn.log for me,24,32,36,46
"rename file ""data/lowki.docx"" into ""toky.log"" for me",12,29,35,45
"change filename from src/nvrjuew.py to ""v2/glbz.txt"" now",21,35,39,52
please rename file v1/vlqpfnqu.md into qkmzfc.docx,19,33,39,50
well update the name of zkid.pdf to v1/zhnd.py,24,32,36,46
"change ""old/rix.py"" to ""psgme.py""",7,19,23,33
can you i want to rename v1/sxjvi.jpg to psnb.docx for me,25,37,41,50
Please update the name of v1/iogykpt.log to ipiyd.log now,26,40,44,53
rename old/tzcc.md to tffdqeo.docx quickly,7,18,22,34
"please rename ntlrz.py as ""whvjm.py"" please",14,22,26,36
"okay change filename from data/qvb.txt to ""ejsajn.docx"" quickly",26,38,42,55
well  i  want  to  rename  src/ycqtcnf.log  to  nnp.json,27,42,48,56
"so rename ""old/irsc.md"" as ""kytzz.pdf"" now",10,23,27,38
okay rename file kyiup.json into new/fkoiqnow.csv please,17,27,33,49
please rename file kcju.log into tnanmet.txt please,19,27,33,44
hey rename file nazsme.png into oepoumb.txt please,16,26,32,43
hey rename file ioow.log into ixnkuv.py please,16,24,30,39
"so rename gtp.csv to ""xocdp.py"" please",10,17,21,31
so change nmghdro.py to ncsegu.csv,10,20,24,34
okay rename nsktdwtm.csv to gjzlnow.jpg,12,24,28,39
"hey change ""djjn.png"" to vwvn.txt for me",11,21,25,33
"well rename file ryazcaja.txt into ""old/ljv.pdf"" quickly",17,29,35,48
hey  rename  v2/zkuqvm.json  to  zmjtemgj.png  now,13,27,33,45
so  change  filename  from  old/kmryced.json  to  oycbwnc.csv  for  me,28,44,50,61
"can you change filename from qab.png to ""hwsnyvyn.docx""",29,36,40,55
"please  change  cvnagbg.jpg  to  ""fwgdprk.md""  quickly",16,27,33,45
Can you rename backup/pgjowt.py as wmfd.jpg,15,31,35,43
change filename from kpkqdcwl.txt to tmp/rrkphdrw.docx,21,33,37,54
"please  i  want  to  rename  svonrn.docx  to  ""v2/fufirubb.md""  please",29,40,46,62
"please update the name of lymcox.docx to ""jgobx.md"" for me",26,37,41,51
"Change filename from ""pwmls.log"" to fch.jpg quickly",21,32,36,43
"okay could you rename ""ixtraog.jpg"" as ""zsvum.txt"" quickly",22,35,39,50
okay rename project/xjrfxhm.py to project/apgh.md please,12,30,34,49
Well rename lbljqijt.py to vhmedzm.json quickly,12,23,27,39
"okay  rename  file  ""pkzocsoo.docx""  into  new/rcj.py  for  me",20,35,43,53
"please rename new/khamqtxx.png as ""xffhzffb.pdf"" quickly",14,30,34,48
"can you rename file zmfg.pdf into ""hiqxwt.csv""",20,28,34,46
so  i  want  to  rename  cvc.png  to  xccwwhg.json  please,25,32,38,50
"hey  rename  wbfhz.txt  to  ""xbygwfcp.js""  quickly",13,22,28,41
okay could you rename fvhrslyx.docx as pikgc.png for me,22,35,39,48
Hey  update  the  name  of  new/romexv.txt  to  kavxky.jpg  for  me,28,42,48,58
Please update the name of v2/aetdldzm.py to backup/rapj.md,26,40,44,58
"can  you  rename  file  new/rfzrpy.log  into  ""ahu.md""  please",24,38,46,54
"Okay could you rename ""src/jekd.json"" as fqci.py quickly",22,37,41,48
"can you change gsfaw.py to ""bniqfqu.log"" now",15,23,27,40
hey change molxcwi.csv to old/xral.docx quickly,11,22,26,39
"can you change filename from qyg.txt to ""mmizg.py"" now",29,36,40,50
"so rename v2/hnrarwp.csv to ""backup/gvpjyjl.csv"" now",10,24,28,48
"can  you  update  the  name  of  qceiu.jpg  to  ""project/jgyxyy.log""  for  me",33,42,48,68
