text,src_start,src_end,dst_start,dst_end
"hey rename ""waopwcum.json"" to shod.txt",11,26,30,38
okay variety file name from nzmdwr.js to tkiaccj.png for pine tree state,28,37,41,52
can you rename data/xognojqb.md to new/luntl.docx,15,31,35,49
"rename blbkud.log to ""src/yorb.pdf""",7,17,21,35
hey rename file ndoec.docx into backup/vsrusrc.png,16,26,32,50
okay could you rename ciqoxy.txt as vpsja.log right,22,32,36,45
can you rename gmlceagx.log to ptbeer.csv for me,15,27,31,41
please rename data/zwtepd.txt as v2/sfjjf.docx please,14,29,33,46
please change computer file name from logs/ira.png to tmp/uzgeuezo.jpg please,38,50,54,70
rename file yqkbjgc.docx into data/zoebbijm.md for me,12,24,30,46
"ok could you rename ""tuifpw.js"" as logs/spzlx.log directly",20,31,35,49
"update the name of ""new/vbgxn.png"" to src/kbecyvb.log please",19,34,38,53
can you could you rename old/dngh.json as new/jtetmjr.json please,25,38,42,58
okey could you rename data/ycs.log as ujwntc.txt for me,22,34,38,48
rename new/paq.js as backup/ndadyw.js please,7,17,21,37
update the name of ifhhy.txt to voirz.docx,19,28,32,42
"okay could you rename v1/omjfcrs.txt as ""ozjdctw.log"" please",22,36,40,53
okay modification yyg.csv to nipwaf.json for me,18,25,29,40
rename file faichrfb.docx into src/vmobvdv.py,12,25,31,45
change filename from aopjcmz.json to project/gnhxw.csv please,21,33,37,54
"hey rename exwylmem.txt to ""old/iwqe.png"" for me",11,23,27,41
"okeh rename tmp/bouc.txt to ""uppyq.js""",12,24,28,38
okey change computer file name from v1/ozc.txt to ufdjqnrl.json for me,36,46,50,63
"okay rename file iimsnun.png into ""upulxuu.pdf"" for me",17,28,34,47
end you rename file jxvdype.csv into logs/cmqtnwym.md at present,20,31,37,53
"rename file qgapiyee.js into ""src/gmdpnc.js""",12,23,29,44
please rename new/yptvm.js to yzwauixg.png please,14,26,30,42
rename hhjypdu.jpg as jflluh.json,7,18,22,33
"please rename xkhejnkn.csv to ""v2/zdlqlvll.docx"" for me",14,26,30,48
can you modification vjfmmext.py to old/klprj.jpg please,21,32,36,49
"can you change ""ynx.csv"" to ""v2/jdpiuonn.log"" forthwith",15,24,28,45
please change computer filename from rxdz.log to yxzczwcp.json,37,45,49,62
please rename lnuwrvfe.py as evhhdxg.md for me,14,25,29,39
"please ace privation to rename ""data/qrfycit.txt"" to dgkornk.pdf for me",31,49,53,64
"can you could you rename ""mthxiru.json"" as vvk.py now",25,39,43,49
okay update the epithet of rfwyu.py to v2/nvitl.py now,27,35,39,50
"hey rename cxxbl.json as ""mubbr.csv"" please",11,21,25,36
"okay rename file ""looxkal.pdf"" into nauf.png now",17,30,36,44
variety file from qwn.csv to ygnungmq.csv for me,18,25,29,41
"hey could you rename ""project/mmoedgcj.docx"" as ""logs/opioje.pdf"" for me",21,44,48,65
please could you rename src/vdvhqhu.txt as xqnxgs.py please,24,39,43,52
"okay 1 want to rename old/zbf.js to ""ufzsc.png"" please",22,32,36,47
nates you change filename from src/xmhwzn.py to logs/yfieqvu.txt,31,44,48,64
can you rename kiiorzi.jpg as ipb.md please,15,26,30,36
"please update the name of ""dei.docx"" to ajwsfp.md for me",26,36,40,49
"can you rename file ""saxq.docx"" into ""jwiwtd.json""",20,31,37,50
can you rename backup/rfye.jpg as backup/ffzino.pdf,15,30,34,51
please change vtnymod.csv to ouumfrml.json for me,14,25,29,42
"can you rename ""src/wpk.docx"" to data/sdiajvw.txt now",15,29,33,49
can you update the name of gved.py to tmp/hnpx.py,27,34,38,49
hey alteration suh.jpg to tmp/sxr.pdf,15,22,26,37
"hey change filename from dwqmd.log to ""old/bcppap.pdf"" today",25,34,38,54
could you rename tqag.jpg as laajnvm.csv for me,17,25,29,40
please rename tmp/yqxwspn.pdf as jnnqrmd.jpg for me,14,29,33,44
"hey rename ""new/ivxfpcz.jpg"" as ""vdqecyy.json"" now",11,28,32,46
could you rename old/ukna.md as src/jxern.txt,17,28,32,45
okay could you rename lcx.log as mie.pdf please,22,29,33,40
hey rename arp.docx to jjztsr.js please,11,19,23,32
rename hmmy.md to project/iwjpieok.csv now,7,14,18,38
"okay change filename from uut.pdf to ""bcxqjouc.pdf"" now",26,33,37,51
please i privation to rename ttsmcch.pdf to src/mspohrc.txt,29,40,44,59
"okay atomic number 53 deficiency to rename ""data/swcytsw.js"" to ""project/rpsqab.json"" for pine tree state",43,60,64,85
rename old/xylafmk.log as cmyqm.py now,7,22,26,34
"o.k. rename file ""v2/xccnkcz.py"" into ""vpwgadn.png"" now",17,32,38,51
"hey rename src/olqdut.js to ""old/yvie.json"" please",11,24,28,43
hey update the name of v2/vzzp.json to dsklup.pdf please,23,35,39,49
"hey change filename from new/xiz.csv to ""dchhwruf.png"" today",25,36,40,54
"okay atomic number 53 neediness to rename backup/mkhdx.log to ""lda.txt"" forthwith",42,58,62,71
"please change ""backup/otrurb.jpg"" to isqe.js now",14,33,37,44
hey rename backup/jrgbynt.jpg to rnlwm.csv,11,29,33,42
hey iodine want to rename qyswelma.csv to zryjv.js please,26,38,42,50
"change ""pne.csv"" to ""odp.docx"" now",7,16,20,30
posterior you could you rename tmp/zlot.log as mwkb.js for me,31,43,47,54
"okay i want to rename hglaqr.pdf to ""src/bqrpdmgd.txt"" for maine",22,32,36,54
hey update the name of urzqxarw.log to v2/aos.docx for pine tree state,23,35,39,50
"can you rename file ""old/menq.json"" into ""logs/kme.js""",20,35,41,54
can you alteration uufnqv.log to jwvbhd.docx now,19,29,33,44
okay rename file src/wrkgp.log into sqnf.pdf please,17,30,36,44
"change filename from ""azy.txt"" to v1/has.log please",21,30,34,44
please update the name of project/lxedv.py to cdnjrjk.log for tree state,26,42,46,57
change ampjyfb.txt to v2/dttt.docx now,7,18,22,34
hey iodin want to rename tmp/nqcd.pdf to uok.txt for pine tree state,25,37,41,48
change src/tdnll.log to new/hxd.txt,7,20,24,35
"hey update the name of ""aupparah.docx"" to tmp/sch.log now",23,38,42,53
rename gpmirk.png to lcvp.jpg,7,17,21,29
please rename v1/weiuxgl.docx to new/wxrd.json for me,14,29,33,46
"okay i want to rename ""backup/ztgz.txt"" to ""zggc.csv""",22,39,43,53
rename tmp/aykf.png as project/cietxu.docx for me,7,19,23,42
can you could you rename src/hlvu.py as xlfw.png today,25,36,40,48
rename dlaaihc.json to pqmnz.png,7,19,23,32
"please rename file ""ouubpqni.docx"" into ""ozptltrn.log""",19,34,40,54
hey modification filename from ison.docx to whct.txt for me,31,40,44,52
"hey rename data file galhjlee.pdf into ""qdvfpfqb.js"" for me",21,33,39,52
"i want to rename ""tdasz.md"" to ""v2/hiknn.js"" for me",17,27,31,44
please rename ybtthin.json as tmp/uoyays.log please,14,26,30,44
please could you rename src/ghbvhln.md as fdb.csv,24,38,42,49
change filename from data/pmowam.py to project/cmmq.js,21,35,39,54
can you i neediness to rename rhut.docx to v1/dphpj.json now,30,39,43,56
"hey rename tmp/ndwbes.js as ""v2/rhuq.csv"" please",11,24,28,41
"can you change ""odxjpba.js"" to v2/rmxcblde.log today",15,27,31,46
"okay modification ""v1/mexsbl.docx"" to jve.csv",18,34,38,45
"please change filename from v2/mzfgov.log to ""dxcau.txt"" please",28,41,45,56
okeh rename new/msfeluo.jpg as project/emrpkif.txt instantly,12,27,31,50
"okey could you rename ""ube.md"" as wazive.js now",22,30,34,43
change filename from v1/itbktlj.py to buya.jpg now,21,34,38,46
"please update the name of uzfbm.md to ""fbciys.py"" for me",26,34,38,49
hey modification filename from edolsj.js to data/rddwrjnj.md for me,31,40,44,60
"hey change ""old/mldazzq.py"" to qrbnst.py straight off",11,27,31,40
"okay rename ""src/ulyofl.jpg"" to cnz.py",12,28,32,38
can you change pjipacnx.jpg to okkdpp.jpg now,15,27,31,41
please change computer from logs/zajt.docx to xlvpphgr.docx please,28,42,46,59
hey update the public figure of yvu.js to gmc.docx instantly,32,38,42,50
okay update the epithet of tahhupge.pdf to project/gxt.pdf please,27,39,43,58
"rename ""dzv.docx"" to ""egfz.log"" straightaway",7,17,21,31
"change filename from ""logs/oerqpyr.js"" to dtrwed.log for me",21,38,42,52
"please update the figure of ""v1/eyxqjcl.json"" to xngvbr.csv now",28,45,49,59
please unity deprivation to rename rggh.png to bozshqc.png for pine tree state,35,43,47,58
hey could you rename v2/fxeqw.log as logs/auiiwfe.jpg please,21,33,37,53
"can you rename ""ejajdyr.json"" as zntlqgo.md for me",15,29,33,43
"okay could you rename ""ptviisz.json"" as igdv.png for me",22,36,40,48
"can you rename wmcyi.docx to ""tmctksb.docx"" instantly",15,25,29,43
"rename file fkugouy.csv into ""ylqtv.pdf"" for pine tree state",12,23,29,40
rename tmp/kfluk.md as ukljx.js now,7,19,23,31
"okay i privation to rename tuhjab.pdf to ""biijuc.txt"" for me",27,37,41,53
please rename file nyhly.png into mtcx.txt for me,19,28,34,42
okay iodin need to rename ddabv.py to logs/mgrr.csv for me,26,34,38,51
okay could you rename kodga.py as data/fcponjo.docx,22,30,34,51
could you rename qnnnjfj.jpg as qshudev.md for me,17,28,32,42
hey rename mhqlyje.jpg as src/lbs.jpg now,11,22,26,37
"could you rename ""v2/qdsva.png"" as knilvp.jpg now",17,31,35,45
hey rename xezhtijv.jpg to uwszbmhe.pdf please,11,23,27,39
hey i want to rename zbzr.csv to data/avzodg.jpg please,21,29,33,48
please i want to rename new/sus.jpg to src/eyxfffm.md for maine,24,35,39,53
rename fqlenn.pdf to mpw.csv,7,17,21,28
"please i want to rename ""backup/qudbx.jpg"" to ""src/hmwm.txt"" please",24,42,46,60
can you rename logs/knxmjxhj.txt as vtnzbzg.js,15,32,36,46
"hey update the gens of mqx.jpg to ""logs/tgqosx.md"" for me",23,30,34,50
"hey change filename from ""hqhjybo.py"" to ""v2/spoya.csv"" forthwith",25,37,41,55
"please rename new/lsdy.csv as ""hjq.json"" for me",14,26,30,40
please iodine want to rename qllpg.json to project/mcheg.docx,29,39,43,61
"please i want to rename ""awr.docx"" to grw.docx for me",24,34,38,46
"can you rename backup/megvd.py to ""fwhtwr.png"" now",15,30,34,46
modification gmpokd.log to src/whv.py for me,13,23,27,37
"okay change ""pgpl.md"" to cmuh.png please",12,21,25,33
"can you alteration filename from ibkpnzsb.docx to ""ferbni.jpg""",33,46,50,62
change filename from ecaml.md to zlmpcbrk.js,21,29,33,44
"please change ""twdjzfsg.txt"" to ""vsjw.txt"" straightaway",14,28,32,42
"posterior you could you rename pezcdn.jpg as ""v2/khixfqz.docx"" please",31,41,45,62
"please change filename from ""svsvbhw.json"" to logs/naidowo.jpg for pine tree state",28,42,46,62
rename lryvckk.txt as old/hdcjg.log,7,18,22,35
please rename tmp/vuhufsbq.txt to bqg.jpg for me,14,30,34,41
commode you change oun.js to lqxjsrml.js now,19,25,29,40
please change v2/wxek.js to zil.jpg now,14,24,28,35
"please rename ""tmp/tftkkx.png"" as new/pkbmqvyy.png please",14,30,34,50
"okay change file name from project/qsrsukyx.txt to ""data/miqvcmc.md"" please",27,47,51,68
hey i want to rename cldmuoj.js to gqzwkpl.md now,21,31,35,45
can you could you rename old/lihrldlt.js as wmfax.docx,25,40,44,54
"can you rename ""v2/fcr.json"" as nbtay.txt for pine tree state",15,28,32,41
"hey update the name of hjzs.js to ""rkwthcf.docx"" instantly",23,30,34,48
rename fmfvfzc.log as v1/pgnpbbfk.jpg now,7,18,22,37
rename file szzpbqc.jpg into koxkes.png now,12,23,29,39
"hey rename file ""logs/gkqcp.js"" into old/zgf.js for me",16,31,37,47
can you change filename from ypa.jpg to logs/hdbxoxx.docx,29,36,40,57
okay rename pqm.md as fbcrirp.md please,12,18,22,32
okay could you rename cyyzeic.txt as jffr.txt please,22,33,37,45
"rename gvkwo.log as ""v2/oeal.txt"" now",7,16,20,33
can you alteration filename from orwgbpnr.js to v2/edx.json now,33,44,48,59
"okay change ""okp.csv"" to tmp/mofwenrq.py for me",12,21,25,40
hey rename weqfxwiv.py as backup/ebcy.json please,11,22,26,42
rename ospkvf.txt as project/uumq.txt,7,17,21,37
can you variety filename from whl.txt to rjd.json please,30,37,41,49
tooshie you update the name of new/ctwf.log to fmpq.md,31,43,47,54
toilet you could you rename uujb.docx as project/qkiuyc.json,28,37,41,60
"keister you rename ""nrs.log"" to ajgx.jpg please",19,28,32,40
"rear end you could you rename ""vluqd.csv"" as ijsgxdm.csv now",30,41,45,56
"please rename file dyii.png into ""vuqsc.jpg""",19,27,33,44
hey could you rename pwxjhkaz.json as qtnzhiwv.png please,21,34,38,50
"can you single want to rename ""eheedc.json"" to src/qrnpzy.js",30,43,47,60
"please modification ""zuo.json"" to ljeq.json now",20,30,34,43
"hey could you rename ksrwrd.py as ""backup/wyp.pdf"" now",21,30,34,50
okay rename lxbc.pdf to nqwycrt.png,12,20,24,35
"can you rename ""new/pfmzhw.json"" as clotty.js",15,32,36,45
okay rename file zrkm.json into gkypqfo.js right away,17,26,32,42
"please rename file ""sgalex.csv"" into ""steatbt.log""",19,31,37,50
hey rename new/mcg.txt to v2/llshque.log,11,22,26,40
please rename vulz.md as eujnrl.png please,14,21,25,35
"okeh rename file ""tmp/rtqey.pdf"" into ""wbmwiop.docx"" now",17,32,38,52
can you change pgw.jpg to tmp/xfvksnk.pdf,15,22,26,41
change filename from src/zbsxa.log to new/qjzvipka.txt,21,34,38,54
okay update the name of reokfqu.md to uoec.py please,24,34,38,45
. k. rename new/ggyqmaf.json as lopfaqgq.md now,12,28,32,43
okay could you rename ktamp.png as gebvde.log please,22,31,35,45
okay alteration file name from new/oxscmlw.txt to hjsag.jpg for maine,31,46,50,59
"okay update the public figure of ""lxzbyqjc.md"" to backup/yhc.js please",33,46,50,63
"okay rename indian ""knmht.log"" into qlgshadv.log please",19,30,36,48
hey rename pswpl.docx as cbpnt.txt please,11,21,25,34
rename gwc.pdf as uvue.docx,7,14,18,27
update the gens of rypb.docx to tmp/acusnal.docx,19,28,32,48
"hey i want to rename ""ondv.csv"" to hpoplxch.png",21,31,35,47
i want to rename data/hde.log to zzzto.csv now,17,29,33,42
hey could you rename ilhk.png as backup/eyycwch.csv forthwith,21,29,33,51
change file name from auyj.json to khsmvpin.jpg instantly,22,31,35,47
hey change src/fqwy.js to ngefzvms.jpg,11,22,26,38
"okay rename wejydbz.py to ""jfqu.jpg"" please",12,22,26,36
"update the name of project/pocub.jpg to ""sigyqkmf.md"" at once",19,36,40,53
okay update the name of znhuluzi.csv to yqo.log for tree state,24,36,40,47
"rename chql.py to ""ygb.png"" for me",7,14,18,27
"okay change filename from ""v2/guqeg.js"" to wtegdfav.png now",26,39,43,55
"sack you rename ""hmtex.js"" as ""tmp/tgbu.csv""",16,26,30,44
"alteration src/pfio.jpg to ""v2/zkibrhw.txt"" for me",11,23,27,43
"okay change filename from ""new/xny.py"" to ""tsgigy.png"" please",26,38,42,54
"please i want to rename xcxr.csv to ""depjd.png""",24,32,36,47
"change ""lwbf.txt"" to v1/uzr.log for me",7,17,21,31
"hey change filename from ""hks.png"" to project/dcwpq.txt please",25,34,38,55
"please update the gens of ""atour.jpg"" to kjac.json please",26,37,41,50
please could you rename new/cso.png as new/fiaa.pdf please,24,35,39,51
hey could you rename osqbdsv.js as txvvrla.jpg,21,31,35,46
"okay i want to rename ""tmp/zswswrr.log"" to ""lsks.log"" for maine",22,39,43,53
"please rename new/fspry.csv as ""v1/tevgit.jpg""",14,27,31,46
"okay modification filename from ""backup/vnzegjqn.docx"" to ahr.txt immediately",32,54,58,65
"can you rename file mjg.py into ""ptfsw.txt"" at present",20,26,32,43
hey rename single file cmfau.log into zkukvnp.png please,23,32,38,49
hey rename data/czrubvnk.pdf as tmp/anz.md for me,11,28,32,42
can you change logs/vmrwdz.md to project/rvg.csv now,15,29,33,48
"please i want to rename data/uewn.pdf to ""src/gguks.md"" for pine tree",24,37,41,55
please update the name of tfg.csv to old/qgrz.js for maine,26,33,37,48
"please change ""ojwhamt.py"" to ""maolt.log"" please",14,26,30,41
change project/bupkm.py to bfdofik.csv now,7,23,27,38
please rename project/ydnwvqr.md as data/urx.jpg please,14,32,36,48
can you atomic number 53 want to rename data/chwr.log to zpdnnnzb.txt,40,53,57,69
"rename ""v1/xdndkztm.txt"" as zudocq.txt for me",7,24,28,38
"please rename ""jyeckq.csv"" as xnsxu.json for me",14,26,30,40
hey alteration iasrdwt.log to esea.json for me,15,26,30,39
"hey change filename from ""v2/xvxc.js"" to cfmunq.pdf for me",25,37,41,51
"hey change data/yllr.log to ""v1/bihnqi.txt"" for maine",11,24,28,43
"could you rename ""data/uenjkt.log"" as ""aykxfjau.csv"" now",17,34,38,52
rename file tgqcr.png into v1/ztm.md now,12,21,27,36
update the name of jfck.jpg to koukuhgy.py now,19,27,31,42
"hey could you rename project/idhoa.txt as ""v2/ajej.json"" please",21,38,42,56
"hey rename fpjhvfq.jpg as ""data/asfmi.pdf"" please",11,22,26,42
"change computer filename from ""aibwfsel.js"" to src/piyfmjau.csv directly",30,43,47,63
okay rename file jibmo.jpg into logs/khkvk.json,17,26,32,47
could you rename v2/wfi.txt as old/htrv.docx please,17,27,31,44
please rename project/kub.py as src/clif.log for me,14,28,32,44
"hey could you rename cjgt.json as ""old/ohvcfp.csv"" for maine",21,30,34,50
please rename data/paknhvkd.md to tmp/knthybr.js right away,14,30,34,48
could you rename backup/sswbdp.jpg as backup/zdbeyjd.jpg,17,34,38,56
"can you could you rename uaooo.png as ""ecc.txt"" forthwith",25,34,38,47
hey change qycgmtxx.py to v2/snwirbp.log please,11,22,26,40
"okay rename single file jbte.csv into ""old/yklf.csv"" now",24,32,38,52
"please rename ""bhp.log"" as ""hupcpj.jpg"" now",14,23,27,39
update the name of ruqxx.txt to old/szazxw.docx please,19,28,32,47
okay rename zxofnbo.py as vwcdhlr.md now,12,22,26,36
"hey update the figure of ""ercmbow.js"" to ivfm.js please",25,37,41,48
"change computer filename from ""ltop.log"" to ""mxrhpxsx.png"" please",30,40,44,58
hey rename project/xhvxgo.js to djv.log please,11,28,32,39
"hey i want to rename jvu.pdf to ""v1/phkmdfp.py"" now",21,28,32,47
"can you update the name of owhqcn.json to ""vcqulzco.docx"" please",27,38,42,57
"can you could you rename wlasx.js as ""v1/feh.py""",25,33,37,48
"change ""v1/hnshtvgz.json"" to kbsaqira.csv directly",7,25,29,41
"can you update the name of sppm.csv to ""izlzqwg.js"" right away",27,35,39,51
rename file esimg.py into tmp/hugz.jpg directly,12,20,26,38
please update the name of gtzwkb.docx to new/yfrxpqcr.md please,26,37,41,56
"can you atomic 53 want to rename uxdbwpjq.json to ""v1/gmgl.pdf"" now",33,46,50,63
"okay change ""v2/cddzlo.js"" to ""project/srgoh.jpg"" for me",12,26,30,49
please rename file fznun.jpg into wts.js,19,28,34,40
"hey rename finwz.json to ""nvihto.md""",11,21,25,36
please change src/vmrmla.docx to kyruuyx.txt,14,29,33,44
rename backup/jqobtost.md as otn.txt for me,7,25,29,36
"hey change filename from tpnox.json to ""yjnif.py"" please",25,35,39,49
can you rename dplacts.md to src/mtaawg.png,15,25,29,43
hey could you rename cxknk.txt as uhjt.py,21,30,34,41
"rename v2/wkjfyhfp.js as ""src/xwubsng.md""",7,21,25,41
potty you could you rename src/xjc.json as gsew.pdf,27,39,43,51
please change filename from fxjso.py to pllgic.py for maine,28,36,40,49
"modification ""rimpazg.json"" to nsfz.log please",13,27,31,39
"hey change filename from data/ytqcprq.log to ""lebevpu.md""",25,41,45,57
"hey unity want to rename new/sfz.csv to ""project/meuoyyw.pdf""",25,36,40,61
can you rename project/rbwmwuv.js as qmtxrkq.jpg now,15,33,37,48
"can you update the name of ""nkxqjfh.json"" to logs/huaqby.txt for me",27,41,45,60
hey rename gsljxbl.log as project/cwtanvus.jpg please,11,22,26,46
hey rename sefsqit.docx as tmp/qnymgg.png for me,11,23,27,41
"please could you rename ojrlieak.pdf as ""allxu.js""",24,36,40,50
"can you update the name of ""yymtqofm.csv"" to aojgrjqo.log please",27,41,45,57
"hey rename ""new/uqwrwdej.json"" to ""snnlim.docx"" please",11,30,34,47
"okey variety filename from ""logs/ogrqs.jpg"" to ""v2/gybkyzig.json"" directly",27,43,47,65
please 1 privation to rename data/vdmwqaz.docx to wxrqedon.csv now,29,46,50,62
"please i want to rename ""zwqn.pdf"" to new/vtfh.js now",24,34,38,49
hey change filename from xykt.log to v1/dipslhjk.docx now,25,33,37,53
tail end you change computer file name from wepdg.log to old/kfuoq.png,44,53,57,70
please rename data file backup/hpgxrpd.log into vlmphj.pdf straightaway,24,42,48,58
"please rename hmp.json as ""old/pknp.jpg"" at",14,22,26,40
"change zefbvip.txt to ""nphsucvn.log"" now",7,18,22,36
"tin you change filename from data/wqw.pdf to ""uze.md"" for me",29,41,45,53
"can you change ""omnzsj.pdf"" to v1/kthlme.js please",15,27,31,43
"hey rename ""ior.pdf"" as logs/eyt.log please",11,20,24,36
can you i want to rename new/rpv.csv to project/qnpp.docx for pine tree state,25,36,40,57
please rename sjafvndm.log as jewoaulj.md,14,26,30,41
can you rename wodgk.jpg to zwgk.py now,15,24,28,35
please change filename from qhbe.pdf to hxjgby.js,28,36,40,49
"rename ""xst.log"" to und.png",7,16,20,27
"okay rename ""backup/czk.csv"" as ""ngith.png"" please",12,28,32,43
please rename fdy.js as fpddyh.log,14,20,24,34
canful you could you rename qncrjnhr.json as goqyongk.txt now,28,41,45,57
okay rename gwj.pdf to v1/qhju.jpg,12,19,23,34
okay change file name from dlp.pdf to data/ptauroa.png for me,27,34,38,54
rename jumfemhv.docx as znyfm.py,7,20,24,32
rename fisfj.jpg as zzlxqcp.md now,7,16,20,30
hey rename tmp/bojyhv.log to iaiy.jpg for me,11,25,29,37
"rename ""vzd.pdf"" to ""logs/roo.json"" for me",7,16,20,35
"change new/vrlohfdj.log to ""xel.png"" please",7,23,27,36
"hey rename ""tmp/lqg.js"" as era.json please",11,23,27,35
could you rename data/vvbnzmso.png as new/rgm.csv straightaway,17,34,38,49
"commode you rename vynthhs.pdf as ""appwj.pdf""",19,30,34,45
okay change computer filename from jwmbeq.json to new/hcznpqbf.md,35,46,50,65
please rename file yzkkwjhh.csv into v1/rvvererp.docx,19,31,37,53
okay update the name of new/rvxurly.py to lzhe.json now,24,38,42,51
"please i want to rename ""vtt.md"" to ""backup/lrir.py"" for maine",24,32,36,52
"hey rename ""src/qqo.py"" as cngg.docx",11,23,27,36
1 privation to rename fqle.js to dsjzliyw.docx,22,29,33,46
tin you rename gyclty.csv as v2/mqxjpahp.txt please,15,25,29,44
"ok change v2/bphwkl.py to ""old/unseihqr.json""",10,22,26,45
"okay rename ""yjmwsagk.json"" to ""ivln.pdf"" for tree state",12,27,31,41
can you i want to rename acjnt.py to backup/vulqm.pdf,25,33,37,53
"give the sack you i want to rename ""oovax.jpg"" to new/scvpcajp.py",35,46,50,65
okay rename vxy.json to logs/zeqnm.png,12,20,24,38
rename file data/bedp.md into pdfg.txt,12,24,30,38
"rename ""vnmodl.py"" to ""oufaayxy.docx"" instantly",7,18,22,37
"please change ""qwjsczw.pdf"" to logs/btyflqje.py",14,27,31,47
"okay change filename from tpgrz.log to ""backup/qcqlfmnr.pdf"" please",26,35,39,60
okey could you rename igupgl.docx as backup/liacs.json now,22,33,37,54
"put up you rename backup/tqvx.png to ""old/skrpv.md"" please",18,33,37,51
"john you update the name of ""backup/gpsalcp.log"" to ""zmq.js"" please",28,48,52,60
could you rename src/bijb.json as naqdo.py for pine state,17,30,34,42
"please update the epithet of new/cxv.docx to ""chjubj.pdf""",29,41,45,57
"okeh rename file ""txzmgab.pdf"" into ""dnkqf.docx"" please",17,30,36,48
can you change vjmbz.docx to v2/mbfe.py for pine tree state,15,25,29,39
. k. modification backup/onb.txt to szkkck.docx straight off,18,32,36,47
"okay change computer filename from jwauf.py to ""backup/mhrijtxh.json"" now",35,43,47,69
hey rename v2/ner.js as lhegtqt.png for maine,11,20,24,35
"hey could you rename ""wyokeuqs.json"" as ""qdksuyx.txt"" for me",21,36,40,53
please update the public figure of coqfbrlr.csv to nnn.docx for me,35,47,51,59
"okay update the name of lerxdr.py to ""v2/hfmrzo.png"" please",24,33,37,52
"rename dzs.png to ""treoi.pdf"" for me",7,14,18,29
hey could you rename ssorb.log as data/jgqf.js now,21,30,34,46
please rename vexcapcx.pdf to ikqmiym.log please,14,26,30,41
hey rename data file lttlwpgu.md into v2/qcc.csv please,21,32,38,48
hey modification file name from project/gby.py to backup/bwroupvm.docx,32,46,50,70
"could you rename ""ghrr.csv"" as hgnedq.txt",17,27,31,41
"okay rename iexf.png to ""yunmqk.md""",12,20,24,35
"could you rename ""new/umr.png"" as tjudtlf.py for me",17,30,34,44
"can you variety filename from ""uctdu.log"" to umoiv.png",30,41,45,54
rename tmp/eucadi.txt to src/czqikzo.md for me,7,21,25,39
"okay modification ""wgdtxriv.js"" to eespix.docx nowadays",18,31,35,46
okeh update the name of bzdmrxa.json to zsop.json please,24,36,40,49
can you modification filename from tmp/ydntsu.docx to umcjk.csv please,35,50,54,63
"please rename src/jmrxro.json as ""old/ndjmwr.jpg"" now",14,29,33,49
rename wvzyegy.pdf to old/eenj.json,7,18,22,35
"okay update the name of ""src/fhyotq.js"" to data/dcsgzke.md",24,39,43,58
i want to rename src/koaqktwm.js to jxeica.txt now,17,32,36,46
hey change myrgqn.docx to wko.pdf now,11,22,26,33
"okay update the name of ""data/thgfsmm.log"" to ""qaxcv.pdf"" for maine",24,42,46,57
hey update the name of jiu.jpg to xfzo.md right away,23,30,34,41
tin you change v1/jtfu.json to tlkkpjuc.txt please,15,27,31,43
please could you rename v2/bqia.json as adm.json now,24,36,40,48
update the name of febd.log to data/twubh.py now,19,27,31,44
hey i want to rename dyarkbsj.log to tmp/qeqetvzh.pdf for me,21,33,37,53
crapper you rename project/ehjjdhk.jpg as project/gkpp.jpg please,19,38,42,58
"hey rename fbuvyd.txt as ""tbdwu.js""",11,21,25,35
"can you update the gens of ""uqrh.json"" to ""fyghitls.js"" now",27,38,42,55
"okay update the name of tmp/uyhwfgr.docx to ""data/eucxhrp.csv"" now",24,40,44,62
okey change filename from xthvujrn.json to sbqbuw.py please,26,39,43,52
"please update the name of ""project/cgfuaoh.md"" to backup/rlebqp.py like a",26,46,50,66
hey rename indian file kigqocj.jpg into hetj.md for me,23,34,40,47
okay change filename from project/vxhcmm.csv to kzsjrq.md,26,44,48,57
"hey rename ""ksbivhek.txt"" as qinxlt.log now",11,25,29,39
"can you atomic number 53 wishing to rename ""src/yvdi.json"" to ""v1/hbfxh.csv""",43,58,62,76
"hey rename file ""phupzjse.pdf"" into ""ydvrcy.py"" please",16,30,36,47
hey rename edbyvz.png as vdwo.pdf,11,21,25,33
o.k. rename logs/wtevkz.json to guhobz.csv,12,28,32,42
please rename czweseh.csv to src/mujua.md please,14,25,29,41
hey i want to rename backup/jzx.jpg to new/itgtbof.json now,21,35,39,55
"please rename oobw.docx as ""backup/gtta.md"" for me",14,23,27,43
"can you alteration old/fgtyzi.txt to ""gixq.log""",19,33,37,47
