text,src_start,src_end,dst_start,dst_end
"hey rename ""new/hur.json"" as kxitd.json for pine tree state",11,25,29,39
"can you update the epithet of vzjkbj.py to ""old/lwn.json"" for me",30,39,43,57
change ynl.js to qybgrwm.jpg,7,13,17,28
"okay rename ""tmp/uqibyydh.jpg"" to fafp.csv for me",12,30,34,42
"okay could you rename logs/rblckcas.json as ""new/wdakdi.md"" please",22,40,44,59
"please rename ""ogq.log"" as nyjepj.py now",14,23,27,36
"change filename from zze.md to ""logs/qpazf.log"" nowadays",21,27,31,47
o.k. rename mqtqp.jpg as vmrp.csv for me,12,21,25,33
"please change computer filename from src/yamjaz.txt to ""rnh.docx"" please",37,51,55,65
"rename file twapusjm.json into ""qnxtsk.png"" please",12,25,31,43
update the gens of ghzf.png to svpsxn.json,19,27,31,42
please change computer file name from gagn.pdf to fjczxpo.jpg,38,46,50,61
"okay update the gens of ""backup/pzuut.md"" to ""zuevmsv.json"" please",24,41,45,59
can you rename v1/xckzubz.docx as bpwgckzb.log,15,30,34,46
"okeh could you rename raxfzi.pdf as ""mpxpwakm.jpg"" now",22,32,36,50
please could you rename ogbxgw.docx as v1/jpmj.log,24,35,39,50
hey rename yhyhmll.png as bci.png,11,22,26,33
"okay change ""knudbijs.pdf"" to jlevcvz.js now",12,26,30,40
okay i neediness to rename tmp/kibnti.log to new/uvwplh.docx please,27,41,45,60
"change momjoaq.txt to ""jcvwsvry.png"" please",7,18,22,36
"ok rename pfbobil.jpg as ""tczggdv.md"" now",10,21,25,37
"okey alteration filename from data/zvzw.json to ""kfqw.jpg"" please",30,44,48,58
rename qqaav.csv as old/oih.txt at present,7,16,20,31
okey iodine want to rename wng.js to tmp/gcvgm.csv now,27,33,37,50
"can you change tmp/ezndk.txt to ""v1/etd.md"" for maine",15,28,32,43
update the epithet of lrxdya.docx to tmp/xjwssmm.docx please,22,33,37,53
"fanny you could you rename ""v2/uvuhbxcf.txt"" as ""aadyf.jpg"" please",27,44,48,59
"okay rename file v1/jwp.md into ""logs/whm.md"" now",17,26,32,45
"please rename filing cabinet ""v1/lptyfyx.js"" into data/vmswkn.csv please",29,44,50,65
please change filename from wtqw.png to mvzr.jpg now,28,36,40,48
"rename file ""rqr.csv"" into ""oyczxvb.log"" please",12,21,27,40
"rename file aktn.log into ""wqqnndpx.pdf""",12,20,26,40
"please rename file idqbd.txt into ""old/gcihc.docx""",19,28,34,50
"can you could you rename sdoyx.json as ""pwivcwjp.docx"" for me",25,35,39,54
"can you rename ""old/idyvup.docx"" as old/hhpcu.js for me",15,32,36,48
"hey rename file ""upcy.json"" into ""project/rdirpm.md""",16,27,33,52
update the name of lntmpf.txt to src/wdbmfgdj.docx now,19,29,33,50
"variety ""wcvetkx.js"" to ""lwp.json"" for maine",8,20,24,34
"please change ""new/tldq.txt"" to pfyxhsc.js please",14,28,32,42
"hey could you rename dtldjffu.jpg as ""cyot.pdf"" please",21,33,37,47
change filename from mfvhrtr.md to vuqrmq.json,21,31,35,46
can you rename file src/nsuw.csv into newmyff.json for me,20,32,38,50
please change xqv.pdf to v2/bfja.docx now,14,21,25,37
"please could you rename ""zpsmqgbq.png"" as v2/fix.log",24,38,42,52
"please rename file ""data/zgbslcs.txt"" into ""mlmefd.txt"" please",19,37,43,55
okay rename v1/faquhs.md to logs/umisw.md for me,12,24,28,41
"hey could you rename ""jcgulo.log"" as embsus.js now",21,33,37,46
"rename ""data/nvd.py"" as gasktwh.md",7,20,24,34
"can you i deficiency to rename ""src/ijmr.jpg"" to zpsqkw.md",31,45,49,58
"please update the name of nworosd.md to ""mti.png"" now",26,36,40,49
rename ziyp.txt as ans.py for me,7,15,19,25
"please rename file ""ajdls.json"" into ""vodltbyn.py""",19,31,37,50
"okay rename file ""src/mga.json"" into vxl.docx",17,31,37,45
"rename data file ""yzdashna.txt"" into src/skw.pdf",17,31,37,48
"okay alteration ""gnitla.py"" to qmpi.docx",16,27,31,40
"please update the name of ""logs/xejej.csv"" to v2/uquqwsm.log for maine",26,42,46,60
"hey rename zdtydc.png as ""lvktt.txt"" for maine",11,21,25,36
"could you rename ""logs/cvpnhmml.jpg"" as nbsdlbtw.md like a shot",17,36,40,51
"change ""v1/sgftwgwg.py"" to seprvyqn.pdf",7,23,27,39
okay update the name of v2/qrn.pdf to v1/fnom.js please,24,34,38,48
please rename old/jiyj.md as v1/xdamjcxn.log now,14,25,29,44
"can you unity wish to rename ""kyyioksm.csv"" to igraj.json",29,43,47,57
"rename file ""fusuhabz.png"" into mdnm.pdf please",12,26,32,40
"atomic number 53 want to rename ""logs/okyaq.png"" to ""hpo.md"" please",32,48,52,60
rename project/wetfvsj.js to kygtwuue.json,7,25,29,42
"throne you rename file v2/tiqovxe.log into ""ecpypkch.log""",23,37,43,57
hey change file name from backup/dttykrin.log to new/gge.pdf immediately,26,45,49,60
please i want to rename data/fvjxej.csv to new/bdki.py for me,24,39,43,54
hey rename v1/ode.pdf as old/xfgom.csv for me,11,21,25,38
can you unity need to rename cndzo.png to flvu.docx directly,29,38,42,51
"rename euld.log as ""fpee.jpg"" now",7,15,19,29
"okay update the public figure of new/cxrxld.png to ""muemegbm.log"" now",33,47,51,65
okeh rename logs/heoxqa.pdf to wckzzklm.md please,12,27,31,42
"can you could you rename ""old/eswikop.docx"" as ""qiwvq.csv"" please",25,43,47,58
"okay could you rename ""dtllazi.pdf"" as ""zdy.csv"" for me",22,35,39,48
update the name of old/haenkyrc.log to etua.txt for me,19,35,39,47
okay change new/rpt.csv to aolyr.csv now,12,23,27,36
"please 1 lack to rename ""jkwk.png"" to ufeggyij.csv now",24,34,38,50
"hey update the name of oajsp.md to ""irigf.json"" now",23,31,35,47
"hey rename single ""igwksehg.docx"" into jou.py now",18,33,39,45
"okay rename data/hlei.docx to ""logs/bnswuaj.txt"" for maine",12,26,30,48
"please change ""pvkor.md"" to ""enzdpr.csv"" for maine",14,24,28,40
okay change falwvt.png to wtfgyvs.png,12,22,26,37
"can you change daoq.jpg to ""oic.md""",15,23,27,35
"okay rename filing cabinet ""vjtnjy.json"" into new/bmlpsg.py for me",27,40,46,59
"can you rename ""v1/toltfbj.json"" as ""old/mepi.jpg"" please",15,32,36,50
"hey single want to rename ""src/omavn.pdf"" to ""mywhjm.jpg""",26,41,45,57
"can you update the figure of gkoiwwxo.json to ""backup/zxhxwhkj.png""",29,42,46,67
"change old/otbgwt.pdf to ""hksy.py"" please",7,21,25,34
update the name of data/bcy.md to bgsner.log for me,19,30,34,44
okay change v1/hkbfmabq.js to pztbctz.jpg please,12,26,30,41
can you update the gens of logs/mndzl.py to tmp/tihzgghb.csv now,27,40,44,60
please alteration ezaeuv.png to exl.log once,18,28,32,39
"can you rename xqbbt.csv as ""mpmvrmv.jpg"" for tree state",15,24,28,41
hey change computer filename from tgn.docx to old/cxsk.jpg for me,34,42,46,58
"hey update the name of ""ypp.jpg"" to mrylois.json for me",23,32,36,48
"rename file wuvi.csv into ""byzmc.json"" now",12,20,26,38
"single deficiency to rename ""old/elccr.csv"" to vtd.jpg now",28,43,47,54
please change filename from project/erkxdva.txt to xsde.json now,28,47,51,60
can you could you rename src/dytawqt.pdf as rnorij.py,25,40,44,53
"can you could you rename pas.docx as ""vxd.pdf""",25,33,37,46
ace want to rename qaqhoqas.json to zflw.pdf for maine,19,32,36,44
could you rename jiu.docx as project/ivog.pdf now,17,25,29,45
"hey change ""ydkiyjdb.json"" to v1/jfzhy.py for me",11,26,30,41
hey could you rename new/eydo.pdf as cvofxk.png,21,33,37,47
could you rename tmp/fchcfls.py as project/jzv.pdf now,17,31,35,50
"hey rename file project/vfcdf.py into ""backup/ctcu.json"" please",16,32,38,56
rename backup/mcllcsf.md as ahes.png please,7,24,28,36
can you rename single file backup/ayppd.py into src/bhmjhih.json for maine,27,42,48,64
please i want to rename wtzxjs.pdf to uuybk.csv for me,24,34,38,47
"okay change ""sopnic.py"" to ""logs/cnu.docx""",12,23,27,42
rename rqkgcmxa.md to gwhmgdm.png please,7,18,22,33
i deficiency to rename src/spw.docx to rpdfz.md please,23,35,39,47
"please i want to rename nhzht.md to ""vxzuumey.png"" for maine",24,32,36,50
hey i want to rename ldyvy.pdf to backup/vzwnuinx.docx please,21,30,34,54
can you rename src/qlsqea.png as new/bfatkw.md please,15,29,33,46
please i wishing to rename tmp/xcxikm.docx to ovzqgoxt.py for pine tree state,27,42,46,57
"can you rename filing cabinet ""tmp/ubaod.jpg"" into ""viecto.js"" for me",30,45,51,62
"hey rename file ""backup/vljp.md"" into tmp/zmmrr.json directly",16,32,38,52
"unity want to rename ""data/zjyosrcl.log"" to ezb.png please",21,40,44,51
okay rename file onc.py into qgdxgoq.csv now,17,23,29,40
prat you i privation to rename new/yegeesm.log to data/somoggl.pdf now,31,46,50,66
"hey modification filename from v2/flgeqs.png to ""envmd.jpg"" now",31,44,48,59
hey 1 deprivation to rename hyehmj.csv to v1/ksiez.log today,28,38,42,54
"hey i want to rename jvkyub.png to ""project/pag.log"" now",21,31,35,52
variety sns.json to rdhrz.png please,8,16,20,29
"hey update the name of ""logs/pxl.py"" to trtcbn.pdf for me",23,36,40,50
can you rename gde.png to cdzzoer.md for maine,15,22,26,36
hey update the name of uqu.csv to pxkctu.md,23,30,34,43
"okay rename file ""project/xhddes.py"" into neb.py please",17,36,42,48
"rename ""old/fihuvenl.docx"" as ""jlnajf.log"" for pine tree state",7,26,30,42
"tush you change qhrxjksr.csv to ""src/ksierb.py"" for me",16,28,32,47
"hey atomic number 53 want to rename ""aaifcegh.csv"" to ""backup/ktxi.jpg"" for pine tree state",36,50,54,71
"please rename skodtsz.txt to ""vfw.png"" please",14,25,29,38
okeh update the figure of lzv.log to backup/igdvmxgz.pdf please,26,33,37,56
rename vcsslpzx.docx as zzey.docx,7,20,24,33
hey rename gdyh.js to v2/chufo.txt,11,18,22,34
"please rename file ""v2/tpesbxfq.py"" into qfdrl.md for me",19,35,41,49
"okeh update the figure of umgmiyr.log to ""old/onmef.py"" for me",26,37,41,55
"hey ace deprivation to rename ""lvlh.json"" to ""zlvaarl.py"" for me",30,41,45,57
"hey rename file ""wymkjux.jpg"" into fgoc.md for maine",16,29,35,42
"can you rename ""tmp/gdzepxw.json"" to xwt.csv please",15,33,37,44
"could you rename wmvc.py as ""new/inaa.pdf""",17,24,28,42
can you rename backup/wvte.docx as bfex.docx,15,31,35,44
hey i privation to rename v1/ajlosdxs.pdf to src/kati.log now,26,41,45,57
hey alteration filename from backup/vjsrlh.png to kydjj.jpg for pine tree state,29,46,50,59
"okay rename jrlr.docx as ""tmp/hfqqwnsp.pdf"" for me",12,21,25,43
rename file ifvbx.csv into old/tsfxvyv.txt,12,21,27,42
"okay rename file nyzeolu.csv into ""data/xinrl.pdf"" for maine",17,28,34,50
"can you rename ""izwdzzid.docx"" as kmkopz.png please",15,30,34,44
okay change file name from v2/fgexyofc.js to dheoyrpg.md now,27,41,45,56
"o.k. change ""xorbnca.txt"" to lhzud.js right away",12,25,29,37
"can you rename data file ygkqms.js into ""jyeqj.docx"" now",25,34,40,52
toilet you modification v2/fgyiu.csv to cybvxix.json,24,36,40,52
rename tmp/ggruu.txt as liad.log please,7,20,24,32
"rename ""backup/znwamug.png"" as foba.png please",7,27,31,39
please rename file nwioksr.jpg into eobyg.json please,19,30,36,46
change name from project/fmdl.docx to pzyh.csv please,17,34,38,46
"hey update the name of oskku.pdf to ""atrb.txt"" please",23,32,36,46
please variety filename from zvijbe.json to uon.js for me,29,40,44,50
"please rename file src/zcmycvl.png into ""xmeiiv.json"" please",19,34,40,53
please rename xzccm.py as eerurqii.log please,14,22,26,38
"rename old/tpxbprz.txt as ""new/sdafa.md"" please",7,22,26,40
hey alteration tmp/pjm.log to project/uhwr.jpg please,15,26,30,46
"out you update the name of ""gacnp.json"" to ""new/ewyeuo.csv"" now",27,39,43,59
"rename ""tmp/hnzlfm.py"" as inn.md please",7,22,26,32
hey i want to rename gunkd.csv to tmp/pinjo.csv please,21,30,34,47
"hey rename ""jdlols.js"" as bevbzu.py please",11,22,26,35
"can you alteration filename from ""v2/rwolgxye.json"" to bdwfdyl.pdf",33,51,55,66
update the name of v2/adzduo.png to hyyjnf.txt for me,19,32,36,46
"hey i want to rename src/wblray.txt to ""tmp/ots.png"" please",21,35,39,52
"hey modification ""fldmuav.js"" to ygajckt.txt for me",17,29,33,44
could you rename ugvpg.png as slyo.py for me,17,26,30,37
"please rename iotiqbsl.png to ""see.docx"" for pine tree state",14,26,30,40
change nnwpccz.txt to data/jmbu.txt please,7,18,22,35
hey update the name of guoer.py to v1/oylv.jpg,23,31,35,46
can you iodin want to rename src/yclkhxx.js to kyq.jpg now,29,43,47,54
hey rename tfx.py as nubuw.docx,11,17,21,31
"okeh i want to rename ""gqoba.json"" to v2/razdu.log immediately",22,34,38,50
please rename v1/yql.docx as v2/vapwek.docx please,14,25,29,43
"can you could you rename ""rkqkjvpc.md"" as data/ejujxv.png for tree state",25,38,42,57
rename file tujdaikr.docx into data/haddlkbo.py,12,25,31,47
can you rename jahag.json as src/yocdtmmr.png,15,25,29,45
behind you rename file tlwqc.pdf into old/epvy.js for me,23,32,38,49
hey update the name of inmsxvj.log to v1/iye.csv now,23,34,38,48
can you rename qxqb.json as luhmhbik.txt,15,24,28,40
can you could you rename baouc.log as old/tmjmsubb.pdf,25,34,38,54
"okay modification ""buhy.txt"" to logs/czcwy.js please",18,28,32,45
"lavatory you rename single file project/opflqvh.pdf into ""demviufy.json"" now",32,51,57,72
"hey could you rename ""kpmx.log"" as ezzxvfn.png",21,31,35,46
"hey change ""ixrwlqnn.pdf"" to tmp/ijwr.js for me",11,25,29,40
"hey could you rename ""src/zyutqw.md"" as onzvqalm.md",21,36,40,51
okay rename logs/mgznzuj.py to data/xkcfd.jpg,12,27,31,45
"hey could you rename ""xyzzkir.jpg"" as knisebuw.py",21,34,38,49
"rename rlric.pdf as ""veuiulqp.csv""",7,16,20,34
"o.k. change computer filename from ""arcy.png"" to tpijlqm.docx now",35,45,49,61
"okay update the name of ""src/zdofrw.js"" to project/pxrs.docx now",24,39,43,60
"can you rename old/hbat.js to ""old/opduusws.py"" please",15,26,30,47
"can you rename file ""v2/lwbnoydd.txt"" into backup/pqgdv.csv please",20,37,43,59
hey change project/rqlkn.py to rmo.js for me,11,27,31,37
"hey rename file ""ulypwcd.log"" into fhoi.jpg now",16,29,35,43
"i want to rename ""vpjey.md"" to tbfjae.jpg",17,27,31,41
can you rename file old/dsgydv.txt into backup/uwbulc.md please,20,34,40,56
"okay could you rename backup/midps.docx as ""new/uugkqt.png""",22,39,43,59
hey i want to rename backup/llysmbg.txt to upy.jpg now,21,39,43,50
"rename single uobg.json into ""logs/okoxkain.pdf"" please",14,23,29,48
"okeh could you rename ""ftlji.log"" as yoffy.docx",22,33,37,47
"can you could you rename snuhfjph.jpg as ""rjpzw.md""",25,37,41,51
rename data/kqvreo.pdf to vqdyaa.md for me,7,22,26,35
please 1 want to rename nppdv.png to new/hgax.png now,24,33,37,49
"please i want to rename ""cbs.docx"" to ""bdk.png"" please",24,34,38,47
"please i want to rename sjddlf.txt to ""xmd.json""",24,34,38,48
change computer file name from project/rjmpxu.js to pmdv.js,31,48,52,59
hey change file name from pcpx.jpg to project/suibmzfm.png,26,34,38,58
okay change atoclm.py to nwtxhv.docx,12,21,25,36
"okey rename wie.js as ""data/ujbswrxp.csv"" please",12,18,22,41
hey rename fwscvm.pdf to tzhqz.py for maine,11,21,25,33
please rename filing cabinet ifrmuk.md into fhwlejxg.csv,29,38,44,56
"i want to rename ""yntcycu.txt"" to project/xhwckvc.pdf now",17,30,34,53
please could you rename tmp/zfnpb.log as yqtzwr.log,24,37,41,51
"okay could you rename new/iitkzcxa.py as ""src/icaqgzi.txt"" now",22,37,41,58
john you change v1/ply.csv to project/ldovzv.md now,16,26,30,47
"okay rename uxzhntgc.txt as ""data/ump.docx"" now",12,24,28,43
"okay update the name of tmp/nsxybb.py to ""new/ulln.jpg"" please",24,37,41,55
"hey update the name of pmrcfvzd.log to ""xepcr.js"" for maine",23,35,39,49
"rename ""bubgf.json"" to v1/nonlkdb.log",7,19,23,37
okay change filename from logs/jkpmwk.csv to backup/utvw.png for me,26,41,45,60
change new/gvzie.png to mmpjyui.docx,7,20,24,36
"can you update the gens of ""v1/gmykyq.py"" to kwy.pdf",27,41,45,52
change computer filename from dqujayer.log to rlizecry.js,30,42,46,57
"rename ""cqmtiwx.pdf"" as uowvtjsk.png now",7,20,24,36
canful you i want to rename tmp/bzf.log to backup/dzfcqib.json nowadays,28,39,43,62
change zalnc.js to new/qfo.js,7,15,19,29
"please update the figure of ""v2/bkpduj.md"" to naoodck.js please",28,42,46,56
"please rename yvj.png as ""inhhooo.json"" please",14,21,25,39
can you rename wxt.png as zyfmn.txt now,15,22,26,35
"hey update the name of ""ytpo.txt"" to tmp/ezpy.pdf please",23,33,37,49
"please i want to rename tpv.docx to ""logs/gshrvjgm.py""",24,32,36,54
hey rename data/gbpmuv.md as tmp/iuew.png,11,25,29,41
please rename file old/hfb.md into hiekindp.jpg,19,29,35,47
hey change file from dop.log to hdqx.js for me,21,28,32,39
"update the name of ""lpc.docx"" to logs/swbhspg.py please",19,29,33,48
rename indian file tmp/mkkrhzde.docx into qowb.js today,19,36,42,49
hey update the name of xwrowrqu.txt to xyhpmcfo.log please,23,35,39,51
"please change file name from ""clwayukz.py"" to ""vjdqmd.jpg"" for me",29,42,46,58
please could you rename hvlt.docx as v1/iambz.md,24,33,37,48
"hey atomic number 53 want to rename ""src/fknlcrc.py"" to ilpwtpp.png",36,52,56,67
"please update the name of ""wxzp.docx"" to ""rmi.pdf"" instantly",26,37,41,50
can you change filename from logs/wwmjja.pdf to backup/zfl.log for me,29,44,48,62
okay change tsgbsg.md to src/vmiyvht.js now,12,21,25,39
can you change file name from kazgc.json to txylrpjp.jpg,30,40,44,56
"update the name of nqevkh.txt to ""logs/dmcza.js"" for maine",19,29,33,48
hey update the name of fggycjpz.png to rrrvz.py,23,35,39,47
"please rename logs/yinvmvf.docx as ""v1/glo.png"" please",14,31,35,47
"can you rename file ""wmrsu.png"" into dvae.png please",20,31,37,45
"hey rename gpfx.md as ""zuysyt.pdf""",11,18,22,34
"fundament you rename indian file new/fwzoam.py into ""v2/wnubza.log"" for me",33,46,52,67
"okay atomic number 53 want to rename ""iujdnfzy.csv"" to ckvjek.docx right away",37,51,55,66
hey could you rename logs/crmrqx.jpg as htzdfmvr.pdf please,21,36,40,52
"rename ftt.csv as ""logs/itvgbrut.png""",7,14,18,37
please rename mgnjht.log to tmp/wzi.docx,14,24,28,40
"buttocks you rename v2/vdoavj.txt as ""logs/cqvqtbtx.csv""",20,33,37,56
okay change computer file name from oxgse.md to data/qgapf.log please,36,44,48,62
"please rename ""xhpwdxd.js"" as idlz.csv immediately",14,26,30,38
hey rename file cabinet data/wzxyu.js into src/doljautu.jpg now,24,37,43,59
"please rename ""rne.log"" as grb.log please",14,23,27,34
"okay rename ""hvc.txt"" as ltr.jpg for me",12,21,25,32
ok rename file xiizls.txt into aopvofx.csv now,15,25,31,42
change v2/ubfsrvn.csv to src/bkzcd.json,7,21,25,39
please could you rename cbbvi.txt as v1/omdeemuy.py,24,33,37,51
can you iodin want to rename rxblrew.json to szsteys.pdf,29,41,45,56
"derriere you rename ""new/kqfrsob.csv"" as project/xfckkb.csv for me",20,37,41,59
"please rename ""qcty.txt"" to cfagc.jpg now",14,24,28,37
okay update the gens of old/xkgvl.json to tmp/uavhsd.py now,24,38,42,55
"can you i want to rename xgmfld.py to ""wcvswjb.log"" now",25,34,38,51
update the name of v2/knnnvigd.txt to nvm.log,19,34,38,45
rename src/nneuclh.md as data/bkvog.json please,7,21,25,40
i deficiency to rename lqtchiln.py to logs/swmckz.pdf now,23,34,38,53
"hey update the name of ""mjwstj.csv"" to src/gzbhlnv.js",23,35,39,53
"okeh rename ""data/cebqngvj.txt"" as ""v2/rbp.log""",12,31,35,47
"variety filename from data/abpm.log to ""ejbpnh.js"" please",22,35,39,50
"please rename file data/eycxhkt.docx into ""oeedxv.json"" for me",19,36,42,55
"i want to rename cgkfwrrm.csv to ""data/kdca.txt"" for me",17,29,33,48
i deficiency to rename haivgq.png to v1/qrpne.txt,23,33,37,49
please rename orjmocr.txt as ljj.jpg today,14,25,29,36
"can you update the name of rcctdn.pdf to ""twfjoftj.log""",27,37,41,55
"hey update the name of ""kjjd.png"" to ajxfu.js for pine tree state",23,33,37,45
"update the name of nrdidqb.json to ""pefvx.csv""",19,31,35,46
"change v2/tvfskw.py to ""project/mbo.js"" for me",7,19,23,39
"rename dvhdl.csv as ""v2/fkvzwtw.csv"" for me",7,16,20,36
please alteration filename from logs/fhrirsit.js to fpnm.json for me,32,48,52,61
"okay could you rename ywqx.py as ""v1/ulspywl.js"" now",22,29,33,48
"ok could you rename ""logs/kzayrl.csv"" as ""data/csw.pdf"" now",20,37,41,55
"ok update the figure of ""ljdwrf.pdf"" to ""imzik.json"" please",24,36,40,52
"can you modification filename from ""jkgw.jpg"" to xnwn.txt",35,45,49,57
"rename ""old/oabzcu.js"" as fycezidj.jpg",7,22,26,38
"okay rename ""rgmvsfc.log"" to data/sks.csv",12,25,29,41
"okeh alteration ""rmbj.py"" to project/lapydjho.txt for me",16,25,29,49
"please rename file ""xtcuis.log"" into mvvdrfgr.csv",19,31,37,49
"okay i wishing to rename logs/gtarvb.js to ""owsyyzh.py"" please",25,39,43,55
"please could you rename ""data/muhwdvb.js"" as jfaifz.js for me",24,41,45,54
"can you rename joqzjqqm.txt to ""rsof.py"" for me",15,27,31,40
okay could you rename ydub.json as backup/paxmlfqo.md now,22,31,35,53
"please i want to rename oalhh.csv to ""cxchx.json"" please",24,33,37,49
"hey change backup/rspp.md to ""old/egvqxy.py""",11,25,29,44
"update the name of ""fmq.jpg"" to mqkzb.docx now",19,28,32,42
"hey change computer file name from xyjmvs.docx to ""ama.png""",35,46,50,59
please change old/gdn.log to vugmkmxq.json now,14,25,29,42
hey rename file v2/nqhg.png into v2/woqj.md now,16,27,33,43
"okay change filename from ""bpkpin.png"" to backup/hsifu.js please",26,38,42,57
please update the public figure of lhcnl.txt to tmp/dnl.txt for me,35,44,48,59
o.k. one want to rename cvocw.js to src/uafssci.csv please,24,32,36,51
hey change filename from v1/dqc.md to tmp/agov.md at present,25,34,38,49
"i want to rename ""v1/pqm.log"" to emtfresl.csv",17,29,33,45
"hey change filename from ""data/baibkvs.png"" to ""pcpzg.js"" please",25,43,47,57
"please rename file ""v1/bqrp.docx"" into pklnxktu.jpg",19,33,39,51
"okay modification ozvo.docx to ""jmjdu.txt""",18,27,31,42
can you i neediness to rename backup/sqkvok.log to lqqt.png for me,30,47,51,59
"hey rename file ""xlrcw.txt"" into project/baopb.jpg for me",16,27,33,50
"please alteration ""lusigksw.csv"" to xmffklnr.js for maine",18,32,36,47
hey rename indian file nniar.log into mqltfh.py for maine,23,32,38,47
"please modification mwbcnmu.txt to ""hvbat.jpg"" for maine",20,31,35,46
"butt you update the name of gdingvd.csv to ""yknvcke.docx"" now",28,39,43,57
"o.k. i lack to rename ""v1/ksieyrv.pdf"" to czcrgv.json",22,38,42,53
"hey rename file ""woj.jpg"" into nweucew.png please",16,25,31,42
please alteration old/avvdxoxz.jpg to devrukw.md please,18,34,38,48
"okey rename qhafkc.js to ""data/lojjc.docx"" please",12,21,25,42
can you rename file old/hch.md into old/mliokw.txt please,20,30,36,50
"okay variety filename from ""project/olu.txt"" to npojm.log instantly",27,44,48,57
rename kvnor.py as src/znoyip.json please,7,15,19,34
please could you rename lpuyjev.png as lnsmc.json,24,35,39,49
rename logs/hxr.md to leybgzd.txt please,7,18,22,33
"can you update the name of v2/wudkvgbk.json to ""logs/fuvcsjjv.jpg""",27,43,47,66
okey could you rename src/jsula.pdf as src/qro.md for me,22,35,39,49
rename pbggudd.docx as lkypjsuj.md now,7,19,23,34
please rename pqivafnl.log to v1/chkf.png now,14,26,30,41
"hey could you rename ""ikn.csv"" as ""cakvl.js"" at once",21,30,34,44
"okay could you rename cltjoht.json as ""tkj.csv"" for me",22,34,38,47
"rename qcsocft.pdf as ""oygkgaeq.docx"" now",7,18,22,37
okay change filename from bztwprv.log to unek.txt for maine,26,37,41,49
"please rename src/jdeycu.log to ""pmk.py"" please",14,28,32,40
"please rename backup/bsnwrxhf.txt as ""wzdi.json""",14,33,37,48
hey rename file v2/uapcinws.csv into zhyieab.txt present,16,31,37,48
"hey i want to rename ""backup/wjm.py"" to ""gxbln.md""",21,36,40,50
can you iodin want to rename yug.py to logs/gtevozh.json,29,35,39,56
"okay could you rename vcprk.js as ""data/ofplqf.md"" please",22,30,34,50
okay variety filename from sdltezr.docx to tmp/hczcxhtc.png please,27,39,43,59
"hey rename filing cabinet ""xincvv.txt"" into ""dzk.docx"" instantly",26,38,44,54
okay rename file uvxjdkae.js into vuebfwy.txt,17,28,34,45
could you rename cyi.js as ypdxjuz.json,17,23,27,39
"rename ""new/eoc.json"" to project/nkdqdgf.txt",7,21,25,44
"butt you could you rename ""old/umtd.png"" as project/ybw.json",26,40,44,60
tin you change filename from prcbbs.png to cnncjtz.csv,29,39,43,54
"please rename ""src/kau.js"" as data/xpdoea.docx",14,26,30,46
"please rename cmzmo.txt as ""dvl.txt"" for me",14,23,27,36
please 1 want to rename jmiee.txt to backup/symeifwn.pdf,24,33,37,56
can you change filename from ocpmry.csv to yltrocgo.jpg now,29,39,43,55
can you alteration data/gzqmcyjx.json to new/rfp.txt,19,37,41,52
could you rename backup/kzd.js as hmghg.log nowadays,17,30,34,43
"could you rename ""ucqr.jpg"" as ""rlsokg.jpg"" please",17,27,31,43
can you unity want to rename ctehyu.docx to v1/xlzrmusg.pdf for me,29,40,44,59
okay rename file rporew.log into kubdo.txt for pine tree state,17,27,33,42
can you could you rename wkouynl.txt as skjecr.js for maine,25,36,40,49
please change filename from backup/iks.jpg to gmbxu.pdf now,28,42,46,55
okay update the figure of inmzzsex.pdf to backup/qrtrhk.log please,26,38,42,59
"behind you rename ""npvp.log"" to xtuxwgcs.json for me",18,28,32,45
"change uuigzt.md to ""lvtzvac.json"" please",7,16,20,34
"please rename ""tjfq.py"" as tmp/bly.json now",14,23,27,39
i want to rename old/hlaxiej.py to ibpqpti.json now,17,31,35,47
"update the name of src/ruz.jpg to ""project/ogv.jpg""",19,30,34,51
please rename jxnqfmlm.pdf to data/wpzd.pdf for me,14,26,30,43
"seat you alteration filename from ""urnzw.docx"" to old/eujokfz.js for pine tree state",34,46,50,64
rename ufjg.js to ayajytbo.txt for pine tree state,7,14,18,30
please rename iuk.csv to ghq.jpg,14,21,25,32
okay update the figure of project/iqtvuq.docx to soqjwav.txt please,26,45,49,60
"variety computer filename from ""project/ktqikqqj.txt"" to tmp/gne.jpg please",31,53,57,68
"commode you update the name of mjhykaec.jpg to ""v2/ecvi.pdf"" for pine tree",31,43,47,60
okay change old/eaqk.docx to jviro.js,12,25,29,37
hey rename cja.docx to project/vwmxa.png,11,19,23,40
rename pagegizt.png to v1/xbpfvigt.py now,7,19,23,37
"please change ""hditdku.png"" to gaplv.txt please",14,27,31,40
