text,src_start,src_end,dst_start,dst_end
hey single want to rename oze.png to fvhbino.json now,26,33,37,49
please update the name of v1/zhy.txt to old/kweodvtb.md please,26,36,40,55
"please rename filing cabinet v2/fmaiuvse.py into ""crzvzn.pdf"" now",29,43,49,61
"can you i want to rename wrdyc.docx to ""project/edryj.pdf"" for pine tree state",25,35,39,58
can you change filename from backup/pcvxhdq.csv to logs/bzo.txt,29,47,51,63
"buns you rename kmynimv.json to ""stf.py"" please",16,28,32,40
"hey change filename from ""v2/baap.json"" to ""dknd.txt"" for pine tree state",25,39,43,53
"hey rename ""oygqait.json"" as v2/uzqp.jpg for me",11,25,29,40
change v1/lrouaobk.jpg to data/jhnrznq.pdf,7,22,26,42
"okay change filename from ""project/hhjeee.png"" to ""hwuum.pdf"" please",26,46,50,61
okay modification altvl.json to bnjdvms.log for me,18,28,32,43
o.k. i want to rename pyknoy.txt to ezwr.docx now,22,32,36,45
please rename file tmp/vbjgt.docx into rlvm.log for me,19,33,39,47
okay change filename from v1/bltxe.js to old/kcwvtj.png now,26,37,41,55
please i want to rename vva.jpg to data/pyumoo.js for me,24,31,35,49
okay could you rename v1/prtgcn.py as tjuwni.csv please,22,34,38,48
"please rename ""v1/vxx.js"" as heugxgu.py for pine tree state",14,25,29,39
okay update the figure of v2/plrovaif.txt to new/lgiisv.csv,26,41,45,59
"arse you could you rename aduk.py as ""cerdxu.py"" now",26,33,37,48
"please rename sjrkorzm.log as ""tmp/fwx.jpg"" for pine tree state",14,26,30,43
hey rename swwjjqsv.log to data/acsf.jpg please,11,23,27,40
okay change filename from ffbcl.log to writx.md,26,35,39,47
"hindquarters you variety ""pnv.txt"" to ivtkxzt.docx",25,34,38,50
hey update the name of cut.docx to tzeq.png for me,23,31,35,43
"please variety ""logs/wglkfvhh.csv"" to v2/thbxhyge.txt for maine",15,34,38,53
okay change logs/utbm.pdf to bitvl.docx now,12,25,29,39
hey could you rename hua.csv as old/jtx.txt please,21,28,32,43
hey update the name of backup/ill.js to src/fvwx.log,23,36,40,52
"okay i deficiency to rename bhx.docx to ""iqy.json""",28,36,40,50
"okay update the name of ""ktiuqdy.py"" to ucxkk.csv immediately",24,36,40,49
please could you rename backup/ueaab.png as clugw.png now,24,40,44,53
can you update the name of autufcej.png to ztpcl.py now,27,39,43,51
rename logs/zjoquifb.csv as ksxfsuq.md please,7,24,28,38
behind you could you rename vgr.csv as data/vyuqxzz.json for me,28,35,39,56
"rename file ""logs/biym.pdf"" into ""cqeo.jpg"" for pine tree state",12,27,33,43
"crapper you rename ""old/dxduv.py"" to djrgor.png",19,33,37,47
"okay alteration sjovz.docx to ""xzu.txt"" please",16,26,30,39
"okay update the name of ""v1/tmi.js"" to ""vtsd.csv"" now",24,35,39,49
"fundament you rename file xmnfeo.txt into ""dsw.csv"" for me",26,36,42,51
update the name of v2/vpbey.py to v1/klwd.js,19,30,34,44
can you could you rename old/zbtxmfxt.pdf as ncqrx.js for me,25,41,45,53
please change qzns.txt to xizhxy.log,14,22,26,36
"hey change tmp/nepqt.log to ""exdnjm.csv""",11,24,28,40
"okay i want to rename ptzjk.png to ""sqtrjxc.pdf"" please",22,31,35,48
okeh could you rename bgeanq.jpg as logs/ydoyhm.jpg for pine tree state,22,32,36,51
ace neediness to rename ivgsibc.txt to nczjjdbu.pdf please,24,35,39,51
okay i want to rename new/bopycg.docx to old/dmawrx.log,22,37,41,55
"please could you rename new/hokprg.log as ""udbxb.png"" today",24,38,42,53
okey change filename from v2/lyjjdufs.log to jxvsp.csv straight off,26,41,45,54
"please rename yxm.md as ""uahmpvoj.docx"" please",14,20,24,39
"change ensdptv.txt to ""zwpbti.log"" now",7,18,22,34
rename file bun.log into v2/bofoqj.log,12,19,25,38
could you rename backup/hqlfedr.json as ccnsts.png for me,17,36,40,50
stool you rename v2/vsmsi.py to logs/sserac.docx please,17,28,32,48
"okeh change file name from logs/kvggzl.jpg to ""src/jyea.jpg"" for me",27,42,46,60
"change csufg.txt to ""tmp/ozykz.md""",7,16,20,34
"rename micjg.csv as ""ngdxz.pdf"" now",7,16,20,31
toilet you rename lrub.js to v1/qpwe.png please,18,25,29,40
"okay change computer filename from opukt.py to ""data/jjc.docx"" now",35,43,47,62
"okay change ""bcobtg.md"" to neutc.png please",12,23,27,36
okay variety data/svoxsuc.txt to saxifq.pdf now,13,29,33,43
okay alteration filename from wzgcpllb.json to gpqi.md for me,30,43,47,54
"please rename ""ynms.pdf"" to v2/bhzt.py for me",14,24,28,38
"update the name of aqgoci.py to ""lqneeiiq.md""",19,28,32,45
"okay rename ""vva.docx"" as backup/pemffql.csv please",12,22,26,44
"hey update the gens of ""fbqtvdpl.jpg"" to ""new/tujqksq.pdf"" for me",23,37,41,58
john you i deprivation to rename wuiztj.docx to mbqenw.csv,33,44,48,58
okay rename new/lkxqbsct.txt to tmp/envpo.log for me,12,28,32,45
"hey rename ""ygyeosrj.json"" to logs/twd.pdf for pine tree state",11,26,30,42
"rename project/ztn.docx to ""eqfjm.png"" for me",7,23,27,38
hey could you rename kpqwtji.png as data/shigoib.py,21,32,36,51
hey i want to rename logs/bgkpimo.js to data/fjq.pdf now,21,36,40,52
ok alteration file name from tmp/scopza.png to v1/xagcx.txt,29,43,47,59
please change filename from new/lvhpknkt.json to tmp/uceocn.txt please,28,45,49,63
hey could you rename new/byi.log as xvji.log now,21,32,36,44
update the epithet of zqxrwn.pdf to tmp/ndvnbbh.md,22,32,36,50
change filename from v2/nfxfgn.jpg to ifoa.log now,21,34,38,46
can you rename gggvm.docx as src/ueqjwryb.py please,15,25,29,44
okay update the name of data/stdpo.csv to rcd.py,24,38,42,48
"o.k. could you rename ""hhph.py"" as qef.log now",22,31,35,42
"hey rename file new/pavar.docx into ""gwms.jpg"" please",16,30,36,46
okay update the name of logs/zpszuq.csv to lnkbii.py for me,24,39,43,52
okay rename mzwusie.js as yxp.pdf,12,22,26,33
"okay i want to rename ""jzvrs.pdf"" to data/llqo.log now",22,33,37,50
okay rename nfcrna.jpg to jkx.txt now,12,22,26,33
"hey change gswwt.docx to ""v1/sme.py"" now",11,21,25,36
can you rename kebu.txt to qbvnd.pdf for pine tree state,15,23,27,36
"please rename cabinet xgy.json into ""sjgydwwm.pdf"" now",22,30,36,50
can you rename wjzhiu.jpg as rgdusec.txt please,15,25,29,40
rename ygeuls.pdf as jafer.json for maine,7,17,21,31
hey rename old/ttikcf.py to lntng.docx please,11,24,28,38
can you change filename from backup/jtgk.py to project/zvuao.docx please,29,43,47,65
"please update the gens of ""scvnt.log"" to xbohu.md at present",26,37,41,49
hey rename file src/jbfrgy.log into zupg.csv,16,30,36,44
change filename from dwmlwcpf.py to old/uyg.csv,21,32,36,47
update the name of project/mnawdr.js to ijawleje.jpg please,19,36,40,52
modification project/lqgn.js to qcvhth.png straight off,13,28,32,42
"update the name of ""toxlxa.md"" to bgeptr.jpg now",19,30,34,44
"please rename ""ocu.csv"" as logs/gtaqrbp.js now",14,23,27,42
"okay could you rename old/ptti.txt as ""logs/ejhlxnut.docx"" please",22,34,38,58
okay rename file yehewe.txt into hjpim.docx,17,27,33,43
hey change cqzkvvif.py to vzzr.log for me,11,22,26,34
rename file cabinet mengboy.jpg into iuliu.js for pine tree state,20,31,37,45
"rename ""oppd.jpg"" as mzmzp.js please",7,17,21,29
"update the name of zvh.log to ""uzzay.py""",19,26,30,40
"hey i deprivation to rename ""project/bijlq.js"" to uojzx.json",28,46,50,60
rename file cabinet gwki.png into data/ptlbyf.docx please,20,28,34,50
"please update the name of kzbbra.pdf to ""rimm.csv"" for pine tree state",26,36,40,50
"okay i deficiency to rename fydk.py to ""project/kjzowz.txt"" now",28,35,39,59
please alteration ajsyfl.csv to old/gjsa.log for me,18,28,32,44
"pot you rename qgu.docx to ""pbl.py"" for me",15,23,27,35
"please change filename from src/jiuqzy.py to ""muyty.txt""",28,41,45,56
"can you rename data file snd.log into ""v2/tmrf.docx"" now",25,32,38,52
"please i deficiency to rename iazbyn.png to ""data/jqthr.py""",30,40,44,59
"rename ""v1/tga.md"" as nfs.txt straightaway",7,18,22,29
"ok rename ""new/nvvae.csv"" as v1/wwcmt.csv for me",10,25,29,41
"could you rename v2/nqen.csv as ""jbgs.png"" now",17,28,32,42
please update the name of qai.py to project/wtoua.csv for maine,26,32,36,53
hey rename backup/swhjm.jpg as nlmbww.txt please,11,27,31,41
okay i wishing to rename smeec.md to uycm.txt,25,33,37,45
"rename zxsig.png as ""tmp/tsawnp.py""",7,16,20,35
rename v1/drylwk.txt to tyyx.json please,7,20,24,33
ass you alteration sum.log to src/uarlhwhi.log please,19,26,30,46
hey rename file icesw.md into tmp/qdruodg.md,16,24,30,44
hey rename mymqq.jpg as tmp/zzqtxkbm.md please,11,20,24,39
"modification filename from ""webr.docx"" to ""ioya.md"" please",27,38,42,51
hey change vsdg.log to xij.py,11,19,23,29
"hey update the name of ""backup/vnzldrpv.png"" to oswk.txt please",23,44,48,56
rename vgxur.json as zwbp.log,7,17,21,29
could you rename hxr.jpg as eymu.docx,17,24,28,37
"rename uwwxeo.js as ""ihhf.jpg"" instantly",7,16,20,30
"could you rename ""project/vgt.js"" as hsufsu.json for me",17,33,37,48
please rename v2/trfygkrn.log to czgfad.py for me,14,29,33,42
"terminate you update the name of ""gisqy.jpg"" to logs/tnqxaqvb.png now",33,44,48,65
rename agqms.log to bjtzut.docx,7,16,20,31
please change bvc.png to plne.js,14,21,25,32
"hey i neediness to rename yldymjcx.png to ""ouqmhkhn.log""",26,38,42,56
"please alteration computer file from logs/rqs.docx to ""wub.jpg"" for me",37,50,54,63
"please one wishing to rename ""hopqdce.log"" to ""xvs.csv"" please",29,42,46,55
rename file erptirm.log into ioejk.csv,12,23,29,38
can you rename tte.csv as logs/trzjujnp.pdf please,15,22,26,43
hey variety filename from umagkqi.docx to gplh.csv please,26,38,42,50
hey rename file pcpfee.pdf into tmp/gbpze.docx now,16,26,32,46
"okay change ""dwkzbc.csv"" to bkit.jpg",12,24,28,36
can you change computer filename from wzebirw.js to ctpkwnv.js,38,48,52,62
okay change igrxwqis.csv to envoht.csv please,12,24,28,38
"hey rename ""ycoohyfn.png"" as data/wgarm.csv nowadays",11,25,29,43
"okay rename file fdovd.md into ""tmp/bovjjp.md"" please",17,25,31,46
"hey rename wpe.md to ""ayhd.py"" for me",11,17,21,30
okay update the name of hltnkb.docx to src/buy.jpg for me,24,35,39,50
hey could you rename v1/jxwor.pdf as src/cxilih.docx for me,21,33,37,52
please rename new/xmgtt.csv to new/sbyqjlj.csv now,14,27,31,46
hey change filename from mxt.js to ucdids.json for maine,25,31,35,46
"hey single want to rename ""v1/iwuvfbn.md"" to rht.jpg now",26,41,45,52
can you rename file octe.docx into zivlqmv.log,20,29,35,46
please one wish to rename wlqinlus.json to wxgwdh.log please,26,39,43,53
okay rename ptqhtx.js as new/icqeib.csv for me,12,21,25,39
hey single wish to rename fsuykf.pdf to tjntze.log,26,36,40,50
"okay update the name of ""backup/nhlx.docx"" to nfzrin.docx now",24,42,46,57
please i want to rename logs/jlcm.log to data/xckhvk.txt,24,37,41,56
rename new/ecxxmi.pdf to ahirsytj.py for me,7,21,25,36
please alteration computer filename from aclngc.docx to old/jvf.json please,41,52,56,68
"can you rename file ""frtotjx.md"" into ""v1/kjvlwq.docx"" now",20,32,38,54
hey could you rename project/hmowh.py as sfi.md for me,21,37,41,47
"please variety data/kuy.docx to ""v1/eehpexne.md"" for me",15,28,32,48
please i want to rename wqthm.md to project/ddrtrhu.png please,24,32,36,55
"hey rename ""urhfks.csv"" as new/uevjpy.docx for tree state",11,23,27,42
update the name of src/swwjgff.json to xoewib.js please,19,35,39,48
"please rename ""data/ewoacfz.md"" to tpawyfob.csv for maine",14,31,35,47
"can you rename qggrrlfk.js to ""qerugqeo.log"" now",15,26,30,44
"okay update the name of chnh.jpg to ""npk.pdf"" please",24,32,36,45
okay rename file v1/yqhmjw.py into project/eakr.js please,17,29,35,50
hey rename v2/vjum.docx as logs/vgwxefwl.csv please,11,23,27,44
bum you alteration filename from xfsiija.py to lkqpfa.csv,33,43,47,57
hey rename nrkv.docx to lxetkyu.md please,11,20,24,34
"rename ""vvkkmdj.json"" to ""bfz.jpg"" now",7,21,25,34
"okay could you rename ""v2/oqihxv.py"" as v1/xcrkylm.csv please",22,36,40,54
"please change ""qvzf.pdf"" to ""ydn.png"" for me",14,24,28,37
okay i neediness to rename uga.json to fwuelzo.log,27,35,39,50
okay rename data file new/hvaaxkbk.md into project/byo.js now,22,37,43,57
"can you rename file fco.log into ""v1/tyslkv.js"" for me",20,27,33,47
"okay alteration filename from esrp.png to ""lefekzf.js""",30,38,42,54
"change ikkmljk.json to ""cbmjgwy.log"" for me",7,19,23,36
variety filename from src/qtwd.pdf to backup/rgytoq.md now,22,34,38,54
"change filename from ""vzrh.csv"" to ttzyds.log for me",21,31,35,45
"please alteration ""nzxijoq.docx"" to ""logs/ojj.md"" please",18,32,36,49
please iodin want to rename src/szs.csv to ujc.log,28,39,43,50
"rename data file ""jpv.jpg"" into nrjmijmy.md please",17,26,32,43
"rename mwndcbah.js to ""qtkebx.csv""",7,18,22,34
"okay update the name of ""jolayib.png"" to yzwr.log",24,37,41,49
"hey could you rename logs/oqkcte.png as ""backup/cdzbgf.docx"" for me",21,36,40,60
"okay rename cabinet ""zlujwazi.txt"" into hsngq.js now",20,34,40,48
can you rename hvaw.md to bpyxwx.png for me,15,22,26,36
"hey rename indian file src/dfivyx.jpg into ""nesdpi.json"" please",23,37,43,56
"hey could you rename ""rdkj.pdf"" as niwnzvqp.docx for me",21,31,35,48
okay modification ckbhhg.json to data/hjtkm.csv now,18,29,33,47
"please rename ""cqawdmiy.txt"" to nooflf.pdf",14,28,32,42
please variety filename from tzs.jpg to logs/qesmg.py,29,36,40,53
"please modification filename from ""hhn.log"" to src/rhgebnp.md now",34,43,47,61
"please change filename from data/nzacyfw.csv to ""project/ynue.log""",28,44,48,66
"update the name of nims.pdf to ""oit.log""",19,27,31,40
ok could you rename rlrshjnh.js as src/fvq.docx,20,31,35,47
"o.k. change pidjvd.txt to ""tmp/kmsrncm.txt"" please",12,22,26,43
"rename v2/tjmjs.json to ""v1/ojinetyf.txt"" instantly",7,20,24,41
rename tdzqu.docx to metn.json,7,17,21,30
". k. i need to rename ""qrufd.jpg"" to ""aczca.docx"" please",22,33,37,49
rename jtvseth.md to backup/usv.txt,7,17,21,35
"hey iodine privation to rename jhdcqnpd.txt to ""ygvf.jpg""",31,43,47,57
"hey atomic number 53 want to rename ""old/xbchv.js"" to v2/waczy.jpg",36,50,54,66
okey update the name of qfngndgh.json to src/zzadupks.js please,24,37,41,56
"fundament you update the name of old/psosrfd.log to ""hmsemsrp.csv"" instantly",33,48,52,66
update the name of data/uba.md to xwmny.py please,19,30,34,42
"okay could you rename v2/bolafrpw.txt as ""bfno.py"" for me",22,37,41,50
rename single file hpyoip.png into backup/bcpq.py now,19,29,35,49
"derriere you rename ""tmp/qqyvy.docx"" to rceefg.py please",20,36,40,49
rename hyb.log as uwrakimi.json now,7,14,18,31
"hey update the name of ""dordcbt.png"" to old/kpba.log for pine tree state",23,36,40,52
hey could you rename xvvqghbs.txt as tydhod.json now,21,33,37,48
please rename dlhuhpzk.jpg to logs/vhhvvbw.csv,14,26,30,46
hey update the name of pcrfs.js to gkyjkh.md,23,31,35,44
potty you rename msmgx.md as zhxbt.csv for me,17,25,29,38
"could you rename vdj.log as ""wrtrf.txt"" right away",17,24,28,39
okay rename scirw.jpg as project/whcrvtg.json now,12,21,25,45
"can you rename ""laxmmp.docx"" to v1/dydajzxh.py for maine",15,28,32,46
okay alteration filename from project/zcan.csv to project/pni.md away,30,46,50,64
hey rename logs/riv.py to znfn.txt for me,11,22,26,34
"okay rename dwzp.pdf to ""src/szb.md"" for me",12,20,24,36
please change vhfcbmlr.jpg to src/abl.pdf please,14,26,30,41
okay rename ldd.docx as qoyf.jpg,12,20,24,32
can you rename bwkbzk.js to tmp/uaaopnx.pdf,15,24,28,43
"hey rename file ""uknvb.md"" into nkeamskm.md",16,26,32,43
update the name of old/nuvkwv.py to orokn.json please,19,32,36,46
rename file backup/mviu.json into kat.pdf now,12,28,34,41
hey change v2/iodygnum.log to project/johlf.py please,11,26,30,46
change file name from project/znpnisi.json to pjovx.json please,22,42,46,56
hey could you rename new/hfwzf.txt as ccbjxqm.js for me,21,34,38,48
"can you rename ""jicwue.log"" to data/ppbqm.py for maine",15,27,31,44
"please rename file rsar.json into ""new/vlxgpmhl.pdf"" now",19,28,34,52
okay rename file hhb.png into qtk.docx,17,24,30,38
okay i privation to rename koz.py to v2/ary.txt please,27,33,37,47
"hey variety project/afand.js to ""ybnrnynk.pdf"" now",12,28,32,46
"please rename jqipnkb.png to ""jipo.docx"" please",14,25,29,40
okay rename udhzi.png as tmp/ljdtqzo.csv please,12,21,25,40
rename mrolyj.png as yxxbzny.json now,7,17,21,33
hey could you rename logs/nbqbza.md as rmjzwdpj.jpg,21,35,39,51
"please rename file ""backup/fri.docx"" into src/xuq.txt for me",19,36,42,53
"can you i want to rename ""tjgi.png"" to tjluvrg.log now",25,35,39,50
"please update the public figure of logs/yeh.pdf to ""logs/gvdcdl.csv""",35,47,51,68
update the name of v2/upsznyrn.md to lyfvwf.json please,19,33,37,48
"hey rename ""v1/xpgsyn.docx"" to ""yygot.py"" at present",11,27,31,41
canful you rename v2/djyscs.docx to aycsamh.jpg for me,18,32,36,47
"okay rename filing cabinet ""uwixaohs.json"" into geylgk.md for maine",27,42,48,57
please i deficiency to rename logs/rthq.csv to new/aeurvu.json for maine,30,43,47,62
"can you change filename from logs/zdrfjg.png to ""tmp/qso.json""",29,44,48,62
"rename v2/zilrtjte.png as ""nopq.csv"" for me",7,22,26,36
"please rename file ""blhw.log"" into src/qzwgtbp.jpg for pine tree state",19,29,35,50
can you change src/chi.log to fjk.txt for maine,15,26,30,37
"please could you rename ""data/nxfoecgq.pdf"" as ""exug.js"" immediately",24,43,47,56
"change filename from new/yyemp.jpg to ""v2/sdgtvhh.csv"" for pine tree state",21,34,38,54
okay rename file jppr.docx into cbpoialh.csv please,17,26,32,44
"rename old/kehk.jpg to ""tavwkk.docx"" please",7,19,23,36
can you rename file txeka.csv into fsge.docx for maine,20,29,35,44
rename file src/cilv.pdf into project/djg.md for me,12,24,30,44
"change filename from ""old/hnanc.py"" to caoqudw.log for maine",21,35,39,50
"hey i wishing to rename new/kufpi.log to ""swdp.js"" for maine",24,37,41,50
"tail you update the name of ""v1/ric.md"" to tmp/gysf.json please",28,39,43,56
"rename pyxys.png to ""project/epn.pdf"" now",7,16,20,37
okay i privation to rename ebhc.py to old/vbbaggux.pdf,27,34,38,54
please could you rename v1/olzv.md as alsmpiha.txt,24,34,38,50
"okay update the name of lbxqosa.txt to ""xfynhtef.png"" please",24,35,39,53
hey rename file project/emu.log into kkkrq.jpg please,16,31,37,46
change xfuuxy.py to lbq.md for maine,7,16,20,26
"rename sbherv.jpg to ""tlxmqtdt.docx"" please",7,17,21,36
"buttocks you i want to rename yplng.js to ""iibz.md"" please",30,38,42,51
"hey i wishing to rename ""oscqo.json"" to project/dqekrwr.csv for me",24,36,40,59
behind you change filename from serwzb.py to new/waaehen.js now,32,41,45,59
"hey update the public figure of ""lgfaihpt.png"" to sqtl.js for me",32,46,50,57
"okay change filename from ""praj.log"" to juo.py please",26,36,40,46
lav you ace want to rename llz.csv to project/dwkqpcw.json,27,34,38,58
"please rename dlixaj.jpg to ""yunhatm.py""",14,24,28,40
hey change filename from data/jbxwf.pdf to vfcugw.log,25,39,43,53
please change filename from ssvaj.log to ogktbtu.py please,28,37,41,51
"can you update the name of cgs.md to ""rnog.json"" at present",27,33,37,48
"hey i want to rename ""vdnljkzo.txt"" to ""backup/baa.json"" please",21,35,39,56
hey i want to rename udnguiig.docx to jkwi.js,21,34,38,45
"can you rename ""new/geojjgwj.pdf"" as v2/kbohfvj.pdf",15,33,37,51
"please update the name of tmp/uadfbrny.csv to ""nwvpdfdi.pdf""",26,42,46,60
can you rename file xka.pdf into project/phcz.pdf please,20,27,33,49
can you could you rename tqkmqdi.docx as rnsinega.pdf for me,25,37,41,53
"okay modification backup/lfilgb.js to ""nvnstihj.json""",18,34,38,53
okay atomic number 53 want to rename upltef.jpg to sjnhk.py,37,47,51,59
"hey could you rename ""bkacfwe.log"" as ccixf.csv at once",21,34,38,47
change filename from v2/totx.txt to tmp/aietio.pdf now,21,32,36,50
"okay atomic number 53 wish to rename nsfwfl.json to ""jrrien.jpg"" please",37,48,52,64
"fanny you atomic number 53 want to rename ""tgzo.log"" to ""pgy.pdf"" now",42,52,56,65
okay rename file hczyiqkj.docx into aqixtmy.py,17,30,36,46
"please modification filename from tmp/xrtpmx.py to ""npbgtmjd.pdf"" for me",34,47,51,65
"please could you rename ztgot.js as ""data/gyo.jpg"" for me",24,32,36,50
"hey change filename from ""old/mwn.json"" to wnhsi.jpg please",25,39,43,52
rename file v1/qhkzmdnr.js into tyx.pdf like a shot,12,26,32,39
"please rename v2/nek.pdf to ""gylfujn.json"" please",14,24,28,42
okay i want to rename fxcdc.js to hyi.js for pine state,22,30,34,40
"okay rename single file zpvsnv.pdf into ""wplwc.py"" please",24,34,40,50
please i need to rename ejlp.jpg to fsi.pdf please,24,32,36,43
"okay update the name of ""pycnlks.docx"" to old/ytydzeog.py please",24,38,42,57
"rename ""gtihup.png"" as ""roy.py"" please",7,19,23,31
"rename file ""wayuf.md"" into tqkpygd.pdf",12,22,28,39
rename file backup/apna.log into lxzcc.js please,12,27,33,41
hey i want to rename stenccrr.png to dnc.log,21,33,37,44
rename src/rjze.pdf as data/lvk.md for me,7,19,23,34
modification hrjuzkt.png to yldpprzu.log now,13,24,28,40
"please rename single file ""nsncgtxl.csv"" into backup/ecnxejga.txt for me",26,40,46,65
hey update the gens of csj.txt to src/tpy.json now,23,30,34,46
rename bnvh.docx as ysluhh.txt now,7,16,20,30
okay could you rename old/pgskqy.txt as project/nze.csv please,22,36,40,55
okay change filename from tmp/srlnodt.md to logs/njukwyqj.txt please,26,40,44,61
"could you rename src/dzbcowkd.log as ""logs/uhpirqx.json""",17,33,37,56
butt you i want to rename logs/stffjzgb.log to mpyqmx.docx for pine tree state,26,43,47,58
"can buoy you could you rename ""vpn.txt"" as v1/lhog.csv now",30,39,43,54
okay rename file uoporx.js into kdsbghb.csv for pine tree state,17,26,32,43
"okay rename ""old/nisppxgw.txt"" as ""uurcdc.csv"" for pine state",12,30,34,46
please rename file logs/rqbxqp.js into v2/hmrlqr.csv,19,33,39,52
"okay rename ""logs/wlax.jpg"" to ""pgyobg.csv"" please",12,27,31,43
"okay change filename from ""oluxjvc.csv"" to logs/ptiwihd.txt for me",26,39,43,59
"okey change ""src/vxwyct.md"" to ""v2/uwdg.md""",12,27,31,43
"please rename ocgoles.csv to ""tmp/buxjfhlj.js""",14,25,29,46
variety dru.jpg to hkwt.json for me,8,15,19,28
"hey rename v1/qkr.py as ""logs/urr.png""",11,20,24,38
hey change egivnfpy.png to etyy.json now,11,23,27,36
please single deficiency to rename onkmtn.png to v1/dmhgbhh.txt for me,35,45,49,63
"rename ""omrizty.jpg"" to ""xakl.pdf"" please",7,20,24,34
"please change ""idp.js"" to qdhkwn.log for me",14,22,26,36
"please rename hkcruuz.pdf as ""oai.png""",14,25,29,38
"update the name of ""ifqt.json"" to slliv.md now",19,30,34,42
can you rename file yivbc.jpg into jijd.pdf please,20,29,35,43
please i need to rename sexu.log to new/vdd.json,24,32,36,48
hey i want to rename v1/ecmt.md to qyyiwcmf.docx for me,21,31,35,48
"hey could you rename ugf.js as ""logs/upfmn.docx"" please",21,27,31,48
"okay rename data file ""lzgvx.txt"" into sjinxgy.json for me",22,33,39,51
"okay i want to rename ""backup/ibypbhd.png"" to ""ywxnuaru.pdf"" please",22,42,46,60
okay rename enkrdp.jpg as vxbq.jpg now,12,22,26,34
"hey rename file ""v1/gvia.log"" into backup/vndvlgr.txt",16,29,35,53
"please could you rename ""spu.js"" as bdpd.txt now",24,32,36,44
please rename file zcv.py into yjjqu.js please,19,25,31,39
can you alteration bfwbzr.py to v2/nrgzaz.pdf,19,28,32,45
okay iodine want to rename v2/aclinde.csv to old/yoji.py for maine,27,41,45,56
"please iodin want to rename okkkd.json to ""new/opfaxmp.pdf"" please",28,38,42,59
"change ""ajsumbpj.json"" to ""jwakkfdy.png"" for me",7,22,26,40
please could you rename mabnrvi.jpg as swq.pdf,24,35,39,46
can you update the epithet of src/tfhusqa.pdf to gpsf.pdf like a shot,30,45,49,57
"tail you could you rename lgksftr.docx as ""sarnwqwi.json"" please",26,38,42,57
hey rename file backup/duxnb.md into fzdj.csv now,16,31,37,45
"can you rename ""new/gfazvjp.md"" to ""nzm.jpg"" please",15,31,35,44
ok could you rename skqof.md as asoee.log for me,20,28,32,41
please rename old/xtebgjm.jpg as xsjikpqq.png please,14,29,33,45
"please rename lcbvazb.md as ""logs/nzn.pdf""",14,24,28,42
o.k. i want to rename fsqvzrw.jpg to backup/bxivz.docx please,22,33,37,54
"okey rename ""project/jwkxglzf.log"" to tmp/xrssom.docx",12,34,38,53
okay could you rename puuc.js as tmp/bdxxcot.log please,22,29,33,48
"please update the name of ""v1/vbebb.md"" to ""nnautv.docx""",26,39,43,56
"modification filename from data/nijujh.md to ""aeyqm.png"" now",27,41,45,56
"can you rename filing cabinet ""dvoo.js"" into v2/vbtuzaoa.png for me",30,39,45,60
"can you variety computer filename from ""siuyduu.txt"" to v2/zicca.md please",39,52,56,67
"okay rename ""gqeoq.py"" as nafbyook.js",12,22,26,37
please could you rename lnxnccq.csv as knslgf.json for me,24,35,39,50
hey rename v2/gsjfufgl.md to tmp/waq.py for me,11,25,29,39
hey rename file ppoyo.json into jytwr.jpg,16,26,32,41
alteration computer filename from project/ttzxs.pdf to logs/ogpinge.md for me,34,51,55,70
"rename ""ehxd.py"" to vcpfaba.pdf",7,16,20,31
hey rename backup/mvadu.log to backup/vsqwuole.py now,11,27,31,49
please update the name of ixo.json to data/mswq.json now,26,34,38,52
"please change data/meuaxuxp.json to ""xzczoz.png"" please",14,32,36,48
"please rename single file jcfl.js into ""v2/shiuqlux.docx"" please",26,33,39,57
"rename backup/wbsncc.json to ""ljhpk.docx"" now",7,25,29,41
hey rename xncuwyey.png as tmp/ockiq.jpg for me,11,23,27,40
"backside you modification filename from ""v2/rmwn.pdf"" to ""v1/imxwwrwg.docx"" please",40,53,57,75
"please change ""vwztozfl.pdf"" to zsgiakpm.pdf now",14,28,32,44
"can you change project/ble.pdf to ""iuyboobu.py"" for maine",15,30,34,47
hey change zzl.js to acpazdza.txt,11,17,21,33
can you rename project/mmcr.md to kkwuq.docx for me,15,30,34,44
"hey variety filename from new/rstbw.log to ""backup/bar.md"" forthwith",26,39,43,58
hey change new/vvll.log to logs/biu.csv,11,23,27,39
hey i want to rename logs/wlwbqg.js to vhtv.py please,21,35,39,46
