text,src_start,src_end,dst_start,dst_end
"rename file ""layjr.log"" into ""v1/pdujciv.log"" for me",12,23,29,45
please change filename from logs/xor.py to etxd.docx for me,28,39,43,52
"okay  rename  ""ocvwoo.py""  to  vhnqppoq.csv",14,25,31,43
"so  change  filename  from  ""project/brrso.docx""  to  old/wrjihw.md  for  me",28,48,54,67
hey i want to rename khbrv.jpg to v2/oaazs.pdf now,21,30,34,46
"okay i want to rename wigowiuc.py to ""kjjw.csv"" quickly",22,33,37,47
okay  change  njv.docx  to  tpcxw.csv  for  me,14,22,28,37
"Okay rename file ""data/thrr.md"" into zixztb.pdf now",17,31,37,47
okay i want to rename ftykq.pdf to cmhxiua.py quickly,22,31,35,45
"so rename ""src/eeuu.json"" as logs/dvedkn.py",10,25,29,43
"can  you  rename  file  ""data/wnt.md""  into  ""gqn.docx""  please",24,37,45,55
well update the name of qlem.log to uqalv.js please,24,32,36,44
rename itbb.png as logs/rskgjx.png please,7,15,19,34
hey change old/igj.jpg to nwxbz.jpg please,11,22,26,35
"please change filename from aobjzka.py to ""hogeon.jpg"" now",28,38,42,54
"can you i want to rename ""agiqjqxi.pdf"" to data/gdy.md",25,39,43,54
Okay  rename  hjppseek.py  as  v1/fbvgopum.csv  please,14,25,31,46
"Change ""xilw.md"" to ""tgvb.csv"" for me",7,16,20,30
update  the  name  of  civi.png  to  kbuc.log  please,23,31,37,45
"i want to rename ""bpxdwab.png"" to uhbqprx.jpg for me",17,30,34,45
well change zywojo.js to src/xyooz.py for me,12,21,25,37
"please  rename  ""fiosfnil.csv""  to  project/ghenozze.pdf  for  me",16,30,36,56
"rename file zxbwycrk.txt into ""wywywngf.png"" quickly",12,24,30,44
"can you change filename from v1/mqob.png to ""dlav.txt"" now",29,40,44,54
please  change  qqyd.png  to  project/hrcf.js  quickly,16,24,30,45
so change filename from tmp/vlaq.md to ihxztos.py please,24,35,39,49
so rename vtfkh.csv to hkdvaqtt.txt for me,10,19,23,35
please rename mphremdi.docx as ybrcjox.csv,14,27,31,42
"can you change v2/akvlc.md to ""cnnbvgfw.txt"" please",15,26,30,44
Well i want to rename ljffzwla.txt to data/sflrf.pdf please,22,34,38,52
"well rename ""lvvc.pdf"" as ""backup/kujfgtw.log"" please",12,22,26,46
"well  change  filename  from  new/rlgg.py  to  ""txmpm.csv""  please",30,41,47,58
"okay change ""project/kcihw.jpg"" to feb.pdf now",12,31,35,42
"i want to rename ""tmp/hvobczjm.csv"" to mww.docx please",17,35,39,47
"so change src/wjrnb.txt to ""dpmvv.md"" for me",10,23,27,37
could  you  rename  snahou.md  as  hlzs.md  for  me,20,29,35,42
"Okay  i  want  to  rename  eeearc.log  to  ""ogeix.md""  quickly",27,37,43,53
"hey  rename  ""jkwvyb.js""  to  klnd.pdf  for  me",13,24,30,38
"can  you  rename  ""v1/ntdwxx.jpg""  as  data/lnnn.md  now",18,33,39,51
okay rename file dlgdo.json into project/izp.py quickly,17,27,33,47
"can you rename ""old/xbmmtwa.jpg"" to ghjzn.csv please",15,32,36,45
please i want to rename gsybsx.pdf to new/keqoz.md,24,34,38,50
"well rename file ""new/usycfg.md"" into ""hkl.csv"" please",17,32,38,47
"Okay rename sdyprbb.csv to ""xst.md"" quickly",12,23,27,35
can you update the name of tmp/brqxparf.csv to old/kwoij.png now,27,43,47,60
"change ""pnp.txt"" to vrgaf.jpg now",7,16,20,29
"Can you rename ""qnbudmt.pdf"" as acow.csv quickly",15,28,32,40
"well rename ""old/cmlagzg.log"" as ""tmp/dmns.pdf"" quickly",12,29,33,47
change kljst.pdf to ihltma.png now,7,16,20,30
"please i want to rename ""raphlpb.js"" to syjesn.log please",24,36,40,50
"Rename file ""gqheghe.jpg"" into ""cygwh.txt""",12,25,31,42
please change bqkgltfw.log to obtcfal.docx,14,26,30,42
so  change  filename  from  whhy.py  to  qscgrmr.json  quickly,28,35,41,53
okay update the name of new/dsbb.json to tmp/vhdjfiwz.js for me,24,37,41,56
please change efp.csv to v1/ziox.json quickly,14,21,25,37
"hey rename ""tmp/rxyjefuc.txt"" as mzugxfo.txt please",11,29,33,44
"could you rename ""ugm.pdf"" as ""fksidhr.png"" for me",17,26,30,43
can you i want to rename v2/yvcxr.txt to old/gucaio.md quickly,25,37,41,54
"so  rename  xnuhb.docx  as  ""kjx.pdf""",12,22,28,37
"could you rename bgp.md as ""cnyhbp.json"" for me",17,23,27,40
so rename file qlgksdag.csv into mvhxlpt.md quickly,15,27,33,43
"well rename file bdpqhlz.js into ""old/ztkzjxn.log"" now",17,27,33,50
okay i want to rename logs/ytbvjyfl.csv to backup/zmcr.docx now,22,39,43,59
"please rename file v1/dfbjldc.py into ""nldiennn.json""",19,32,38,53
hey change filename from tmru.js to data/nfvfhq.pdf,25,32,36,51
"okay rename ""vmhgbpdm.pdf"" as qwm.docx now",12,26,30,38
"can you could you rename qsho.js as ""vcm.docx"" for me",25,32,36,46
"hey  could  you  rename  ""kjg.jpg""  as  ""aryqf.js""  please",25,34,40,50
"can you i want to rename fwtlfwgq.docx to ""olw.docx"" please",25,38,42,52
can you rename backup/duyzica.txt to tbrzyv.docx quickly,15,33,37,48
"rename ezqdnmq.json to ""cqk.csv"" quickly",7,19,23,32
please rename file uukleo.jpg into logs/bvru.md quickly,19,29,35,47
hey  rename  lfwmcra.docx  as  ieinkg.pdf  quickly,13,25,31,41
hey change filename from v2/kpddt.jpg to lyhkit.png please,25,37,41,51
can  you  rename  uypwaom.docx  as  gktpkdzq.py,18,30,36,47
"so update the name of ""gaxysdcj.csv"" to vctxk.txt please",22,36,40,49
okay rename qpaw.txt to gyquqw.log please,12,20,24,34
"update the name of ""src/ytojebb.pdf"" to ""wlwxwb.log"" please",19,36,40,52
"So update the name of v1/dmuvaf.jpg to ""v1/yzvi.csv"" for me",22,35,39,52
hey i want to rename cckmcw.docx to fuioet.md,21,32,36,45
"okay  change  filename  from  zooi.log  to  ""ffll.csv""  please",30,38,44,54
okay  change  backup/lirljpf.json  to  jnxxk.pdf,14,33,39,48
"please  rename  ""ayslwtav.txt""  to  project/aiutfvie.json  for  me",16,30,36,57
"please could you rename src/pawpa.jpg as ""ybcqhh.png"" now",24,37,41,53
hey update the name of new/usxuit.png to ckxq.md please,23,37,41,48
"rename file kwfptl.docx into ""uqkepu.py"" quickly",12,23,29,40
hey update the name of new/ihanzsqn.py to epolu.txt please,23,38,42,51
please update the name of utiwfebj.txt to ifewanf.png quickly,26,38,42,53
hey rename file project/ewhdche.txt into old/yxd.log now,16,35,41,52
"okay could you rename emddlk.md as ""cgjnyvlf.jpg"" please",22,31,35,49
well change filename from ifydlwj.pdf to data/pdwcwse.csv please,26,37,41,57
hey change filename from backup/axfuh.docx to new/noz.py,25,42,46,56
hey rename mkzi.py to new/ambjhobl.pdf please,11,18,22,38
well  change  dufl.log  to  tetcrzo.docx,14,22,28,40
"well update the name of new/twsjhfro.py to ""new/drzyrna.js""",24,39,43,59
"i want to rename ""rhiaubl.png"" to old/jxwpqwvd.log",17,30,34,50
"please could you rename ""tmp/xevrapq.md"" as dtii.py quickly",24,40,44,51
so rename old/yqca.js to logs/wecdrx.js now,10,21,25,39
"please rename ""data/ufvo.log"" as zdpdu.md now",14,29,33,41
please update the name of yprkocr.json to nobpyfik.pdf for me,26,38,42,54
"can you i want to rename ""kuvi.jpg"" to backup/yvgo.log please",25,35,39,54
"can you change filename from backup/bxdykak.jpg to ""ugav.csv""",29,47,51,61
"okay  could  you  rename  ""tmp/hbk.js""  as  oas.png  quickly",26,38,44,51
hey change filename from ojjzk.csv to data/sev.py quickly,25,34,38,49
"okay rename ""mzhnotc.log"" as gaw.csv quickly",12,25,29,36
"please rename ""tnjc.pdf"" as ""ruv.log""",14,24,28,37
"so  change  ""tmp/nrmr.png""  to  old/olor.py  quickly",12,26,32,43
"So  change  filename  from  ""ibiwrg.log""  to  src/tswshj.docx  quickly",28,40,46,61
"hey i want to rename tmp/citjve.log to ""tfmcb.png"" quickly",21,35,39,50
"well change ""nbvvwq.log"" to ""tmp/wmu.log"" quickly",12,24,28,41
rename  oaeqd.json  as  cqrkfom.json  quickly,8,18,24,36
so change filename from project/nim.json to src/gbe.py please,24,40,44,54
"so  rename  ""backup/mjmrk.png""  as  ""dkcdcn.docx""  now",12,30,36,49
"Can you rename src/agcg.js to ""project/jburqckc.txt"" now",15,26,30,52
hey rename logs/eolczx.log to nvunacp.png quickly,11,26,30,41
"Please rename ""tmp/vmfrcwi.json"" as ""v2/qeqlroc.png""",14,32,36,52
well rename qqte.csv to qmtcf.png quickly,12,20,24,33
"so update the name of bpjznrqk.md to ""ffxc.js"" please",22,33,37,46
hey rename lomx.txt as ekdyqfr.txt now,11,19,23,34
update the name of odxzozg.pdf to zlo.pdf quickly,19,30,34,41
please update the name of data/xcapkyj.log to mpku.js,26,42,46,53
hey change filename from project/hmjlayb.pdf to logs/dba.py,25,44,48,59
"well rename file ""project/qku.png"" into old/ezxnnge.js",17,34,40,54
"can you rename ""data/qixukipb.docx"" as xxiktwr.md please",15,35,39,49
"please  i  want  to  rename  ""otoiux.js""  to  jnvt.log  now",29,40,46,54
so rename egdtu.png to lju.js please,10,19,23,29
so  could  you  rename  old/fmiwott.csv  as  logs/mmac.log  quickly,24,39,45,58
okay  rename  cio.docx  to  new/vlnf.md,14,22,28,39
"hey rename ""v1/zhjosor.txt"" as old/qwvz.docx please",11,27,31,44
please  rename  owtpdyja.json  as  ehw.docx  quickly,16,29,35,43
"hey change linxyk.png to ""nobywvnk.log"" for me",11,21,25,39
"rename ""uff.csv"" as ""data/klhpiwo.md"" now",7,16,20,37
okay  i  want  to  rename  zint.log  to  lrkjao.docx  for  me,27,35,41,52
please change filename from v2/ugr.pdf to ugrf.csv now,28,38,42,50
update the name of yrxqnh.json to nqtfjqh.md,19,30,34,44
okay  rename  file  kftehz.pdf  into  new/wywlcpoa.js  now,20,30,38,53
"can you rename file v2/yoh.js into ""xrsznlq.png"" please",20,29,35,48
okay rename backup/ugtiu.jpg to rnkzrzlg.pdf for me,12,28,32,44
"so  could  you  rename  ""bizb.jpg""  as  backup/fhagoavr.json  please",24,34,40,60
"please change filename from v1/eyjycv.docx to ""qmiliwtx.docx"" for me",28,42,46,61
"well update the name of new/qhjxh.csv to ""gtp.txt"" quickly",24,37,41,50
okay rename old/yfvbb.js as backup/mtk.py quickly,12,24,28,41
"please rename ""klan.py"" to tmp/phfzgqbn.md for me",14,23,27,42
"can you change filename from xepfs.pdf to ""awezeo.docx"" now",29,38,42,55
"Please rename old/gyp.json as ""logs/wxlnpmga.json"" quickly",14,26,30,50
"hey  change  logs/sml.txt  to  ""wbc.jpg""  now",13,25,31,40
"well could you rename ""v1/eamf.log"" as lsmmbqbj.jpg please",22,35,39,51
So change filename from src/hilv.csv to qdrp.pdf,24,36,40,48
"please rename file zymiq.log into ""glvfzqw.csv"" for me",19,28,34,47
"can you change filename from ""ouwgh.png"" to ""lbzg.log"" please",29,40,44,54
so rename old/cihgixb.txt to ome.png now,10,25,29,36
update the name of project/nqls.txt to utfziacx.jpg now,19,35,39,51
"please  update  the  name  of  new/femb.docx  to  ""backup/lahth.json""  please",31,44,50,69
please  update  the  name  of  atobrc.png  to  scjqf.txt  quickly,31,41,47,56
"well i want to rename ""backup/ezw.docx"" to asbrwcxy.txt",22,39,43,55
please  rename  cju.txt  as  hhe.pdf  now,16,23,29,36
"okay i want to rename ""data/gzqikw.json"" to tmp/femp.pdf now",22,40,44,56
Hey  rename  file  aylkz.docx  into  old/wqdxza.log,19,29,37,51
"so could you rename ""v1/tbs.jpg"" as fghsfbw.csv quickly",20,32,36,47
okay rename file project/npnzimo.py into zri.pdf for me,17,35,41,48
"Okay change hdn.jpg to ""tfusmc.txt"" quickly",12,19,23,35
hey change filename from kcvoot.json to jffm.py,25,36,40,47
"so update the name of ""project/uhfro.log"" to project/tsu.csv quickly",22,41,45,60
"well rename project/blt.py to ""v2/xhzzxzse.json"" for me",12,26,30,48
okay update the name of bdtnumni.pdf to olhl.log quickly,24,36,40,48
"please update the name of ""clzwrd.log"" to ""btdzmbl.md"" quickly",26,38,42,54
Could  you  rename  tmp/qgtra.csv  as  yfi.py,20,33,39,45
change  smi.png  to  zgafuv.png  quickly,8,15,21,31
well change old/arkfwpc.pdf to tdg.json for me,12,27,31,39
please rename backup/hhtoutp.docx as v1/iahcq.log,14,33,37,49
"please change filename from ""puk.csv"" to new/tqc.csv please",28,37,41,52
can you change filename from logs/dkvihf.py to rptohidu.docx for me,29,43,47,60
"okay rename tmp/osxr.txt to ""nxf.py"" now",12,24,28,36
"please change filename from ""kact.png"" to oet.md for me",28,38,42,48
"can you change ""src/yuqut.log"" to old/dvtc.pdf now",15,30,34,46
Well change fki.md to tmp/vwrcau.json for me,12,18,22,37
"well rename logs/reay.json to ""tmp/hvck.csv"" for me",12,26,30,44
well update the name of logs/eajl.py to v2/hmbrat.py now,24,36,40,52
"rename file ""v1/mpv.py"" into new/ngcz.png now",12,23,29,41
please  i  want  to  rename  podj.log  to  njv.png,29,37,43,50
please change filename from project/hlc.json to rvcckcq.png,28,44,48,59
rename  tmp/sjagabvv.txt  as  backup/bkvh.js  quickly,8,24,30,44
hey rename new/wwgmz.md as xqvngna.docx for me,11,23,27,39
"well update the name of ""trurwbc.md"" to v2/adnzqkrr.pdf",24,36,40,55
"so change filename from ""efr.docx"" to ""wkaifri.py"" quickly",24,34,38,50
"rename file logs/qldgvsw.log into ""old/uyl.js"" please",12,28,34,46
"well i want to rename ""v2/lzbw.txt"" to jhdds.log now",22,35,39,48
please update the name of new/leb.jpg to bjm.md for me,26,37,41,47
"please could you rename ""new/olhjlbrt.py"" as wfrvre.jpg now",24,41,45,55
hey rename zztprkb.csv as hgoez.txt please,11,22,26,35
"okay rename ""dzlbshd.jpg"" as kbycedfc.py quickly",12,25,29,40
okay change src/emecm.py to v2/mjdhabls.csv quickly,12,24,28,43
"please change filename from jhsless.log to ""crdb.js"" quickly",28,39,43,52
"can you i want to rename ""data/xgdx.log"" to iyimhy.png now",25,40,44,54
hey could you rename bhvfoqn.csv as jbzthyxo.pdf for me,21,32,36,48
okay i want to rename txdvsdxy.csv to vnhaipr.json,22,34,38,50
"So  change  filename  from  xys.md  to  ""cuk.py""",28,34,40,48
so i want to rename tmp/yfgy.js to eazwe.png now,20,31,35,44
okay rename file tekcnmki.docx into kygzcfau.py quickly,17,30,36,47
"well  change  jsdrbptt.csv  to  ""xkdlmx.js""  quickly",14,26,32,43
please could you rename src/ktagztf.png as gzxdtim.txt for me,24,39,43,54
so  rename  file  v2/qlegpoo.log  into  src/qndr.json,18,32,40,53
well rename jwncaeww.pdf to ictsplz.docx quickly,12,24,28,40
update  the  name  of  vtwea.txt  to  old/xaqhyvir.txt  now,23,32,38,54
"okay  could  you  rename  ""mbzz.jpg""  as  backup/gfqa.py  quickly",26,36,42,56
"can you rename file ufb.csv into ""bfczka.py"" please",20,27,33,44
hey change filename from rzr.md to old/vjpc.png quickly,25,31,35,47
"please update the name of lwdsiejj.pdf to ""v2/uatnuuc.py"" now",26,38,42,57
"please  i  want  to  rename  gqv.docx  to  ""src/lctl.py""  quickly",29,37,43,56
"hey rename ""oaacr.log"" as fzfh.json quickly",11,22,26,35
well change filename from iizqxogb.csv to yctes.txt quickly,26,38,42,51
can you update the name of othnv.docx to cmlixh.log please,27,37,41,51
"please i want to rename ""v1/qvrw.txt"" to logs/upo.csv now",24,37,41,53
"please rename ""v1/jjwrwly.png"" as ghq.json for me",14,30,34,42
well rename v1/qvzgflyh.csv to logs/bfx.md,12,27,31,42
please  rename  file  oebmsfay.docx  into  ehaxwjob.docx  for  me,22,35,43,56
hey change logs/mdc.jpg to v2/gjk.json please,11,23,27,38
so change new/rcm.log to rpjmop.pdf quickly,10,21,25,35
"well could you rename ""cstdpni.md"" as v1/qnrda.json please",22,34,38,51
"please rename v2/koovz.docx to ""src/ihuibrk.csv"" now",14,27,31,48
well update the name of src/jqikii.json to etevv.csv,24,39,43,52
"rename file ""zizy.md"" into tmp/mulwz.txt",12,21,27,40
"so rename file ""tkpzqp.txt"" into kgmkxakj.jpg now",15,27,33,45
please change ucai.png to dgfxuu.txt now,14,22,26,36
"Please rename ""ldn.png"" to ""cci.json""",14,23,27,37
"well rename v1/pflzkipd.png as ""aafmupu.jpg"" please",12,27,31,44
please  rename  file  cocotvob.jpg  into  zsl.txt  quickly,22,34,42,49
"i want to rename qhnt.txt to ""logs/kmdrpluh.png"" for me",17,25,29,48
"please change filename from ""v2/zanirhj.docx"" to ""zxg.pdf""",28,45,49,58
Rename  xmqusubu.json  as  data/egfvj.log  quickly,8,21,27,41
update the name of fevi.log to bgpvjtv.log for me,19,27,31,42
can  you  update  the  name  of  data/idpfcz.js  to  bqnyz.md  now,33,47,53,61
change filename from tmp/vpws.py to v1/rqj.log please,21,32,36,46
"okay rename v2/qorh.pdf to ""jantzh.txt""",12,23,27,39
"rename v2/qkb.png to ""giudir.txt""",7,17,21,33
hey change filename from v2/nlexknwx.docx to data/swayob.jpg for me,25,41,45,60
"change ""zer.log"" to v2/dhmxb.json please",7,16,20,33
can you i want to rename mxo.png to backup/ogtiae.log,25,32,36,53
"so could you rename kxiaknj.docx as ""project/zhtwmx.csv"" now",20,32,36,56
hey could you rename qkweeur.jpg as mhwnq.pdf please,21,32,36,45
"can  you  update  the  name  of  v2/mmwdrzl.json  to  ""uwpvfy.jpg""  now",33,48,54,66
"okay update the name of ""qxwftg.json"" to ""wfrm.png"" for me",24,37,41,51
"so i want to rename ""tmp/lmqvuynr.txt"" to mhytfbrn.pdf for me",20,38,42,54
"hey could you rename ""pmktzmj.png"" as svu.docx for me",21,34,38,46
please  change  vewkio.py  to  ksounhq.png  please,16,25,31,42
so  rename  file  src/xpv.txt  into  tiagmamj.log  now,18,29,37,49
"Can you change ""backup/krth.jpg"" to jsowa.log quickly",15,32,36,45
so change xaderggf.md to project/adsyfjs.js quickly,10,21,25,43
"can you update the name of ""tojuxmo.json"" to src/fdvjvyl.py for me",27,41,45,59
"so  change  ""hszgaof.jpg""  to  logs/tpvs.js  quickly",12,25,31,43
please change data/wvbcsuk.csv to msutlp.md,14,30,34,43
"rename  ""logs/djj.png""  as  ""old/tfjp.csv""",8,22,28,42
rename file data/adgwthal.md into lom.png please,12,28,34,41
"Please rename file ""qzmwmu.md"" into qcnfa.pdf",19,30,36,45
so update the name of cahofxwg.js to data/skd.py please,22,33,37,48
"please rename ""old/zlkt.jpg"" as acy.txt quickly",14,28,32,39
Rename mwung.txt to new/fvxnn.json please,7,16,20,34
so change uvxyeul.csv to tmp/gvkjddol.py please,10,21,25,40
"well could you rename ""nlbjj.js"" as rwylkda.log please",22,32,36,47
hey  rename  file  lauoz.txt  into  usrt.pdf  quickly,19,28,36,44
"can you i want to rename new/avegx.png to ""jdowxg.json"" please",25,38,42,55
Can  you  could  you  rename  hso.json  as  caoa.csv  for  me,30,38,44,52
okay  i  want  to  rename  aakfbi.jpg  to  jnxz.csv  quickly,27,37,43,51
"So rename ""old/kretneq.txt"" to ""src/wcp.js"" quickly",10,27,31,43
can you change qvs.md to data/kdsbe.jpg quickly,15,21,25,39
"can you update the name of ""bnkprm.txt"" to flczqxos.py for me",27,39,43,54
"i want to rename ezgy.js to ""new/sukjm.log"" now",17,24,28,43
"well could you rename ""tmp/pdojedi.json"" as ""lrmdtqyf.pdf"" now",22,40,44,58
well rename mjo.pdf as backup/olxe.png quickly,12,19,23,38
"okay i want to rename eljy.md to ""tmp/witzlbqh.json"" now",22,29,33,52
"please rename ""project/dduaw.pdf"" to data/ngxhpf.log for me",14,33,37,52
"so rename sgmi.txt to ""old/oyh.csv"" for me",10,18,22,35
so i want to rename logs/hztdbcnt.csv to tmp/qukw.log for me,20,37,41,53
"Can  you  rename  file  cdmaekht.pdf  into  ""cma.py""",24,36,44,52
"so rename ""gucias.jpg"" to wsxkvpp.md for me",10,22,26,36
can you change filename from pfkq.png to uyettyu.js now,29,37,41,51
"so update the name of dserahg.png to ""v1/fdmevi.csv"" quickly",22,33,37,52
"hey rename file ""logs/wlaxeih.pdf"" into ""gjwd.json"" quickly",16,34,40,51
please  rename  data/hxgubdu.docx  to  v2/ewlhdk.jpg  for  me,16,33,39,52
"can you could you rename ""eaowdhfi.js"" as ""v1/uqitgnew.log""",25,38,42,59
well update the name of vmla.csv to backup/syrr.docx,24,32,36,52
"can you rename backup/dgfzeir.csv to ""xtkeyh.log""",15,33,37,49
update the name of old/ivqharex.md to ctmaph.jpg now,19,34,38,48
Please i want to rename logs/zvskpekv.docx to drgfgs.json quickly,24,42,46,57
"So  rename  new/zhm.png  to  ""old/jgwpors.csv""  now",12,23,29,46
okay could you rename src/wkboxphn.py as v1/yhalfi.txt please,22,37,41,54
"well could you rename ""rgparex.docx"" as logs/znm.docx please",22,36,40,53
"i want to rename ""v1/bwvxpjwq.docx"" to hnkldft.md for me",17,35,39,49
so rename project/ayvljb.jpg to uckfhzmx.log please,10,28,32,44
"so change filename from project/exnna.txt to ""v1/bqkk.md"" now",24,41,45,57
okay  rename  ljmo.js  as  jhlrdb.docx,14,21,27,38
please rename vqakmb.py as xzvonex.py,14,23,27,37
hey change pzzou.png to rdmp.txt,11,20,24,32
"so change v1/dwfu.jpg to ""ilhjermm.jpg""",10,21,25,39
"please rename file ""ymqma.docx"" into sgflwc.js quickly",19,31,37,46
"well  rename  file  lnfmmph.png  into  ""dlv.md""  quickly",20,31,39,47
"please  i  want  to  rename  ""backup/wwpb.png""  to  mvxetcr.json  for  me",29,46,52,64
"please change ""zoodmlwp.py"" to project/ntqfiq.pdf",14,27,31,49
"so could you rename v2/mpur.log as ""ppcoprpm.pdf""",20,31,35,49
so i want to rename gtspb.docx to wzt.py quickly,20,30,34,40
rename qgtmysu.md as v2/yckthzz.csv now,7,17,21,35
"rename ""backup/qdtpoa.png"" as opwqe.json",7,26,30,40
please rename ktbhe.docx to qwrmai.docx,14,24,28,39
"well i want to rename ""src/jpzlykn.md"" to ""cyxzp.csv"" quickly",22,38,42,53
please rename ejslwd.md to old/bczfgcvp.py quickly,14,23,27,42
okay could you rename jhdy.pdf as zbpqxow.py now,22,30,34,44
okay i want to rename bbqa.pdf to backup/raqovcs.docx,22,30,34,53
so  i  want  to  rename  v1/xixytj.js  to  dia.json  please,25,37,43,51
"please  update  the  name  of  v1/xjeqrk.jpg  to  ""kyhkdtz.json""  now",31,44,50,64
"so could you rename ""abj.txt"" as ""hhh.json"" for me",20,29,33,43
please update the name of qhajc.md to xjrzb.md for me,26,34,38,46
"update the name of ""old/scbn.txt"" to ltca.json",19,33,37,46
So rename logs/wszklwot.js to anoogcz.js now,10,26,30,40
"Okay i want to rename ""v1/kcyev.py"" to kgyros.py",22,35,39,48
"okay change filename from ""project/gjgufomx.log"" to kaygkus.jpg now",26,48,52,63
hey i want to rename tmp/jidmlqg.jpg to project/rrkiktz.json now,21,36,40,60
please  rename  logs/gpvfecy.json  as  vfnmj.jpg  now,16,33,39,48
"okay rename ""tbs.csv"" to ""keztpga.docx"" now",12,21,25,39
"so  rename  file  v1/sfh.log  into  ""v1/hepxqxqs.pdf""  now",18,28,36,53
well change src/hjd.py to v1/eeurbit.js for me,12,22,26,39
"can you could you rename old/irhbddf.md as ""npme.csv"" for me",25,39,43,53
"hey update the name of ""v1/wzf.py"" to ""cui.md"" please",23,34,38,46
"okay i want to rename ""atluhcw.png"" to hgj.md quickly",22,35,39,45
rename zggrkdjq.csv as old/bnp.log,7,19,23,34
so could you rename backup/xle.py as vtfbpils.docx for me,20,33,37,50
"hey rename ""rehyx.txt"" as src/zcrxdwrz.log quickly",11,22,26,42
well change dujfhmdk.md to dhdgimdy.log please,12,23,27,39
"hey change filename from zkk.log to ""tqdc.log"" now",25,32,36,46
"rename ""hvcqizx.csv"" to ""data/cbnvdyog.js"" please",7,20,24,42
please i want to rename slget.jpg to v2/jsm.txt now,24,33,37,47
"can you rename ""qfzgu.pdf"" as sktylws.docx quickly",15,26,30,42
"okay  rename  file  ""project/tzysm.js""  into  old/pdt.py",20,38,46,56
hey rename file vgjtpmw.js into raef.js please,16,26,32,39
"i want to rename data/eugaq.json to ""jyj.py"" for me",17,32,36,44
rename  file  ymshdq.json  into  jfifib.log  now,14,25,33,43
change filename from logs/fzutbhfz.py to src/qzf.txt,21,37,41,52
"please change ibew.py to ""duwu.js"" quickly",14,21,25,34
so rename src/roxydzc.js as new/xahbbwq.md for me,10,24,28,42
Rename  file  project/xfw.docx  into  project/dvil.csv,14,30,38,54
"can you change lhwtlpi.py to ""etkadbur.docx"" for me",15,25,29,44
"okay rename ggazokk.py as ""jrbbe.md"" quickly",12,22,26,36
well i want to rename v1/syk.log to src/hsexpn.js,22,32,36,49
well change filename from v1/xuwngxf.jpg to jlw.md quickly,26,40,44,50
can you change filename from ipcnwhmb.jpg to tmp/zpa.txt now,29,41,45,56
rename  v1/rtjz.jpg  as  vognyjz.csv  now,8,19,25,36
"Rename ""backup/tnh.json"" to backup/uysnl.txt now",7,24,28,44
Well  rename  file  new/cqdddlm.png  into  v1/bsytic.js  quickly,20,35,43,55
okay  change  filename  from  aeabytj.jpg  to  ikh.pdf  quickly,30,41,47,54
"hey change filename from ""logs/mgywapm.jpg"" to ""nrkirwi.png"" for me",25,43,47,60
"okay could you rename ""ktolezw.js"" as ""project/tykz.py"" for me",22,34,38,55
"can you update the name of ""pof.pdf"" to kyjvmi.md",27,36,40,49
well rename hbpwwqd.png as dcyfn.pdf now,12,23,27,36
update the name of eecl.jpg to rdxwgs.png quickly,19,27,31,41
"can you rename file ""nmual.pdf"" into ""dvhvm.md"" quickly",20,31,37,47
"so change ""logs/nuxxmdvm.txt"" to uvomyjrm.json",10,29,33,46
can you rename lbsr.py to new/hkuhxek.pdf quickly,15,22,26,41
well  change  filename  from  lcl.jpg  to  tmp/und.csv  now,30,37,43,54
"hey change nshx.log to ""ddh.pdf""",11,19,23,32
okay i want to rename jutrtkum.py to fippq.md for me,22,33,37,45
"hey rename rjjcdtyu.json to ""pbco.py"" quickly",11,24,28,37
"could you rename ""uerpu.docx"" as hbbzc.py now",17,29,33,41
"Can you change filename from ""dnsiirh.js"" to v2/yqojem.txt for me",29,41,45,58
update the name of iwldp.log to ldpsync.json quickly,19,28,32,44
"well i want to rename ""data/qspf.log"" to exdodg.txt now",22,37,41,51
"i want to rename ""backup/nvezt.csv"" to yvfjz.csv for me",17,35,39,48
well  update  the  name  of  yrxrs.png  to  project/pymgjwqc.json  please,29,38,44,65
hey  rename  backup/gfp.png  to  backup/sgxnma.png  now,13,27,33,50
"well change filename from logs/whz.json to ""ichq.jpg""",26,39,43,53
please rename logs/soyeewk.json to kzmoorc.pdf for me,14,31,35,46
"hey  could  you  rename  ""old/fxnjnkp.js""  as  wen.csv  please",25,41,47,54
"so i want to rename ""v1/odeaxl.py"" to goefu.json please",20,34,38,48
i want to rename tmp/ozb.log to isyqsjd.docx,17,28,32,44
"hey change ""pkmjsv.md"" to ""fwdwb.md""",11,22,26,36
"well rename file backup/gyps.docx into ""backup/fqovey.png"" now",17,33,39,58
okay update the name of ivrfhj.py to v2/erm.png please,24,33,37,47
well change mecq.csv to mjqvagf.js now,12,20,24,34
"hey  change  filename  from  ""hcmcxrl.jpg""  to  backup/jhqgbgrk.jpg",29,42,48,67
Well rename vxp.py to qup.txt,12,18,22,29
okay rename bctqhus.json to imqlrr.md,12,24,28,37
can you i want to rename hlq.js to fht.md please,25,31,35,41
"well  change  filename  from  ""mpaib.pdf""  to  rjjl.docx  for  me",30,41,47,56
"well change filename from ""data/loogetey.log"" to data/ddjwjbwt.md please",26,45,49,65
"hey change hjdpdbu.txt to ""src/cbfiw.csv""",11,22,26,41
